benchmarks/SaturnOPU/model_dispatch_decomposition.csv
model_key,model,idx,symbol,source_file,include_in_model,layer_id,op_kind,segment,opu_path,ops,opu_ops,compute_pct,shape,M,N,K,B,vopacc,opmvinbcast,opu_fetch,rvv_reduction,rvv_sqrt,rvv_gather,tile_m,tile_n,tile_k,tiling_tier,evidence
mlp,MLP,-1,_encoding_0_encode_32x10xi8_to_32x10xi8,build/compiled_models/mlp/saturn_opu_OPU_mlp.q.int8/sources/module__encoding_0.mlir,0,auxiliary,data_movement,data_movement,data_movement,0,0,0.00000000,32x10,,,,,0,0,0,0,0,0,,,,none,
mlp,MLP,-1,_encoding_1_encode_32xf32_to_32xf32,build/compiled_models/mlp/saturn_opu_OPU_mlp.q.int8/sources/module__encoding_1.mlir,0,auxiliary,data_movement,data_movement,data_movement,0,0,0.00000000,,,,,,0,0,0,0,0,0,,,,none,
mlp,MLP,-1,_encoding_2_encode_32x32xi8_to_32x32xi8,build/compiled_models/mlp/saturn_opu_OPU_mlp.q.int8/sources/module__encoding_2.mlir,0,auxiliary,data_movement,data_movement,data_movement,0,0,0.00000000,32x32,,,,,0,0,0,0,0,0,,,,none,
mlp,MLP,-1,_encoding_3_encode_2x32xi8_to_2x32xi8,build/compiled_models/mlp/saturn_opu_OPU_mlp.q.int8/sources/module__encoding_3.mlir,0,auxiliary,data_movement,data_movement,data_movement,0,0,0.00000000,2x32,,,,,0,0,0,0,0,0,,,,none,
mlp,MLP,-1,_encoding_4_encode_2xf32_to_2xf32,build/compiled_models/mlp/saturn_opu_OPU_mlp.q.int8/sources/module__encoding_4.mlir,0,auxiliary,data_movement,data_movement,data_movement,0,0,0.00000000,,,,,,0,0,0,0,0,0,,,,none,
mlp,MLP,0,mlp$async_dispatch_0_elementwise_10_f32xi8,build/compiled_models/mlp/saturn_opu_OPU_mlp.q.int8/sources/module_mlp$async_dispatch_0.mlir,1,elementwise:dispatch_0,elementwise,elementwise_other,elementwise_other,10,0,0.35360679,10,,,,,0,0,0,0,0,0,,,,none,
mlp,MLP,1,mlp$async_dispatch_1_matvec_like_32x10_i8xi8xi32,build/compiled_models/mlp/saturn_opu_OPU_mlp.q.int8/sources/module_mlp$async_dispatch_1.mlir,1,matvec:dispatch_1,matvec,runtime_narrow_tile,runtime_mmt4d_opu,640,640,22.63083451,1x32x10,1,32,10,,1,4,1,0,0,0,1,16,1,1x16x1,llvm:iree_uk_mmt4d;asm:vopacc=1;tile=1x16x1
mlp,MLP,2,mlp$async_dispatch_2_matvec_like_32x32_i8xi8xi32,build/compiled_models/mlp/saturn_opu_OPU_mlp.q.int8/sources/module_mlp$async_dispatch_2.mlir,1,matvec:dispatch_2,matvec,runtime_narrow_tile,runtime_mmt4d_opu,2048,2048,72.41867044,1x32x32,1,32,32,,1,4,1,0,0,0,1,16,1,1x16x1,llvm:iree_uk_mmt4d;asm:vopacc=1;tile=1x16x1
mlp,MLP,3,mlp$async_dispatch_3_matvec_like_2x32_i8xi8xi32,build/compiled_models/mlp/saturn_opu_OPU_mlp.q.int8/sources/module_mlp$async_dispatch_3.mlir,1,matvec:dispatch_3,matvec,runtime_narrow_tile,runtime_mmt4d_opu,128,128,4.52616690,1x2x32,1,2,32,,1,4,1,0,0,0,1,16,1,1x16x1,llvm:iree_uk_mmt4d;asm:vopacc=1;tile=1x16x1
mlp,MLP,4,mlp$async_dispatch_4_elementwise_2_i8xf32,build/compiled_models/mlp/saturn_opu_OPU_mlp.q.int8/sources/module_mlp$async_dispatch_4.mlir,1,elementwise:dispatch_4,elementwise,elementwise_other,elementwise_other,2,0,0.07072136,2,,,,,0,0,0,0,0,0,,,,none,
opu_bench_large_mlp,Large MLP,-1,_encoding_0_encode_2048x512xi8_to_2048x512xi8,build/compiled_models/opu_bench_suite/saturn_opu_OPU_opu_bench_large_mlp.q.int8/sources/module__encoding_0.mlir,0,auxiliary,data_movement,data_movement,data_movement,0,0,0.00000000,2048x512,,,,,0,0,0,0,0,0,,,,none,
opu_bench_large_mlp,Large MLP,-1,_encoding_1_encode_2048xf32_to_2048xf32,build/compiled_models/opu_bench_suite/saturn_opu_OPU_opu_bench_large_mlp.q.int8/sources/module__encoding_1.mlir,0,auxiliary,data_movement,data_movement,data_movement,0,0,0.00000000,,,,,,0,0,0,0,0,0,,,,none,
opu_bench_large_mlp,Large MLP,-1,_encoding_2_encode_2048x2048xi8_to_2048x2048xi8,build/compiled_models/opu_bench_suite/saturn_opu_OPU_opu_bench_large_mlp.q.int8/sources/module__encoding_2.mlir,0,auxiliary,data_movement,data_movement,data_movement,0,0,0.00000000,2048x2048,,,,,0,0,0,0,0,0,,,,none,
opu_bench_large_mlp,Large MLP,-1,_encoding_3_encode_128x2048xi8_to_128x2048xi8,build/compiled_models/opu_bench_suite/saturn_opu_OPU_opu_bench_large_mlp.q.int8/sources/module__encoding_3.mlir,0,auxiliary,data_movement,data_movement,data_movement,0,0,0.00000000,128x2048,,,,,0,0,0,0,0,0,,,,none,
opu_bench_large_mlp,Large MLP,-1,_encoding_4_encode_128xf32_to_128xf32,build/compiled_models/opu_bench_suite/saturn_opu_OPU_opu_bench_large_mlp.q.int8/sources/module__encoding_4.mlir,0,auxiliary,data_movement,data_movement,data_movement,0,0,0.00000000,,,,,,0,0,0,0,0,0,,,,none,
opu_bench_large_mlp,Large MLP,0,main_graph$async_dispatch_0_elementwise_65536_f32xi8,build/compiled_models/opu_bench_suite/saturn_opu_OPU_opu_bench_large_mlp.q.int8/sources/module_main_graph$async_dispatch_0.mlir,1,elementwise:dispatch_0,elementwise,elementwise_other,elementwise_other,65536,0,0.00263927,65536,,,,,0,0,0,0,0,0,,,,none,
opu_bench_large_mlp,Large MLP,1,main_graph$async_dispatch_1_matmul_like_128x2048x512_i8xi8xi32,build/compiled_models/opu_bench_suite/saturn_opu_OPU_opu_bench_large_mlp.q.int8/sources/module_main_graph$async_dispatch_1.mlir,1,matmul:dispatch_1,matmul,encoding_16x16_tile,encoding_resolver,268435456,268435456,10.81045415,128x2048x512,128,2048,512,,1,4,1,0,0,0,16,16,1,16x16x1,llvm:iree_uk_opu_matmul;asm:vopacc=1;tile=16x16x1
opu_bench_large_mlp,Large MLP,2,main_graph$async_dispatch_2_matmul_like_128x2048x2048_i8xi8xi32,build/compiled_models/opu_bench_suite/saturn_opu_OPU_opu_bench_large_mlp.q.int8/sources/module_main_graph$async_dispatch_2.mlir,1,matmul:dispatch_2,matmul,encoding_16x16_tile,encoding_resolver,1073741824,1073741824,43.24181661,128x2048x2048,128,2048,2048,,1,4,1,0,0,0,16,16,1,16x16x1,llvm:iree_uk_opu_matmul;asm:vopacc=1;tile=16x16x1
opu_bench_large_mlp,Large MLP,3,main_graph$async_dispatch_3_matmul_like_128x2048x2048_i8xi8xi32,build/compiled_models/opu_bench_suite/saturn_opu_OPU_opu_bench_large_mlp.q.int8/sources/module_main_graph$async_dispatch_3.mlir,1,matmul:dispatch_3,matmul,encoding_16x16_tile,encoding_resolver,1073741824,1073741824,43.24181661,128x2048x2048,128,2048,2048,,1,4,1,0,0,0,16,16,1,16x16x1,llvm:iree_uk_opu_matmul;asm:vopacc=1;tile=16x16x1
opu_bench_large_mlp,Large MLP,4,main_graph$async_dispatch_4_matmul_like_128x128x2048_i8xi8xi32,build/compiled_models/opu_bench_suite/saturn_opu_OPU_opu_bench_large_mlp.q.int8/sources/module_main_graph$async_dispatch_4.mlir,1,matmul:dispatch_4,matmul,encoding_16x16_tile,encoding_resolver,67108864,67108864,2.70261354,128x128x2048,128,128,2048,,1,4,1,0,0,0,16,16,1,16x16x1,llvm:iree_uk_opu_matmul;asm:vopacc=1;tile=16x16x1
opu_bench_large_mlp,Large MLP,5,main_graph$async_dispatch_5_elementwise_16384_i8xf32,build/compiled_models/opu_bench_suite/saturn_opu_OPU_opu_bench_large_mlp.q.int8/sources/module_main_graph$async_dispatch_5.mlir,1,elementwise:dispatch_5,elementwise,elementwise_other,elementwise_other,16384,0,0.00065982,16384,,,,,0,0,0,0,0,0,,,,none,
opu_bench_vit_small,ViT-Small,-1,_encoding_0_encode_128x128xi8_to_128x128xi8,build/compiled_models/opu_bench_suite/saturn_opu_OPU_opu_bench_vit_small.q.int8/sources/module__encoding_0.mlir,0,auxiliary,data_movement,data_movement,data_movement,0,0,0.00000000,128x128,,,,,0,0,0,0,0,0,,,,none,
opu_bench_vit_small,ViT-Small,-1,_encoding_1_encode_128xf32_to_128xf32,build/compiled_models/opu_bench_suite/saturn_opu_OPU_opu_bench_vit_small.q.int8/sources/module__encoding_1.mlir,0,auxiliary,data_movement,data_movement,data_movement,0,0,0.00000000,,,,,,0,0,0,0,0,0,,,,none,
opu_bench_vit_small,ViT-Small,-1,_encoding_2_encode_128x512xi8_to_128x512xi8,build/compiled_models/opu_bench_suite/saturn_opu_OPU_opu_bench_vit_small.q.int8/sources/module__encoding_2.mlir,0,auxiliary,data_movement,data_movement,data_movement,0,0,0.00000000,128x512,,,,,0,0,0,0,0,0,,,,none,
opu_bench_vit_small,ViT-Small,-1,_encoding_3_encode_512xi8_to_512xi8,build/compiled_models/opu_bench_suite/saturn_opu_OPU_opu_bench_vit_small.q.int8/sources/module__encoding_3.mlir,0,auxiliary,data_movement,data_movement,data_movement,0,0,0.00000000,,,,,,0,0,0,0,0,0,,,,none,
opu_bench_vit_small,ViT-Small,-1,_encoding_4_encode_512x128xi8_to_512x128xi8,build/compiled_models/opu_bench_suite/saturn_opu_OPU_opu_bench_vit_small.q.int8/sources/module__encoding_4.mlir,0,auxiliary,data_movement,data_movement,data_movement,0,0,0.00000000,512x128,,,,,0,0,0,0,0,0,,,,none,
opu_bench_vit_small,ViT-Small,-1,_encoding_5_encode_128xi8_to_128xi8,build/compiled_models/opu_bench_suite/saturn_opu_OPU_opu_bench_vit_small.q.int8/sources/module__encoding_5.mlir,0,auxiliary,data_movement,data_movement,data_movement,0,0,0.00000000,,,,,,0,0,0,0,0,0,,,,none,
opu_bench_vit_small,ViT-Small,-1,_encoding_6_encode_16x128xi8_to_16x128xi8,build/compiled_models/opu_bench_suite/saturn_opu_OPU_opu_bench_vit_small.q.int8/sources/module__encoding_6.mlir,0,auxiliary,data_movement,data_movement,data_movement,0,0,0.00000000,16x128,,,,,0,0,0,0,0,0,,,,none,
opu_bench_vit_small,ViT-Small,-1,_encoding_7_encode_16xf32_to_16xf32,build/compiled_models/opu_bench_suite/saturn_opu_OPU_opu_bench_vit_small.q.int8/sources/module__encoding_7.mlir,0,auxiliary,data_movement,data_movement,data_movement,0,0,0.00000000,,,,,,0,0,0,0,0,0,,,,none,
opu_bench_vit_small,ViT-Small,-1,_encoding_8_encode_4x64x64xi8_to_4x64x64xi8,build/compiled_models/opu_bench_suite/saturn_opu_OPU_opu_bench_vit_small.q.int8/sources/module__encoding_8.mlir,0,auxiliary,data_movement,data_movement,data_movement,0,0,0.00000000,4x64x64,,,,,0,0,0,0,0,0,,,,none,
opu_bench_vit_small,ViT-Small,-1,_encoding_9_encode_64x128xi8_to_64x128xi8,build/compiled_models/opu_bench_suite/saturn_opu_OPU_opu_bench_vit_small.q.int8/sources/module__encoding_9.mlir,0,auxiliary,data_movement,data_movement,data_movement,0,0,0.00000000,64x128,,,,,0,0,0,0,0,0,,,,none,
opu_bench_vit_small,ViT-Small,0,main_graph$async_dispatch_0_elementwise_8192_f32xi8,build/compiled_models/opu_bench_suite/saturn_opu_OPU_opu_bench_vit_small.q.int8/sources/module_main_graph$async_dispatch_0.mlir,1,elementwise:dispatch_0,elementwise,elementwise_other,elementwise_other,8192,0,0.02144778,8192,,,,,0,0,0,0,0,0,,,,none,
opu_bench_vit_small,ViT-Small,1,main_graph$async_dispatch_1_reduction_64x128_f32,build/compiled_models/opu_bench_suite/saturn_opu_OPU_opu_bench_vit_small.q.int8/sources/module_main_graph$async_dispatch_1.mlir,1,norm_or_softmax:dispatch_1,reduction,rvv_reduction_softmax_norm,rvv_reduction_softmax_norm,8128,0,0.02128022,64x128,,,,,0,0,0,0,0,0,,,,none,
opu_bench_vit_small,ViT-Small,10,main_graph$async_dispatch_10_reduction_64x128_f32,build/compiled_models/opu_bench_suite/saturn_opu_OPU_opu_bench_vit_small.q.int8/sources/module_main_graph$async_dispatch_10.mlir,1,norm_or_softmax:dispatch_10,reduction,rvv_reduction_softmax_norm,rvv_reduction_softmax_norm,8128,0,0.02128022,64x128,,,,,0,0,0,0,0,0,,,,none,
opu_bench_vit_small,ViT-Small,11,main_graph$async_dispatch_11_matmul_like_64x512x128_i8xi8xi32,build/compiled_models/opu_bench_suite/saturn_opu_OPU_opu_bench_vit_small.q.int8/sources/module_main_graph$async_dispatch_11.mlir,1,projection_or_ffn:dispatch_11,matmul,encoding_16x16_tile,encoding_resolver,8388608,8388608,21.96253089,64x512x128,64,512,128,,1,4,1,0,0,0,16,16,1,16x16x1,llvm:iree_uk_opu_matmul;asm:vopacc=1;tile=16x16x1
opu_bench_vit_small,ViT-Small,12,main_graph$async_dispatch_12_matmul_like_64x128x512_i8xi8xi32,build/compiled_models/opu_bench_suite/saturn_opu_OPU_opu_bench_vit_small.q.int8/sources/module_main_graph$async_dispatch_12.mlir,1,projection_or_ffn:dispatch_12,matmul,encoding_16x16_tile,encoding_resolver,8388608,8388608,21.96253089,64x128x512,64,128,512,,1,4,1,0,0,0,16,16,1,16x16x1,llvm:iree_uk_opu_matmul;asm:vopacc=1;tile=16x16x1
opu_bench_vit_small,ViT-Small,13,main_graph$async_dispatch_13_reduction_64x128_f32,build/compiled_models/opu_bench_suite/saturn_opu_OPU_opu_bench_vit_small.q.int8/sources/module_main_graph$async_dispatch_13.mlir,1,norm_or_softmax:dispatch_13,reduction,rvv_reduction_softmax_norm,rvv_reduction_softmax_norm,8128,0,0.02128022,64x128,,,,,0,0,0,0,0,0,,,,none,
opu_bench_vit_small,ViT-Small,14,main_graph$async_dispatch_14_matmul_like_3x64x128x128_i8xi8xi32,build/compiled_models/opu_bench_suite/saturn_opu_OPU_opu_bench_vit_small.q.int8/sources/module_main_graph$async_dispatch_14.mlir,1,projection_or_ffn:dispatch_14,matmul,rvv_matmul,rvv_matmul,49152,0,0.12868670,3x64x128,3,64,128,,0,0,0,0,0,8,,,,none,asm:vrgather=8
opu_bench_vit_small,ViT-Small,16,main_graph$async_dispatch_16_elementwise_broadcast_8192_f32xi8,build/compiled_models/opu_bench_suite/saturn_opu_OPU_opu_bench_vit_small.q.int8/sources/module_main_graph$async_dispatch_16.mlir,1,elementwise:dispatch_16,elementwise,elementwise_other,elementwise_other,8192,0,0.02144778,8192,,,,,0,0,0,0,0,0,,,,none,
opu_bench_vit_small,ViT-Small,17,main_graph$async_dispatch_17_elementwise_broadcast_8192_f32xi8,build/compiled_models/opu_bench_suite/saturn_opu_OPU_opu_bench_vit_small.q.int8/sources/module_main_graph$async_dispatch_17.mlir,1,elementwise:dispatch_17,elementwise,elementwise_other,elementwise_other,8192,0,0.02144778,8192,,,,,0,0,0,0,0,0,,,,none,
opu_bench_vit_small,ViT-Small,18,main_graph$async_dispatch_18_matmul_like_4x64x64x32_i8xi8xi32,build/compiled_models/opu_bench_suite/saturn_opu_OPU_opu_bench_vit_small.q.int8/sources/module_main_graph$async_dispatch_18.mlir,1,projection_or_ffn:dispatch_18,matmul,runtime_narrow_tile,runtime_mmt4d_opu,32768,32768,0.08579114,4x64x64,4,64,64,,4,4,4,0,0,0,32,32,1,32x32x1,llvm:iree_uk_mmt4d;asm:vopacc=4;tile=32x32x1
opu_bench_vit_small,ViT-Small,19,main_graph$async_dispatch_19_softmax_4x64x64xf32_generic,build/compiled_models/opu_bench_suite/saturn_opu_OPU_opu_bench_vit_small.q.int8/sources/module_main_graph$async_dispatch_19.mlir,1,attention_softmax:dispatch_19,softmax,rvv_reduction_softmax_norm,rvv_reduction_softmax_norm,81920,0,0.21447784,4x64x64,,,,,0,0,0,0,0,0,,,,none,
opu_bench_vit_small,ViT-Small,2,main_graph$async_dispatch_2_matmul_like_3x64x128x128_i8xi8xi32,build/compiled_models/opu_bench_suite/saturn_opu_OPU_opu_bench_vit_small.q.int8/sources/module_main_graph$async_dispatch_2.mlir,1,projection_or_ffn:dispatch_2,matmul,rvv_matmul,rvv_matmul,49152,0,0.12868670,3x64x128,3,64,128,,0,0,0,0,0,8,,,,none,asm:vrgather=8
opu_bench_vit_small,ViT-Small,20,main_graph$async_dispatch_20_matmul_like_64x4x32x64_i8xi8xi32,build/compiled_models/opu_bench_suite/saturn_opu_OPU_opu_bench_vit_small.q.int8/sources/module_main_graph$async_dispatch_20.mlir,1,projection_or_ffn:dispatch_20,matmul,runtime_narrow_tile,runtime_mmt4d_opu,16384,16384,0.04289557,64x4x32,64,4,32,,4,4,4,0,0,0,32,32,1,32x32x1,llvm:iree_uk_mmt4d;asm:vopacc=4;tile=32x32x1
opu_bench_vit_small,ViT-Small,21,main_graph$async_dispatch_21_matmul_like_64x128x128_i8xi8xi32,build/compiled_models/opu_bench_suite/saturn_opu_OPU_opu_bench_vit_small.q.int8/sources/module_main_graph$async_dispatch_21.mlir,1,projection_or_ffn:dispatch_21,matmul,encoding_16x16_tile,encoding_resolver,2097152,2097152,5.49063272,64x128x128,64,128,128,,1,4,1,0,0,0,16,16,1,16x16x1,llvm:iree_uk_opu_matmul;asm:vopacc=1;tile=16x16x1
opu_bench_vit_small,ViT-Small,22,main_graph$async_dispatch_22_reduction_64x128_f32,build/compiled_models/opu_bench_suite/saturn_opu_OPU_opu_bench_vit_small.q.int8/sources/module_main_graph$async_dispatch_22.mlir,1,norm_or_softmax:dispatch_22,reduction,rvv_reduction_softmax_norm,rvv_reduction_softmax_norm,8128,0,0.02128022,64x128,,,,,0,0,0,0,0,0,,,,none,
opu_bench_vit_small,ViT-Small,23,main_graph$async_dispatch_23_matmul_like_64x512x128_i8xi8xi32,build/compiled_models/opu_bench_suite/saturn_opu_OPU_opu_bench_vit_small.q.int8/sources/module_main_graph$async_dispatch_23.mlir,1,projection_or_ffn:dispatch_23,matmul,encoding_16x16_tile,encoding_resolver,8388608,8388608,21.96253089,64x512x128,64,512,128,,1,4,1,0,0,0,16,16,1,16x16x1,llvm:iree_uk_opu_matmul;asm:vopacc=1;tile=16x16x1
opu_bench_vit_small,ViT-Small,24,main_graph$async_dispatch_24_matmul_like_64x128x512_i8xi8xi32,build/compiled_models/opu_bench_suite/saturn_opu_OPU_opu_bench_vit_small.q.int8/sources/module_main_graph$async_dispatch_24.mlir,1,projection_or_ffn:dispatch_24,matmul,encoding_16x16_tile,encoding_resolver,8388608,8388608,21.96253089,64x128x512,64,128,512,,1,4,1,0,0,0,16,16,1,16x16x1,llvm:iree_uk_opu_matmul;asm:vopacc=1;tile=16x16x1
opu_bench_vit_small,ViT-Small,25,main_graph$async_dispatch_25_elementwise_broadcast_128_i8,build/compiled_models/opu_bench_suite/saturn_opu_OPU_opu_bench_vit_small.q.int8/sources/module_main_graph$async_dispatch_25.mlir,1,elementwise:dispatch_25,elementwise,elementwise_other,elementwise_other,128,0,0.00033512,128,,,,,0,0,0,0,0,0,,,,none,
opu_bench_vit_small,ViT-Small,26,main_graph$async_dispatch_26_matvec_like_16x128_i8xi8xi32,build/compiled_models/opu_bench_suite/saturn_opu_OPU_opu_bench_vit_small.q.int8/sources/module_main_graph$async_dispatch_26.mlir,1,projection_or_ffn:dispatch_26,matvec,runtime_narrow_tile,runtime_mmt4d_opu,4096,4096,0.01072389,1x16x128,1,16,128,,1,4,1,0,0,0,1,16,1,1x16x1,llvm:iree_uk_mmt4d;asm:vopacc=1;tile=1x16x1
opu_bench_vit_small,ViT-Small,27,main_graph$async_dispatch_27_elementwise_16_i8xf32,build/compiled_models/opu_bench_suite/saturn_opu_OPU_opu_bench_vit_small.q.int8/sources/module_main_graph$async_dispatch_27.mlir,1,elementwise:dispatch_27,elementwise,elementwise_other,elementwise_other,16,0,0.00004189,16,,,,,0,0,0,0,0,0,,,,none,
opu_bench_vit_small,ViT-Small,3,main_graph$async_dispatch_3_elementwise_broadcast_8192_i8,build/compiled_models/opu_bench_suite/saturn_opu_OPU_opu_bench_vit_small.q.int8/sources/module_main_graph$async_dispatch_3.mlir,1,elementwise:dispatch_3,elementwise,elementwise_other,elementwise_other,8192,0,0.02144778,8192,,,,,0,0,0,0,0,0,,,,none,
opu_bench_vit_small,ViT-Small,4,main_graph$async_dispatch_4_elementwise_broadcast_8192_f32xi8,build/compiled_models/opu_bench_suite/saturn_opu_OPU_opu_bench_vit_small.q.int8/sources/module_main_graph$async_dispatch_4.mlir,1,elementwise:dispatch_4,elementwise,elementwise_other,elementwise_other,8192,0,0.02144778,8192,,,,,0,0,0,0,0,0,,,,none,
opu_bench_vit_small,ViT-Small,5,main_graph$async_dispatch_5_elementwise_broadcast_8192_f32xi8,build/compiled_models/opu_bench_suite/saturn_opu_OPU_opu_bench_vit_small.q.int8/sources/module_main_graph$async_dispatch_5.mlir,1,elementwise:dispatch_5,elementwise,elementwise_other,elementwise_other,8192,0,0.02144778,8192,,,,,0,0,0,0,0,0,,,,none,
opu_bench_vit_small,ViT-Small,6,main_graph$async_dispatch_6_matmul_like_4x64x64x32_i8xi8xi32,build/compiled_models/opu_bench_suite/saturn_opu_OPU_opu_bench_vit_small.q.int8/sources/module_main_graph$async_dispatch_6.mlir,1,projection_or_ffn:dispatch_6,matmul,runtime_narrow_tile,runtime_mmt4d_opu,32768,32768,0.08579114,4x64x64,4,64,64,,4,4,4,0,0,0,32,32,1,32x32x1,llvm:iree_uk_mmt4d;asm:vopacc=4;tile=32x32x1
opu_bench_vit_small,ViT-Small,7,main_graph$async_dispatch_7_softmax_4x64x64xf32_generic,build/compiled_models/opu_bench_suite/saturn_opu_OPU_opu_bench_vit_small.q.int8/sources/module_main_graph$async_dispatch_7.mlir,1,attention_softmax:dispatch_7,softmax,rvv_reduction_softmax_norm,rvv_reduction_softmax_norm,81920,0,0.21447784,4x64x64,,,,,0,0,0,0,0,0,,,,none,
opu_bench_vit_small,ViT-Small,8,main_graph$async_dispatch_8_matmul_like_64x4x32x64_i8xi8xi32,build/compiled_models/opu_bench_suite/saturn_opu_OPU_opu_bench_vit_small.q.int8/sources/module_main_graph$async_dispatch_8.mlir,1,projection_or_ffn:dispatch_8,matmul,runtime_narrow_tile,runtime_mmt4d_opu,16384,16384,0.04289557,64x4x32,64,4,32,,4,4,4,0,0,0,32,32,1,32x32x1,llvm:iree_uk_mmt4d;asm:vopacc=4;tile=32x32x1
opu_bench_vit_small,ViT-Small,9,main_graph$async_dispatch_9_matmul_like_64x128x128_i8xi8xi32,build/compiled_models/opu_bench_suite/saturn_opu_OPU_opu_bench_vit_small.q.int8/sources/module_main_graph$async_dispatch_9.mlir,1,projection_or_ffn:dispatch_9,matmul,encoding_16x16_tile,encoding_resolver,2097152,2097152,5.49063272,64x128x128,64,128,128,,1,4,1,0,0,0,16,16,1,16x16x1,llvm:iree_uk_opu_matmul;asm:vopacc=1;tile=16x16x1
opu_bench_hybrid,Hybrid CNN+Trf,-1,_encoding_0_encode_128x128xi8_to_128x128xi8,build/compiled_models/opu_bench_suite/saturn_opu_OPU_LLM_opu_bench_hybrid.q.int8/sources/module__encoding_0.mlir,0,auxiliary,data_movement,data_movement,data_movement,0,0,0.00000000,128x128,,,,,0,0,0,0,0,0,,,,none,
opu_bench_hybrid,Hybrid CNN+Trf,-1,_encoding_1_encode_128xf32_to_128xf32,build/compiled_models/opu_bench_suite/saturn_opu_OPU_LLM_opu_bench_hybrid.q.int8/sources/module__encoding_1.mlir,0,auxiliary,data_movement,data_movement,data_movement,0,0,0.00000000,,,,,,0,0,0,0,0,0,,,,none,
opu_bench_hybrid,Hybrid CNN+Trf,-1,_encoding_2_encode_1x128x512xi8_to_1x128x512xi8,build/compiled_models/opu_bench_suite/saturn_opu_OPU_LLM_opu_bench_hybrid.q.int8/sources/module__encoding_2.mlir,0,auxiliary,data_movement,data_movement,data_movement,0,0,0.00000000,1x128x512,,,,,0,0,0,0,0,0,,,,none,
opu_bench_hybrid,Hybrid CNN+Trf,-1,_encoding_3_encode_512xi8_to_512xi8,build/compiled_models/opu_bench_suite/saturn_opu_OPU_LLM_opu_bench_hybrid.q.int8/sources/module__encoding_3.mlir,0,auxiliary,data_movement,data_movement,data_movement,0,0,0.00000000,,,,,,0,0,0,0,0,0,,,,none,
opu_bench_hybrid,Hybrid CNN+Trf,-1,_encoding_4_encode_1x512x128xi8_to_1x512x128xi8,build/compiled_models/opu_bench_suite/saturn_opu_OPU_LLM_opu_bench_hybrid.q.int8/sources/module__encoding_4.mlir,0,auxiliary,data_movement,data_movement,data_movement,0,0,0.00000000,1x512x128,,,,,0,0,0,0,0,0,,,,none,
opu_bench_hybrid,Hybrid CNN+Trf,-1,_encoding_5_encode_128xi8_to_128xi8,build/compiled_models/opu_bench_suite/saturn_opu_OPU_LLM_opu_bench_hybrid.q.int8/sources/module__encoding_5.mlir,0,auxiliary,data_movement,data_movement,data_movement,0,0,0.00000000,,,,,,0,0,0,0,0,0,,,,none,
opu_bench_hybrid,Hybrid CNN+Trf,-1,_encoding_6_encode_16x128xi8_to_16x128xi8,build/compiled_models/opu_bench_suite/saturn_opu_OPU_LLM_opu_bench_hybrid.q.int8/sources/module__encoding_6.mlir,0,auxiliary,data_movement,data_movement,data_movement,0,0,0.00000000,16x128,,,,,0,0,0,0,0,0,,,,none,
opu_bench_hybrid,Hybrid CNN+Trf,-1,_encoding_7_encode_1x16xf32_to_1x16xf32,build/compiled_models/opu_bench_suite/saturn_opu_OPU_LLM_opu_bench_hybrid.q.int8/sources/module__encoding_7.mlir,0,auxiliary,data_movement,data_movement,data_movement,0,0,0.00000000,1x16,,,,,0,0,0,0,0,0,,,,none,
opu_bench_hybrid,Hybrid CNN+Trf,-1,_encoding_8_encode_4x256x256xi8_to_4x256x256xi8,build/compiled_models/opu_bench_suite/saturn_opu_OPU_LLM_opu_bench_hybrid.q.int8/sources/module__encoding_8.mlir,0,auxiliary,data_movement,data_movement,data_movement,0,0,0.00000000,4x256x256,,,,,0,0,0,0,0,0,,,,none,
opu_bench_hybrid,Hybrid CNN+Trf,-1,_encoding_9_encode_256x128xi8_to_256x128xi8,build/compiled_models/opu_bench_suite/saturn_opu_OPU_LLM_opu_bench_hybrid.q.int8/sources/module__encoding_9.mlir,0,auxiliary,data_movement,data_movement,data_movement,0,0,0.00000000,256x128,,,,,0,0,0,0,0,0,,,,none,
opu_bench_hybrid,Hybrid CNN+Trf,0,main_graph$async_dispatch_0_elementwise_3x64x64_f32xi8,build/compiled_models/opu_bench_suite/saturn_opu_OPU_LLM_opu_bench_hybrid.q.int8/sources/module_main_graph$async_dispatch_0.mlir,1,elementwise:dispatch_0,elementwise,elementwise_other,elementwise_other,12288,0,0.00469119,3x64x64,,,,,0,0,0,0,0,0,,,,none,
opu_bench_hybrid,Hybrid CNN+Trf,1,main_graph$async_dispatch_1_conv_64x32x32x3x3x3_i8xi8xi32,build/compiled_models/opu_bench_suite/saturn_opu_OPU_LLM_opu_bench_hybrid.q.int8/sources/module_main_graph$async_dispatch_1.mlir,1,conv:dispatch_1,conv,direct_conv,direct_conv,1331712,0,0.50840820,64x34x34,,,,,0,0,0,0,0,0,,,,none,
opu_bench_hybrid,Hybrid CNN+Trf,10,main_graph$async_dispatch_10_elementwise_broadcast_32768_f32xi8,build/compiled_models/opu_bench_suite/saturn_opu_OPU_LLM_opu_bench_hybrid.q.int8/sources/module_main_graph$async_dispatch_10.mlir,1,elementwise:dispatch_10,elementwise,elementwise_other,elementwise_other,32768,0,0.01250985,32768,,,,,0,0,0,0,0,0,,,,none,
opu_bench_hybrid,Hybrid CNN+Trf,11,main_graph$async_dispatch_11_batch_matmul_4x256x256x32_i8xi8xi32,build/compiled_models/opu_bench_suite/saturn_opu_OPU_LLM_opu_bench_hybrid.q.int8/sources/module_main_graph$async_dispatch_11.mlir,1,projection_or_ffn:dispatch_11,batch_matmul,runtime_32x32_tile,runtime_mmt4d_opu,16777216,16777216,6.40504421,4x256x256x32,256,256,32,4,4,4,4,0,0,0,32,32,1,32x32x1,llvm:iree_uk_mmt4d;asm:vopacc=4;tile=32x32x1
opu_bench_hybrid,Hybrid CNN+Trf,12,main_graph$async_dispatch_12_softmax_4x256x256xf32_generic,build/compiled_models/opu_bench_suite/saturn_opu_OPU_LLM_opu_bench_hybrid.q.int8/sources/module_main_graph$async_dispatch_12.mlir,1,attention_softmax:dispatch_12,softmax,rvv_reduction_softmax_norm,rvv_reduction_softmax_norm,1310720,0,0.50039408,4x256x256,,,,,0,0,0,0,0,0,,,,none,
opu_bench_hybrid,Hybrid CNN+Trf,13,main_graph$async_dispatch_13_batch_matmul_4x256x32x256_i8xi8xi32,build/compiled_models/opu_bench_suite/saturn_opu_OPU_LLM_opu_bench_hybrid.q.int8/sources/module_main_graph$async_dispatch_13.mlir,1,projection_or_ffn:dispatch_13,batch_matmul,runtime_32x32_tile,runtime_mmt4d_opu,16777216,16777216,6.40504421,4x256x32x256,256,32,256,4,4,4,4,0,0,0,32,32,1,32x32x1,llvm:iree_uk_mmt4d;asm:vopacc=4;tile=32x32x1
opu_bench_hybrid,Hybrid CNN+Trf,14,main_graph$async_dispatch_14_matmul_256x128x128_i8xi8xi32,build/compiled_models/opu_bench_suite/saturn_opu_OPU_LLM_opu_bench_hybrid.q.int8/sources/module_main_graph$async_dispatch_14.mlir,1,projection_or_ffn:dispatch_14,matmul,encoding_16x16_tile,encoding_resolver,8388608,8388608,3.20252210,256x128x128,256,128,128,,1,4,1,0,0,0,16,16,1,16x16x1,llvm:iree_uk_opu_matmul;asm:vopacc=1;tile=16x16x1
opu_bench_hybrid,Hybrid CNN+Trf,15,main_graph$async_dispatch_15_elementwise_32768_i8xf32,build/compiled_models/opu_bench_suite/saturn_opu_OPU_LLM_opu_bench_hybrid.q.int8/sources/module_main_graph$async_dispatch_15.mlir,1,elementwise:dispatch_15,elementwise,elementwise_other,elementwise_other,32768,0,0.01250985,32768,,,,,0,0,0,0,0,0,,,,none,
opu_bench_hybrid,Hybrid CNN+Trf,16,main_graph$async_dispatch_16_reduction_256x128_f32,build/compiled_models/opu_bench_suite/saturn_opu_OPU_LLM_opu_bench_hybrid.q.int8/sources/module_main_graph$async_dispatch_16.mlir,1,norm_or_softmax:dispatch_16,reduction,rvv_reduction_softmax_norm,rvv_reduction_softmax_norm,32512,0,0.01241212,256x128,,,,,0,0,0,0,0,0,,,,none,
opu_bench_hybrid,Hybrid CNN+Trf,17,main_graph$async_dispatch_17_reduction_256x128_f32,build/compiled_models/opu_bench_suite/saturn_opu_OPU_LLM_opu_bench_hybrid.q.int8/sources/module_main_graph$async_dispatch_17.mlir,1,norm_or_softmax:dispatch_17,reduction,rvv_reduction_softmax_norm,rvv_reduction_softmax_norm,32512,0,0.01241212,256x128,,,,,0,0,0,0,0,0,,,,none,
opu_bench_hybrid,Hybrid CNN+Trf,18,main_graph$async_dispatch_18_batch_matmul_1x256x512x128_i8xi8xi32,build/compiled_models/opu_bench_suite/saturn_opu_OPU_LLM_opu_bench_hybrid.q.int8/sources/module_main_graph$async_dispatch_18.mlir,1,projection_or_ffn:dispatch_18,batch_matmul,runtime_32x32_tile,runtime_mmt4d_opu,33554432,33554432,12.81008841,1x256x512x128,256,512,128,1,4,4,4,0,0,0,32,32,1,32x32x1,llvm:iree_uk_mmt4d;asm:vopacc=4;tile=32x32x1
opu_bench_hybrid,Hybrid CNN+Trf,19,main_graph$async_dispatch_19_batch_matmul_1x256x128x512_i8xi8xi32,build/compiled_models/opu_bench_suite/saturn_opu_OPU_LLM_opu_bench_hybrid.q.int8/sources/module_main_graph$async_dispatch_19.mlir,1,projection_or_ffn:dispatch_19,batch_matmul,runtime_32x32_tile,runtime_mmt4d_opu,33554432,33554432,12.81008841,1x256x128x512,256,128,512,1,4,4,4,0,0,0,32,32,1,32x32x1,llvm:iree_uk_mmt4d;asm:vopacc=4;tile=32x32x1
opu_bench_hybrid,Hybrid CNN+Trf,2,main_graph$async_dispatch_2_conv_128x16x16x64x3x3_i8xi8xi32,build/compiled_models/opu_bench_suite/saturn_opu_OPU_LLM_opu_bench_hybrid.q.int8/sources/module_main_graph$async_dispatch_2.mlir,1,conv:dispatch_2,conv,direct_conv,direct_conv,1331712,0,0.50840820,64x34x34,,,,,0,0,0,0,0,0,,,,none,
opu_bench_hybrid,Hybrid CNN+Trf,20,main_graph$async_dispatch_20_reduction_256x128_f32,build/compiled_models/opu_bench_suite/saturn_opu_OPU_LLM_opu_bench_hybrid.q.int8/sources/module_main_graph$async_dispatch_20.mlir,1,norm_or_softmax:dispatch_20,reduction,rvv_reduction_softmax_norm,rvv_reduction_softmax_norm,32512,0,0.01241212,256x128,,,,,0,0,0,0,0,0,,,,none,
opu_bench_hybrid,Hybrid CNN+Trf,21,main_graph$async_dispatch_21_reduction_256x128_f32,build/compiled_models/opu_bench_suite/saturn_opu_OPU_LLM_opu_bench_hybrid.q.int8/sources/module_main_graph$async_dispatch_21.mlir,1,norm_or_softmax:dispatch_21,reduction,rvv_reduction_softmax_norm,rvv_reduction_softmax_norm,32512,0,0.01241212,256x128,,,,,0,0,0,0,0,0,,,,none,
opu_bench_hybrid,Hybrid CNN+Trf,24,main_graph$async_dispatch_24_elementwise_98304_i32xi8,build/compiled_models/opu_bench_suite/saturn_opu_OPU_LLM_opu_bench_hybrid.q.int8/sources/module_main_graph$async_dispatch_24.mlir,1,elementwise:dispatch_24,elementwise,elementwise_other,elementwise_other,98304,0,0.03752956,98304,,,,,0,0,0,0,0,0,,,,none,
opu_bench_hybrid,Hybrid CNN+Trf,26,main_graph$async_dispatch_26_elementwise_broadcast_32768_f32xi8,build/compiled_models/opu_bench_suite/saturn_opu_OPU_LLM_opu_bench_hybrid.q.int8/sources/module_main_graph$async_dispatch_26.mlir,1,elementwise:dispatch_26,elementwise,elementwise_other,elementwise_other,32768,0,0.01250985,32768,,,,,0,0,0,0,0,0,,,,none,
opu_bench_hybrid,Hybrid CNN+Trf,27,main_graph$async_dispatch_27_elementwise_broadcast_32768_f32xi8,build/compiled_models/opu_bench_suite/saturn_opu_OPU_LLM_opu_bench_hybrid.q.int8/sources/module_main_graph$async_dispatch_27.mlir,1,elementwise:dispatch_27,elementwise,elementwise_other,elementwise_other,32768,0,0.01250985,32768,,,,,0,0,0,0,0,0,,,,none,
opu_bench_hybrid,Hybrid CNN+Trf,28,main_graph$async_dispatch_28_batch_matmul_4x256x256x32_i8xi8xi32,build/compiled_models/opu_bench_suite/saturn_opu_OPU_LLM_opu_bench_hybrid.q.int8/sources/module_main_graph$async_dispatch_28.mlir,1,projection_or_ffn:dispatch_28,batch_matmul,runtime_32x32_tile,runtime_mmt4d_opu,16777216,16777216,6.40504421,4x256x256x32,256,256,32,4,4,4,4,0,0,0,32,32,1,32x32x1,llvm:iree_uk_mmt4d;asm:vopacc=4;tile=32x32x1
opu_bench_hybrid,Hybrid CNN+Trf,29,main_graph$async_dispatch_29_softmax_4x256x256xf32_generic,build/compiled_models/opu_bench_suite/saturn_opu_OPU_LLM_opu_bench_hybrid.q.int8/sources/module_main_graph$async_dispatch_29.mlir,1,attention_softmax:dispatch_29,softmax,rvv_reduction_softmax_norm,rvv_reduction_softmax_norm,1310720,0,0.50039408,4x256x256,,,,,0,0,0,0,0,0,,,,none,
opu_bench_hybrid,Hybrid CNN+Trf,3,main_graph$async_dispatch_3_reduction_256x128_f32,build/compiled_models/opu_bench_suite/saturn_opu_OPU_LLM_opu_bench_hybrid.q.int8/sources/module_main_graph$async_dispatch_3.mlir,1,norm_or_softmax:dispatch_3,reduction,rvv_reduction_softmax_norm,rvv_reduction_softmax_norm,32512,0,0.01241212,256x128,,,,,0,0,0,0,0,0,,,,none,
opu_bench_hybrid,Hybrid CNN+Trf,30,main_graph$async_dispatch_30_batch_matmul_4x256x32x256_i8xi8xi32,build/compiled_models/opu_bench_suite/saturn_opu_OPU_LLM_opu_bench_hybrid.q.int8/sources/module_main_graph$async_dispatch_30.mlir,1,projection_or_ffn:dispatch_30,batch_matmul,runtime_32x32_tile,runtime_mmt4d_opu,16777216,16777216,6.40504421,4x256x32x256,256,32,256,4,4,4,4,0,0,0,32,32,1,32x32x1,llvm:iree_uk_mmt4d;asm:vopacc=4;tile=32x32x1
opu_bench_hybrid,Hybrid CNN+Trf,31,main_graph$async_dispatch_31_matmul_256x128x128_i8xi8xi32,build/compiled_models/opu_bench_suite/saturn_opu_OPU_LLM_opu_bench_hybrid.q.int8/sources/module_main_graph$async_dispatch_31.mlir,1,projection_or_ffn:dispatch_31,matmul,encoding_16x16_tile,encoding_resolver,8388608,8388608,3.20252210,256x128x128,256,128,128,,1,4,1,0,0,0,16,16,1,16x16x1,llvm:iree_uk_opu_matmul;asm:vopacc=1;tile=16x16x1
opu_bench_hybrid,Hybrid CNN+Trf,32,main_graph$async_dispatch_32_elementwise_32768_i8xf32,build/compiled_models/opu_bench_suite/saturn_opu_OPU_LLM_opu_bench_hybrid.q.int8/sources/module_main_graph$async_dispatch_32.mlir,1,elementwise:dispatch_32,elementwise,elementwise_other,elementwise_other,32768,0,0.01250985,32768,,,,,0,0,0,0,0,0,,,,none,
opu_bench_hybrid,Hybrid CNN+Trf,33,main_graph$async_dispatch_33_reduction_256x128_f32,build/compiled_models/opu_bench_suite/saturn_opu_OPU_LLM_opu_bench_hybrid.q.int8/sources/module_main_graph$async_dispatch_33.mlir,1,norm_or_softmax:dispatch_33,reduction,rvv_reduction_softmax_norm,rvv_reduction_softmax_norm,32512,0,0.01241212,256x128,,,,,0,0,0,0,0,0,,,,none,
opu_bench_hybrid,Hybrid CNN+Trf,34,main_graph$async_dispatch_34_reduction_256x128_f32,build/compiled_models/opu_bench_suite/saturn_opu_OPU_LLM_opu_bench_hybrid.q.int8/sources/module_main_graph$async_dispatch_34.mlir,1,norm_or_softmax:dispatch_34,reduction,rvv_reduction_softmax_norm,rvv_reduction_softmax_norm,32512,0,0.01241212,256x128,,,,,0,0,0,0,0,0,,,,none,
opu_bench_hybrid,Hybrid CNN+Trf,35,main_graph$async_dispatch_35_batch_matmul_1x256x512x128_i8xi8xi32,build/compiled_models/opu_bench_suite/saturn_opu_OPU_LLM_opu_bench_hybrid.q.int8/sources/module_main_graph$async_dispatch_35.mlir,1,projection_or_ffn:dispatch_35,batch_matmul,runtime_32x32_tile,runtime_mmt4d_opu,33554432,33554432,12.81008841,1x256x512x128,256,512,128,1,4,4,4,0,0,0,32,32,1,32x32x1,llvm:iree_uk_mmt4d;asm:vopacc=4;tile=32x32x1
opu_bench_hybrid,Hybrid CNN+Trf,36,main_graph$async_dispatch_36_batch_matmul_1x256x128x512_i8xi8xi32,build/compiled_models/opu_bench_suite/saturn_opu_OPU_LLM_opu_bench_hybrid.q.int8/sources/module_main_graph$async_dispatch_36.mlir,1,projection_or_ffn:dispatch_36,batch_matmul,runtime_32x32_tile,runtime_mmt4d_opu,33554432,33554432,12.81008841,1x256x128x512,256,128,512,1,4,4,4,0,0,0,32,32,1,32x32x1,llvm:iree_uk_mmt4d;asm:vopacc=4;tile=32x32x1
opu_bench_hybrid,Hybrid CNN+Trf,37,main_graph$async_dispatch_37_reduction_256x128_f32,build/compiled_models/opu_bench_suite/saturn_opu_OPU_LLM_opu_bench_hybrid.q.int8/sources/module_main_graph$async_dispatch_37.mlir,1,norm_or_softmax:dispatch_37,reduction,rvv_reduction_softmax_norm,rvv_reduction_softmax_norm,32512,0,0.01241212,256x128,,,,,0,0,0,0,0,0,,,,none,
opu_bench_hybrid,Hybrid CNN+Trf,38,main_graph$async_dispatch_38_reduction_256x128_f32,build/compiled_models/opu_bench_suite/saturn_opu_OPU_LLM_opu_bench_hybrid.q.int8/sources/module_main_graph$async_dispatch_38.mlir,1,norm_or_softmax:dispatch_38,reduction,rvv_reduction_softmax_norm,rvv_reduction_softmax_norm,32512,0,0.01241212,256x128,,,,,0,0,0,0,0,0,,,,none,
opu_bench_hybrid,Hybrid CNN+Trf,39,main_graph$async_dispatch_39_reduction_128x256_f32,build/compiled_models/opu_bench_suite/saturn_opu_OPU_LLM_opu_bench_hybrid.q.int8/sources/module_main_graph$async_dispatch_39.mlir,1,norm_or_softmax:dispatch_39,reduction,rvv_reduction_softmax_norm,rvv_reduction_softmax_norm,32640,0,0.01246099,128x256,,,,,0,0,0,0,0,0,,,,none,
opu_bench_hybrid,Hybrid CNN+Trf,4,main_graph$async_dispatch_4_reduction_256x128_f32,build/compiled_models/opu_bench_suite/saturn_opu_OPU_LLM_opu_bench_hybrid.q.int8/sources/module_main_graph$async_dispatch_4.mlir,1,norm_or_softmax:dispatch_4,reduction,rvv_reduction_softmax_norm,rvv_reduction_softmax_norm,32512,0,0.01241212,256x128,,,,,0,0,0,0,0,0,,,,none,
opu_bench_hybrid,Hybrid CNN+Trf,40,main_graph$async_dispatch_40_matmul_1x16x128_i8xi8xi32,build/compiled_models/opu_bench_suite/saturn_opu_OPU_LLM_opu_bench_hybrid.q.int8/sources/module_main_graph$async_dispatch_40.mlir,1,projection_or_ffn:dispatch_40,matmul,encoding_narrow_tile,encoding_resolver,4096,4096,0.00156373,1x16x128,1,16,128,,1,4,1,0,0,0,1,16,1,1x16x1,llvm:iree_uk_opu_matmul;asm:vopacc=1;tile=1x16x1
opu_bench_hybrid,Hybrid CNN+Trf,41,main_graph$async_dispatch_41_elementwise_16_i8xf32,build/compiled_models/opu_bench_suite/saturn_opu_OPU_LLM_opu_bench_hybrid.q.int8/sources/module_main_graph$async_dispatch_41.mlir,1,elementwise:dispatch_41,elementwise,elementwise_other,elementwise_other,16,0,0.00000611,16,,,,,0,0,0,0,0,0,,,,none,
opu_bench_hybrid,Hybrid CNN+Trf,5,main_graph$async_dispatch_5_elementwise_broadcast_256x49152_i8,build/compiled_models/opu_bench_suite/saturn_opu_OPU_LLM_opu_bench_hybrid.q.int8/sources/module_main_graph$async_dispatch_5.mlir,1,elementwise:dispatch_5,elementwise,elementwise_other,elementwise_other,12582912,0,4.80378316,256x49152,,,,,0,0,0,0,0,0,,,,none,
opu_bench_hybrid,Hybrid CNN+Trf,6,main_graph$async_dispatch_6_batch_matmul_256x1x384x128_i8xi8xi32,build/compiled_models/opu_bench_suite/saturn_opu_OPU_LLM_opu_bench_hybrid.q.int8/sources/module_main_graph$async_dispatch_6.mlir,1,projection_or_ffn:dispatch_6,batch_matmul,runtime_narrow_tile,runtime_mmt4d_opu,25165824,25165824,9.60756631,256x1x384x128,1,384,128,256,4,4,4,0,0,0,32,32,1,32x32x1,llvm:iree_uk_mmt4d;asm:vopacc=4;tile=32x32x1
opu_bench_hybrid,Hybrid CNN+Trf,7,main_graph$async_dispatch_7_elementwise_98304_i32xi8,build/compiled_models/opu_bench_suite/saturn_opu_OPU_LLM_opu_bench_hybrid.q.int8/sources/module_main_graph$async_dispatch_7.mlir,1,elementwise:dispatch_7,elementwise,elementwise_other,elementwise_other,98304,0,0.03752956,98304,,,,,0,0,0,0,0,0,,,,none,
opu_bench_hybrid,Hybrid CNN+Trf,8,main_graph$async_dispatch_8_elementwise_broadcast_32768_i8,build/compiled_models/opu_bench_suite/saturn_opu_OPU_LLM_opu_bench_hybrid.q.int8/sources/module_main_graph$async_dispatch_8.mlir,1,elementwise:dispatch_8,elementwise,elementwise_other,elementwise_other,32768,0,0.01250985,32768,,,,,0,0,0,0,0,0,,,,none,
opu_bench_hybrid,Hybrid CNN+Trf,9,main_graph$async_dispatch_9_elementwise_broadcast_32768_f32xi8,build/compiled_models/opu_bench_suite/saturn_opu_OPU_LLM_opu_bench_hybrid.q.int8/sources/module_main_graph$async_dispatch_9.mlir,1,elementwise:dispatch_9,elementwise,elementwise_other,elementwise_other,32768,0,0.01250985,32768,,,,,0,0,0,0,0,0,,,,none,
opu_bench_convnet,ConvNet,0,_encoding_0_encode_27x32xi8_to_27x32xi8,,1,,data_movement,data_movement,,0,0,0,,,,,,0,0,0,0,0,0,,,,,
opu_bench_convnet,ConvNet,1,_encoding_1_encode_1024x32xi32_to_1024x32xi32,,1,,data_movement,data_movement,,0,0,0,,,,,,0,0,0,0,0,0,,,,,
opu_bench_convnet,ConvNet,2,_encoding_2_encode_32xf32_to_32xf32,,1,,data_movement,data_movement,,0,0,0,,,,,,0,0,0,0,0,0,,,,,
opu_bench_convnet,ConvNet,3,_encoding_3_encode_288x32xi8_to_288x32xi8,,1,,data_movement,data_movement,,0,0,0,,,,,,0,0,0,0,0,0,,,,,
opu_bench_convnet,ConvNet,4,_encoding_4_encode_288x64xi8_to_288x64xi8,,1,,data_movement,data_movement,,0,0,0,,,,,,0,0,0,0,0,0,,,,,
opu_bench_convnet,ConvNet,5,_encoding_5_encode_256x64xi32_to_256x64xi32,,1,,data_movement,data_movement,,0,0,0,,,,,,0,0,0,0,0,0,,,,,
opu_bench_convnet,ConvNet,6,_encoding_6_encode_64xf32_to_64xf32,,1,,data_movement,data_movement,,0,0,0,,,,,,0,0,0,0,0,0,,,,,
opu_bench_convnet,ConvNet,7,_encoding_7_encode_576x64xi8_to_576x64xi8,,1,,data_movement,data_movement,,0,0,0,,,,,,0,0,0,0,0,0,,,,,
opu_bench_convnet,ConvNet,8,_encoding_8_encode_64x32xi8_to_64x32xi8,,1,,data_movement,data_movement,,0,0,0,,,,,,0,0,0,0,0,0,,,,,
opu_bench_convnet,ConvNet,9,_encoding_9_encode_576x128xi8_to_576x128xi8,,1,,data_movement,data_movement,,0,0,0,,,,,,0,0,0,0,0,0,,,,,
opu_bench_convnet,ConvNet,10,_encoding_10_encode_64x128xi32_to_64x128xi32,,1,,data_movement,data_movement,,0,0,0,,,,,,0,0,0,0,0,0,,,,,
opu_bench_convnet,ConvNet,11,_encoding_11_encode_128xf32_to_128xf32,,1,,data_movement,data_movement,,0,0,0,,,,,,0,0,0,0,0,0,,,,,
opu_bench_convnet,ConvNet,12,_encoding_12_encode_1152x128xi8_to_1152x128xi8,,1,,data_movement,data_movement,,0,0,0,,,,,,0,0,0,0,0,0,,,,,
opu_bench_convnet,ConvNet,13,_encoding_13_encode_128x64xi8_to_128x64xi8,,1,,data_movement,data_movement,,0,0,0,,,,,,0,0,0,0,0,0,,,,,
opu_bench_convnet,ConvNet,14,_encoding_14_encode_16x128xi8_to_16x128xi8,,1,,data_movement,data_movement,,0,0,0,,,,,,0,0,0,0,0,0,,,,,
opu_bench_convnet,ConvNet,15,_encoding_15_encode_1x16xf32_to_1x16xf32,,1,,data_movement,data_movement,,0,0,0,,,,,,0,0,0,0,0,0,,,,,
opu_bench_convnet,ConvNet,16,_initializer_1_dispatch_0_elementwise_broadcast_1024x32_i32,,1,,data_movement,data_movement,,0,0,0,,,,,,0,0,0,0,0,0,,,,,
opu_bench_convnet,ConvNet,17,_initializer_21_dispatch_0_elementwise_broadcast_256x64_i32,,1,,data_movement,data_movement,,0,0,0,,,,,,0,0,0,0,0,0,,,,,
opu_bench_convnet,ConvNet,18,_initializer_39_dispatch_0_elementwise_broadcast_64x128_i32,,1,,data_movement,data_movement,,0,0,0,,,,,,0,0,0,0,0,0,,,,,
opu_bench_convnet,ConvNet,19,main_graph$async_dispatch_0_elementwise_transpose_3x64x64_f32xi8,,1,,transpose_reshape,transpose_reshape,,0,0,0,,,,,,0,0,0,0,0,0,,,,,
opu_bench_convnet,ConvNet,20,main_graph$async_dispatch_1_generic_32x32x3x3x3_i8,,1,,activation,activation,,0,0,0,,,,,,0,0,0,0,0,0,,,,,
opu_bench_convnet,ConvNet,21,main_graph$async_dispatch_2_matmul_1024x32x27_i8xi8xi32,,1,,encoding_16x16_tile,encoding_16x16_tile,,0,0,0,,,,,,1,0,0,0,0,0,,,,,
opu_bench_convnet,ConvNet,22,main_graph$async_dispatch_3_slow_memcpy,,1,,elementwise_other,elementwise_other,,0,0,0,,,,,,0,0,0,0,0,0,,,,,
opu_bench_convnet,ConvNet,23,main_graph$async_dispatch_4_generic_32x32x3x3x32_i8,,1,,activation,activation,,0,0,0,,,,,,0,0,0,0,0,0,,,,,
opu_bench_convnet,ConvNet,24,main_graph$async_dispatch_5_matmul_1024x32x288_i8xi8xi32,,1,,encoding_16x16_tile,encoding_16x16_tile,,0,0,0,,,,,,1,0,0,0,0,0,,,,,
opu_bench_convnet,ConvNet,25,main_graph$async_dispatch_8_matmul_1024x32x288_i8xi8xi32,,1,,encoding_16x16_tile,encoding_16x16_tile,,0,0,0,,,,,,1,0,0,0,0,0,,,,,
opu_bench_convnet,ConvNet,26,main_graph$async_dispatch_11_matmul_1024x32x288_i8xi8xi32,,1,,encoding_16x16_tile,encoding_16x16_tile,,0,0,0,,,,,,1,0,0,0,0,0,,,,,
opu_bench_convnet,ConvNet,27,main_graph$async_dispatch_14_matmul_1024x32x288_i8xi8xi32,,1,,encoding_16x16_tile,encoding_16x16_tile,,0,0,0,,,,,,1,0,0,0,0,0,,,,,
opu_bench_convnet,ConvNet,28,main_graph$async_dispatch_16_generic_16x16x3x3x32_i8,,1,,activation,activation,,0,0,0,,,,,,0,0,0,0,0,0,,,,,
opu_bench_convnet,ConvNet,29,main_graph$async_dispatch_17_matmul_256x64x288_i8xi8xi32,,1,,encoding_16x16_tile,encoding_16x16_tile,,0,0,0,,,,,,1,0,0,0,0,0,,,,,
opu_bench_convnet,ConvNet,30,main_graph$async_dispatch_18_generic_16x16x32_i8,,1,,activation,activation,,0,0,0,,,,,,0,0,0,0,0,0,,,,,
opu_bench_convnet,ConvNet,31,main_graph$async_dispatch_19_slow_memcpy,,1,,elementwise_other,elementwise_other,,0,0,0,,,,,,0,0,0,0,0,0,,,,,
opu_bench_convnet,ConvNet,32,main_graph$async_dispatch_20_generic_16x16x3x3x64_i8,,1,,activation,activation,,0,0,0,,,,,,0,0,0,0,0,0,,,,,
opu_bench_convnet,ConvNet,33,main_graph$async_dispatch_21_matmul_256x64x576_i8xi8xi32,,1,,encoding_16x16_tile,encoding_16x16_tile,,0,0,0,,,,,,1,0,0,0,0,0,,,,,
opu_bench_convnet,ConvNet,34,main_graph$async_dispatch_22_matmul_256x64x32_i8xi8xi32,,1,,encoding_16x16_tile,encoding_16x16_tile,,0,0,0,,,,,,1,0,0,0,0,0,,,,,
opu_bench_convnet,ConvNet,35,main_graph$async_dispatch_25_matmul_256x64x576_i8xi8xi32,,1,,encoding_16x16_tile,encoding_16x16_tile,,0,0,0,,,,,,1,0,0,0,0,0,,,,,
opu_bench_convnet,ConvNet,36,main_graph$async_dispatch_28_matmul_256x64x576_i8xi8xi32,,1,,encoding_16x16_tile,encoding_16x16_tile,,0,0,0,,,,,,1,0,0,0,0,0,,,,,
opu_bench_convnet,ConvNet,37,main_graph$async_dispatch_30_generic_8x8x3x3x64_i8,,1,,activation,activation,,0,0,0,,,,,,0,0,0,0,0,0,,,,,
opu_bench_convnet,ConvNet,38,main_graph$async_dispatch_31_matmul_64x128x576_i8xi8xi32,,1,,encoding_16x16_tile,encoding_16x16_tile,,0,0,0,,,,,,1,0,0,0,0,0,,,,,
opu_bench_convnet,ConvNet,39,main_graph$async_dispatch_32_generic_8x8x64_i8,,1,,activation,activation,,0,0,0,,,,,,0,0,0,0,0,0,,,,,
opu_bench_convnet,ConvNet,40,main_graph$async_dispatch_33_slow_memcpy,,1,,elementwise_other,elementwise_other,,0,0,0,,,,,,0,0,0,0,0,0,,,,,
opu_bench_convnet,ConvNet,41,main_graph$async_dispatch_34_generic_8x8x3x3x128_i8,,1,,activation,activation,,0,0,0,,,,,,0,0,0,0,0,0,,,,,
opu_bench_convnet,ConvNet,42,main_graph$async_dispatch_35_matmul_64x128x1152_i8xi8xi32,,1,,encoding_16x16_tile,encoding_16x16_tile,,0,0,0,,,,,,1,0,0,0,0,0,,,,,
opu_bench_convnet,ConvNet,43,main_graph$async_dispatch_36_matmul_64x128x64_i8xi8xi32,,1,,encoding_16x16_tile,encoding_16x16_tile,,0,0,0,,,,,,1,0,0,0,0,0,,,,,
opu_bench_convnet,ConvNet,44,main_graph$async_dispatch_39_matmul_64x128x1152_i8xi8xi32,,1,,encoding_16x16_tile,encoding_16x16_tile,,0,0,0,,,,,,1,0,0,0,0,0,,,,,
opu_bench_convnet,ConvNet,45,main_graph$async_dispatch_42_matmul_64x128x1152_i8xi8xi32,,1,,encoding_16x16_tile,encoding_16x16_tile,,0,0,0,,,,,,1,0,0,0,0,0,,,,,
opu_bench_convnet,ConvNet,46,main_graph$async_dispatch_43_reduction_128x64_i8xf32xf32xi8xf32,,1,,rvv_reduction_softmax_norm,rvv_reduction_softmax_norm,,0,0,0,,,,,,0,0,0,0,0,0,,,,,
opu_bench_convnet,ConvNet,47,main_graph$async_dispatch_44_matmul_1x16x128_i8xi8xi32,,1,,encoding_16x16_tile,encoding_16x16_tile,,0,0,0,,,,,,1,0,0,0,0,0,,,,,
opu_bench_convnet,ConvNet,48,main_graph$async_dispatch_45_elementwise_16_i8xf32,,1,,dequantize_i8_to_f32,dequantize_i8_to_f32,,0,0,0,,,,,,0,0,0,0,0,0,,,,,
opu_bench_convnet,ConvNet,49,_encoding_16_encode_1024x32xi8_to_1024x32xi8,,1,,data_movement,data_movement,,0,0,0,,,,,,0,0,0,0,0,0,,,,,
opu_bench_convnet,ConvNet,50,_encoding_17_encode_256x64xi8_to_256x64xi8,,1,,data_movement,data_movement,,0,0,0,,,,,,0,0,0,0,0,0,,,,,
dronet,DroNet,51,_encoding_0_encode_27x32xi8_to_27x32xi8,,1,,data_movement,data_movement,,0,0,0,,,,,,0,0,0,0,0,0,,,,,
dronet,DroNet,52,_encoding_1_encode_288x32xi8_to_288x32xi8,,1,,data_movement,data_movement,,0,0,0,,,,,,0,0,0,0,0,0,,,,,
dronet,DroNet,53,_encoding_2_encode_32x32xi8_to_32x32xi8,,1,,data_movement,data_movement,,0,0,0,,,,,,0,0,0,0,0,0,,,,,
dronet,DroNet,54,_encoding_3_encode_288x64xi8_to_288x64xi8,,1,,data_movement,data_movement,,0,0,0,,,,,,0,0,0,0,0,0,,,,,
dronet,DroNet,55,_encoding_4_encode_576x64xi8_to_576x64xi8,,1,,data_movement,data_movement,,0,0,0,,,,,,0,0,0,0,0,0,,,,,
dronet,DroNet,56,_encoding_5_encode_64x32xi8_to_64x32xi8,,1,,data_movement,data_movement,,0,0,0,,,,,,0,0,0,0,0,0,,,,,
dronet,DroNet,57,_encoding_6_encode_576x128xi8_to_576x128xi8,,1,,data_movement,data_movement,,0,0,0,,,,,,0,0,0,0,0,0,,,,,
dronet,DroNet,58,_encoding_7_encode_1152x128xi8_to_1152x128xi8,,1,,data_movement,data_movement,,0,0,0,,,,,,0,0,0,0,0,0,,,,,
dronet,DroNet,59,_encoding_8_encode_128x64xi8_to_128x64xi8,,1,,data_movement,data_movement,,0,0,0,,,,,,0,0,0,0,0,0,,,,,
dronet,DroNet,60,_encoding_9_encode_2048x1xi8_to_2048x1xi8,,1,,data_movement,data_movement,,0,0,0,,,,,,0,0,0,0,0,0,,,,,
dronet,DroNet,61,_initializer_0_dispatch_0_elementwise_broadcast_3136x32_i32,,1,,data_movement,data_movement,,0,0,0,,,,,,0,0,0,0,0,0,,,,,
dronet,DroNet,62,_initializer_2_dispatch_0_elementwise_broadcast_196x32_i32,,1,,data_movement,data_movement,,0,0,0,,,,,,0,0,0,0,0,0,,,,,
dronet,DroNet,63,_initializer_3_dispatch_0_elementwise_broadcast_196x32_i32,,1,,data_movement,data_movement,,0,0,0,,,,,,0,0,0,0,0,0,,,,,
dronet,DroNet,64,_initializer_8_dispatch_0_elementwise_broadcast_49x64_i32,,1,,data_movement,data_movement,,0,0,0,,,,,,0,0,0,0,0,0,,,,,
dronet,DroNet,65,_initializer_9_dispatch_0_elementwise_broadcast_49x64_i32,,1,,data_movement,data_movement,,0,0,0,,,,,,0,0,0,0,0,0,,,,,
dronet,DroNet,66,_initializer_11_dispatch_0_elementwise_broadcast_49x64_i32,,1,,data_movement,data_movement,,0,0,0,,,,,,0,0,0,0,0,0,,,,,
dronet,DroNet,67,_initializer_14_dispatch_0_elementwise_broadcast_16x128_i32,,1,,data_movement,data_movement,,0,0,0,,,,,,0,0,0,0,0,0,,,,,
dronet,DroNet,68,_initializer_15_dispatch_0_elementwise_broadcast_16x128_i32,,1,,data_movement,data_movement,,0,0,0,,,,,,0,0,0,0,0,0,,,,,
dronet,DroNet,69,_initializer_17_dispatch_0_elementwise_broadcast_16x128_i32,,1,,data_movement,data_movement,,0,0,0,,,,,,0,0,0,0,0,0,,,,,
dronet,DroNet,70,dronet$async_dispatch_0_elementwise_transpose_3x112x112_f32xi8,,1,,transpose_reshape,transpose_reshape,,0,0,0,,,,,,0,0,0,0,0,0,,,,,
dronet,DroNet,71,dronet$async_dispatch_1_generic_56x56x3x3x3_i8,,1,,activation,activation,,0,0,0,,,,,,0,0,0,0,0,0,,,,,
dronet,DroNet,72,dronet$async_dispatch_2_matmul_3136x32x27_i8xi8xi32,,1,,encoding_16x16_tile,encoding_16x16_tile,,0,0,0,,,,,,1,0,0,0,0,0,,,,,
dronet,DroNet,73,dronet$async_dispatch_3_conv_32x27x27x3x3_f32,,1,,direct_conv,direct_conv,,0,0,0,,,,,,0,0,0,0,0,0,,,,,
dronet,DroNet,74,dronet$async_dispatch_4_generic_14x14x32_i8,,1,,activation,activation,,0,0,0,,,,,,0,0,0,0,0,0,,,,,
dronet,DroNet,75,dronet$async_dispatch_5_elementwise_transpose_32x27x27_i8xf32xf32xi8,,1,,elementwise_multi_dtype,elementwise_multi_dtype,,0,0,0,,,,,,0,0,0,0,0,0,,,,,
dronet,DroNet,76,dronet$async_dispatch_6_generic_14x14x3x3x32_i8,,1,,activation,activation,,0,0,0,,,,,,0,0,0,0,0,0,,,,,
dronet,DroNet,77,dronet$async_dispatch_7_matmul_196x32x288_i8xi8xi32,,1,,encoding_16x16_tile,encoding_16x16_tile,,0,0,0,,,,,,1,0,0,0,0,0,,,,,
dronet,DroNet,78,dronet$async_dispatch_8_slow_memcpy,,1,,elementwise_other,elementwise_other,,0,0,0,,,,,,0,0,0,0,0,0,,,,,
dronet,DroNet,79,dronet$async_dispatch_9_generic_14x14x3x3x32_i8,,1,,activation,activation,,0,0,0,,,,,,0,0,0,0,0,0,,,,,
dronet,DroNet,80,dronet$async_dispatch_10_matmul_196x32x288_i8xi8xi32,,1,,encoding_16x16_tile,encoding_16x16_tile,,0,0,0,,,,,,1,0,0,0,0,0,,,,,
dronet,DroNet,81,dronet$async_dispatch_11_matmul_196x32x32_i8xi8xi32,,1,,encoding_16x16_tile,encoding_16x16_tile,,0,0,0,,,,,,1,0,0,0,0,0,,,,,
dronet,DroNet,82,dronet$async_dispatch_12_generic_7x7x32_i8,,1,,activation,activation,,0,0,0,,,,,,0,0,0,0,0,0,,,,,
dronet,DroNet,83,dronet$async_dispatch_13_elementwise_196x32_i8xf32xf32xi8,,1,,elementwise_multi_dtype,elementwise_multi_dtype,,0,0,0,,,,,,0,0,0,0,0,0,,,,,
dronet,DroNet,84,dronet$async_dispatch_15_generic_7x7x3x3x32_i8,,1,,activation,activation,,0,0,0,,,,,,0,0,0,0,0,0,,,,,
dronet,DroNet,85,dronet$async_dispatch_16_matmul_49x64x288_i8xi8xi32,,1,,encoding_16x16_tile,encoding_16x16_tile,,0,0,0,,,,,,1,0,0,0,0,0,,,,,
dronet,DroNet,86,dronet$async_dispatch_17_slow_memcpy,,1,,elementwise_other,elementwise_other,,0,0,0,,,,,,0,0,0,0,0,0,,,,,
dronet,DroNet,87,dronet$async_dispatch_18_generic_7x7x3x3x64_i8,,1,,activation,activation,,0,0,0,,,,,,0,0,0,0,0,0,,,,,
dronet,DroNet,88,dronet$async_dispatch_19_matmul_49x64x576_i8xi8xi32,,1,,encoding_16x16_tile,encoding_16x16_tile,,0,0,0,,,,,,1,0,0,0,0,0,,,,,
dronet,DroNet,89,dronet$async_dispatch_20_matmul_49x64x32_i8xi8xi32,,1,,encoding_16x16_tile,encoding_16x16_tile,,0,0,0,,,,,,1,0,0,0,0,0,,,,,
dronet,DroNet,90,dronet$async_dispatch_21_generic_4x4x64_i8,,1,,activation,activation,,0,0,0,,,,,,0,0,0,0,0,0,,,,,
dronet,DroNet,91,dronet$async_dispatch_22_elementwise_49x64_i8xf32xf32xi8,,1,,elementwise_multi_dtype,elementwise_multi_dtype,,0,0,0,,,,,,0,0,0,0,0,0,,,,,
dronet,DroNet,92,dronet$async_dispatch_24_generic_4x4x3x3x64_i8,,1,,activation,activation,,0,0,0,,,,,,0,0,0,0,0,0,,,,,
dronet,DroNet,93,dronet$async_dispatch_25_matmul_16x128x576_i8xi8xi32,,1,,encoding_16x16_tile,encoding_16x16_tile,,0,0,0,,,,,,1,0,0,0,0,0,,,,,
dronet,DroNet,94,dronet$async_dispatch_26_slow_memcpy,,1,,elementwise_other,elementwise_other,,0,0,0,,,,,,0,0,0,0,0,0,,,,,
dronet,DroNet,95,dronet$async_dispatch_27_generic_4x4x3x3x128_i8,,1,,activation,activation,,0,0,0,,,,,,0,0,0,0,0,0,,,,,
dronet,DroNet,96,dronet$async_dispatch_28_matmul_16x128x1152_i8xi8xi32,,1,,encoding_16x16_tile,encoding_16x16_tile,,0,0,0,,,,,,1,0,0,0,0,0,,,,,
dronet,DroNet,97,dronet$async_dispatch_29_matmul_16x128x64_i8xi8xi32,,1,,encoding_16x16_tile,encoding_16x16_tile,,0,0,0,,,,,,1,0,0,0,0,0,,,,,
dronet,DroNet,98,dronet$async_dispatch_30_elementwise_2048_f32xi8,,1,,quantize_f32_to_i8,quantize_f32_to_i8,,0,0,0,,,,,,0,0,0,0,0,0,,,,,
dronet,DroNet,99,dronet$async_dispatch_31_matmul_1x1x2048_i8xi8xi32,,1,,encoding_16x16_tile,encoding_16x16_tile,,0,0,0,,,,,,1,0,0,0,0,0,,,,,
dronet,DroNet,100,dronet$async_dispatch_33_elementwise,,1,,elementwise_other,elementwise_other,,0,0,0,,,,,,0,0,0,0,0,0,,,,,
dronet,DroNet,101,dronet$async_dispatch_34_elementwise,,1,,elementwise_other,elementwise_other,,0,0,0,,,,,,0,0,0,0,0,0,,,,,
dronet,DroNet,102,_encoding_10_encode_1x2048xi8_to_1x2048xi8,,1,,data_movement,data_movement,,0,0,0,,,,,,0,0,0,0,0,0,,,,,
yolov8_nano,YOLOv8-n,103,_encoding_0_encode_27x16xi8_to_27x16xi8,,1,,data_movement,data_movement,,0,0,0,,,,,,0,0,0,0,0,0,,,,,
yolov8_nano,YOLOv8-n,104,_encoding_1_encode_144x32xi8_to_144x32xi8,,1,,data_movement,data_movement,,0,0,0,,,,,,0,0,0,0,0,0,,,,,
yolov8_nano,YOLOv8-n,105,_encoding_2_encode_32x32xi8_to_32x32xi8,,1,,data_movement,data_movement,,0,0,0,,,,,,0,0,0,0,0,0,,,,,
yolov8_nano,YOLOv8-n,106,_encoding_3_encode_144x16xi8_to_144x16xi8,,1,,data_movement,data_movement,,0,0,0,,,,,,0,0,0,0,0,0,,,,,
yolov8_nano,YOLOv8-n,107,_encoding_4_encode_32x48xi8_to_32x48xi8,,1,,data_movement,data_movement,,0,0,0,,,,,,0,0,0,0,0,0,,,,,
yolov8_nano,YOLOv8-n,108,_encoding_5_encode_288x64xi8_to_288x64xi8,,1,,data_movement,data_movement,,0,0,0,,,,,,0,0,0,0,0,0,,,,,
yolov8_nano,YOLOv8-n,109,_encoding_6_encode_64x64xi8_to_64x64xi8,,1,,data_movement,data_movement,,0,0,0,,,,,,0,0,0,0,0,0,,,,,
yolov8_nano,YOLOv8-n,110,_encoding_7_encode_288x32xi8_to_288x32xi8,,1,,data_movement,data_movement,,0,0,0,,,,,,0,0,0,0,0,0,,,,,
yolov8_nano,YOLOv8-n,111,_encoding_8_encode_64x128xi8_to_64x128xi8,,1,,data_movement,data_movement,,0,0,0,,,,,,0,0,0,0,0,0,,,,,
yolov8_nano,YOLOv8-n,112,_encoding_9_encode_576x128xi8_to_576x128xi8,,1,,data_movement,data_movement,,0,0,0,,,,,,0,0,0,0,0,0,,,,,
yolov8_nano,YOLOv8-n,113,_encoding_10_encode_128x128xi8_to_128x128xi8,,1,,data_movement,data_movement,,0,0,0,,,,,,0,0,0,0,0,0,,,,,
yolov8_nano,YOLOv8-n,114,_encoding_11_encode_576x64xi8_to_576x64xi8,,1,,data_movement,data_movement,,0,0,0,,,,,,0,0,0,0,0,0,,,,,
yolov8_nano,YOLOv8-n,115,_encoding_12_encode_128x256xi8_to_128x256xi8,,1,,data_movement,data_movement,,0,0,0,,,,,,0,0,0,0,0,0,,,,,
yolov8_nano,YOLOv8-n,116,_encoding_13_encode_1152x256xi8_to_1152x256xi8,,1,,data_movement,data_movement,,0,0,0,,,,,,0,0,0,0,0,0,,,,,
yolov8_nano,YOLOv8-n,117,_encoding_14_encode_256x256xi8_to_256x256xi8,,1,,data_movement,data_movement,,0,0,0,,,,,,0,0,0,0,0,0,,,,,
yolov8_nano,YOLOv8-n,118,_encoding_15_encode_1152x128xi8_to_1152x128xi8,,1,,data_movement,data_movement,,0,0,0,,,,,,0,0,0,0,0,0,,,,,
yolov8_nano,YOLOv8-n,119,_encoding_16_encode_256x384xi8_to_256x384xi8,,1,,data_movement,data_movement,,0,0,0,,,,,,0,0,0,0,0,0,,,,,
yolov8_nano,YOLOv8-n,120,_encoding_17_encode_256x512xi8_to_256x512xi8,,1,,data_movement,data_movement,,0,0,0,,,,,,0,0,0,0,0,0,,,,,
yolov8_nano,YOLOv8-n,121,_encoding_18_encode_128x384xi8_to_128x384xi8,,1,,data_movement,data_movement,,0,0,0,,,,,,0,0,0,0,0,0,,,,,
yolov8_nano,YOLOv8-n,122,_encoding_19_encode_128x192xi8_to_128x192xi8,,1,,data_movement,data_movement,,0,0,0,,,,,,0,0,0,0,0,0,,,,,
yolov8_nano,YOLOv8-n,123,_encoding_20_encode_64x192xi8_to_64x192xi8,,1,,data_movement,data_movement,,0,0,0,,,,,,0,0,0,0,0,0,,,,,
yolov8_nano,YOLOv8-n,124,_encoding_21_encode_64x96xi8_to_64x96xi8,,1,,data_movement,data_movement,,0,0,0,,,,,,0,0,0,0,0,0,,,,,
yolov8_nano,YOLOv8-n,125,_encoding_22_encode_576x80xi8_to_576x80xi8,,1,,data_movement,data_movement,,0,0,0,,,,,,0,0,0,0,0,0,,,,,
yolov8_nano,YOLOv8-n,126,_encoding_23_encode_720x80xi8_to_720x80xi8,,1,,data_movement,data_movement,,0,0,0,,,,,,0,0,0,0,0,0,,,,,
yolov8_nano,YOLOv8-n,127,_encoding_24_encode_80x80xi8_to_80x80xi8,,1,,data_movement,data_movement,,0,0,0,,,,,,0,0,0,0,0,0,,,,,
yolov8_nano,YOLOv8-n,128,_encoding_25_encode_1152x64xi8_to_1152x64xi8,,1,,data_movement,data_movement,,0,0,0,,,,,,0,0,0,0,0,0,,,,,
yolov8_nano,YOLOv8-n,129,_encoding_26_encode_1152x80xi8_to_1152x80xi8,,1,,data_movement,data_movement,,0,0,0,,,,,,0,0,0,0,0,0,,,,,
yolov8_nano,YOLOv8-n,130,_encoding_27_encode_2304x64xi8_to_2304x64xi8,,1,,data_movement,data_movement,,0,0,0,,,,,,0,0,0,0,0,0,,,,,
yolov8_nano,YOLOv8-n,131,_encoding_28_encode_2304x80xi8_to_2304x80xi8,,1,,data_movement,data_movement,,0,0,0,,,,,,0,0,0,0,0,0,,,,,
yolov8_nano,YOLOv8-n,132,_encoding_29_encode_16x1xi8_to_16x1xi8,,1,,data_movement,data_movement,,0,0,0,,,,,,0,0,0,0,0,0,,,,,
yolov8_nano,YOLOv8-n,133,_initializer_1_dispatch_0_elementwise_broadcast_6400x32_i32,,1,,data_movement,data_movement,,0,0,0,,,,,,0,0,0,0,0,0,,,,,
yolov8_nano,YOLOv8-n,134,_initializer_3_dispatch_0_elementwise_broadcast_6400x32_i32,,1,,data_movement,data_movement,,0,0,0,,,,,,0,0,0,0,0,0,,,,,
yolov8_nano,YOLOv8-n,135,_initializer_5_dispatch_0_elementwise_broadcast_6400x16_i32,,1,,data_movement,data_movement,,0,0,0,,,,,,0,0,0,0,0,0,,,,,
yolov8_nano,YOLOv8-n,136,_initializer_9_dispatch_0_elementwise_broadcast_6400x32_i32,,1,,data_movement,data_movement,,0,0,0,,,,,,0,0,0,0,0,0,,,,,
yolov8_nano,YOLOv8-n,137,_initializer_11_dispatch_0_elementwise_broadcast_1600x64_i32,,1,,data_movement,data_movement,,0,0,0,,,,,,0,0,0,0,0,0,,,,,
yolov8_nano,YOLOv8-n,138,_initializer_13_dispatch_0_elementwise_broadcast_1600x64_i32,,1,,data_movement,data_movement,,0,0,0,,,,,,0,0,0,0,0,0,,,,,
yolov8_nano,YOLOv8-n,139,_initializer_15_dispatch_0_elementwise_broadcast_1600x32_i32,,1,,data_movement,data_movement,,0,0,0,,,,,,0,0,0,0,0,0,,,,,
yolov8_nano,YOLOv8-n,140,_initializer_23_dispatch_0_elementwise_broadcast_1600x64_i32,,1,,data_movement,data_movement,,0,0,0,,,,,,0,0,0,0,0,0,,,,,
yolov8_nano,YOLOv8-n,141,_initializer_25_dispatch_0_elementwise_broadcast_400x128_i32,,1,,data_movement,data_movement,,0,0,0,,,,,,0,0,0,0,0,0,,,,,
yolov8_nano,YOLOv8-n,142,_initializer_27_dispatch_0_elementwise_broadcast_400x128_i32,,1,,data_movement,data_movement,,0,0,0,,,,,,0,0,0,0,0,0,,,,,
yolov8_nano,YOLOv8-n,143,_initializer_29_dispatch_0_elementwise_broadcast_400x64_i32,,1,,data_movement,data_movement,,0,0,0,,,,,,0,0,0,0,0,0,,,,,
yolov8_nano,YOLOv8-n,144,_initializer_37_dispatch_0_elementwise_broadcast_400x128_i32,,1,,data_movement,data_movement,,0,0,0,,,,,,0,0,0,0,0,0,,,,,
yolov8_nano,YOLOv8-n,145,_initializer_39_dispatch_0_elementwise_broadcast_100x256_i32,,1,,data_movement,data_movement,,0,0,0,,,,,,0,0,0,0,0,0,,,,,
yolov8_nano,YOLOv8-n,146,_initializer_41_dispatch_0_elementwise_broadcast_100x256_i32,,1,,data_movement,data_movement,,0,0,0,,,,,,0,0,0,0,0,0,,,,,
yolov8_nano,YOLOv8-n,147,_initializer_43_dispatch_0_elementwise_broadcast_100x128_i32,,1,,data_movement,data_movement,,0,0,0,,,,,,0,0,0,0,0,0,,,,,
yolov8_nano,YOLOv8-n,148,_initializer_47_dispatch_0_elementwise_broadcast_100x256_i32,,1,,data_movement,data_movement,,0,0,0,,,,,,0,0,0,0,0,0,,,,,
yolov8_nano,YOLOv8-n,149,_initializer_49_dispatch_0_elementwise_broadcast_100x128_i32,,1,,data_movement,data_movement,,0,0,0,,,,,,0,0,0,0,0,0,,,,,
yolov8_nano,YOLOv8-n,150,_initializer_51_dispatch_0_elementwise_broadcast_100x256_i32,,1,,data_movement,data_movement,,0,0,0,,,,,,0,0,0,0,0,0,,,,,
yolov8_nano,YOLOv8-n,151,_initializer_53_dispatch_0_elementwise_broadcast_400x128_i32,,1,,data_movement,data_movement,,0,0,0,,,,,,0,0,0,0,0,0,,,,,
yolov8_nano,YOLOv8-n,152,_initializer_59_dispatch_0_elementwise_broadcast_400x128_i32,,1,,data_movement,data_movement,,0,0,0,,,,,,0,0,0,0,0,0,,,,,
yolov8_nano,YOLOv8-n,153,_initializer_61_dispatch_0_elementwise_broadcast_1600x64_i32,,1,,data_movement,data_movement,,0,0,0,,,,,,0,0,0,0,0,0,,,,,
yolov8_nano,YOLOv8-n,154,_initializer_67_dispatch_0_elementwise_broadcast_1600x64_i32,,1,,data_movement,data_movement,,0,0,0,,,,,,0,0,0,0,0,0,,,,,
yolov8_nano,YOLOv8-n,155,_initializer_71_dispatch_0_elementwise_broadcast_1600x64_i32,,1,,data_movement,data_movement,,0,0,0,,,,,,0,0,0,0,0,0,,,,,
yolov8_nano,YOLOv8-n,156,_initializer_73_dispatch_0_elementwise_broadcast_1600x80_i32,,1,,data_movement,data_movement,,0,0,0,,,,,,0,0,0,0,0,0,,,,,
yolov8_nano,YOLOv8-n,157,_initializer_77_dispatch_0_elementwise_broadcast_1600x80_i32,,1,,data_movement,data_movement,,0,0,0,,,,,,0,0,0,0,0,0,,,,,
yolov8_nano,YOLOv8-n,158,_initializer_83_dispatch_0_elementwise_broadcast_1600x80_i32,,1,,data_movement,data_movement,,0,0,0,,,,,,0,0,0,0,0,0,,,,,
yolov8_nano,YOLOv8-n,159,_initializer_93_dispatch_0_elementwise_broadcast_400x64_i32,,1,,data_movement,data_movement,,0,0,0,,,,,,0,0,0,0,0,0,,,,,
yolov8_nano,YOLOv8-n,160,_initializer_95_dispatch_0_elementwise_broadcast_400x80_i32,,1,,data_movement,data_movement,,0,0,0,,,,,,0,0,0,0,0,0,,,,,
yolov8_nano,YOLOv8-n,161,_initializer_99_dispatch_0_elementwise_broadcast_400x80_i32,,1,,data_movement,data_movement,,0,0,0,,,,,,0,0,0,0,0,0,,,,,
yolov8_nano,YOLOv8-n,162,_initializer_103_dispatch_0_elementwise_broadcast_400x64_i32,,1,,data_movement,data_movement,,0,0,0,,,,,,0,0,0,0,0,0,,,,,
yolov8_nano,YOLOv8-n,163,_initializer_105_dispatch_0_elementwise_broadcast_400x80_i32,,1,,data_movement,data_movement,,0,0,0,,,,,,0,0,0,0,0,0,,,,,
yolov8_nano,YOLOv8-n,164,_initializer_113_dispatch_0_elementwise_broadcast_100x64_i32,,1,,data_movement,data_movement,,0,0,0,,,,,,0,0,0,0,0,0,,,,,
yolov8_nano,YOLOv8-n,165,_initializer_115_dispatch_0_elementwise_broadcast_100x80_i32,,1,,data_movement,data_movement,,0,0,0,,,,,,0,0,0,0,0,0,,,,,
yolov8_nano,YOLOv8-n,166,_initializer_117_dispatch_0_elementwise_broadcast_100x64_i32,,1,,data_movement,data_movement,,0,0,0,,,,,,0,0,0,0,0,0,,,,,
yolov8_nano,YOLOv8-n,167,_initializer_119_dispatch_0_elementwise_broadcast_100x80_i32,,1,,data_movement,data_movement,,0,0,0,,,,,,0,0,0,0,0,0,,,,,
yolov8_nano,YOLOv8-n,168,_initializer_121_dispatch_0_elementwise_broadcast_100x64_i32,,1,,data_movement,data_movement,,0,0,0,,,,,,0,0,0,0,0,0,,,,,
yolov8_nano,YOLOv8-n,169,_initializer_123_dispatch_0_elementwise_broadcast_100x80_i32,,1,,data_movement,data_movement,,0,0,0,,,,,,0,0,0,0,0,0,,,,,
yolov8_nano,YOLOv8-n,170,main_graph$async_dispatch_0_elementwise_transpose_3x320x320_f32xi8,,1,,transpose_reshape,transpose_reshape,,0,0,0,,,,,,0,0,0,0,0,0,,,,,
yolov8_nano,YOLOv8-n,171,main_graph$async_dispatch_1_elementwise_broadcast_25600x16_i32,,1,,elementwise_other,elementwise_other,,0,0,0,,,,,,0,0,0,0,0,0,,,,,
yolov8_nano,YOLOv8-n,172,main_graph$async_dispatch_2_generic_160x160x3x3x3_i8,,1,,activation,activation,,0,0,0,,,,,,0,0,0,0,0,0,,,,,
yolov8_nano,YOLOv8-n,173,main_graph$async_dispatch_3_matmul_25600x16x27_i8xi8xi32,,1,,encoding_16x16_tile,encoding_16x16_tile,,0,0,0,,,,,,1,0,0,0,0,0,,,,,
yolov8_nano,YOLOv8-n,174,main_graph$async_dispatch_4_slow_memcpy,,1,,elementwise_other,elementwise_other,,0,0,0,,,,,,0,0,0,0,0,0,,,,,
yolov8_nano,YOLOv8-n,175,main_graph$async_dispatch_5_generic_80x80x3x3x16_i8,,1,,activation,activation,,0,0,0,,,,,,0,0,0,0,0,0,,,,,
yolov8_nano,YOLOv8-n,176,main_graph$async_dispatch_6_matmul_6400x32x144_i8xi8xi32,,1,,encoding_16x16_tile,encoding_16x16_tile,,0,0,0,,,,,,1,0,0,0,0,0,,,,,
yolov8_nano,YOLOv8-n,177,main_graph$async_dispatch_7_matmul_6400x32x32_i8xi8xi32,,1,,encoding_16x16_tile,encoding_16x16_tile,,0,0,0,,,,,,1,0,0,0,0,0,,,,,
yolov8_nano,YOLOv8-n,178,main_graph$async_dispatch_8_elementwise_16x80x80_f32xi8,,1,,quantize_f32_to_i8,quantize_f32_to_i8,,0,0,0,,,,,,0,0,0,0,0,0,,,,,
yolov8_nano,YOLOv8-n,179,main_graph$async_dispatch_9_elementwise_16x80x80_f32xi8,,1,,quantize_f32_to_i8,quantize_f32_to_i8,,0,0,0,,,,,,0,0,0,0,0,0,,,,,
yolov8_nano,YOLOv8-n,180,main_graph$async_dispatch_10_elementwise_102400_i8xf32,,1,,dequantize_i8_to_f32,dequantize_i8_to_f32,,0,0,0,,,,,,0,0,0,0,0,0,,,,,
yolov8_nano,YOLOv8-n,181,main_graph$async_dispatch_12_transpose_16x80x80_i8,,1,,elementwise_other,elementwise_other,,0,0,0,,,,,,0,0,0,0,0,0,,,,,
yolov8_nano,YOLOv8-n,182,main_graph$async_dispatch_13_generic_80x80x3x3x16_i8,,1,,activation,activation,,0,0,0,,,,,,0,0,0,0,0,0,,,,,
yolov8_nano,YOLOv8-n,183,main_graph$async_dispatch_14_matmul_6400x16x144_i8xi8xi32,,1,,encoding_16x16_tile,encoding_16x16_tile,,0,0,0,,,,,,1,0,0,0,0,0,,,,,
yolov8_nano,YOLOv8-n,184,main_graph$async_dispatch_15_slow_memcpy,,1,,elementwise_other,elementwise_other,,0,0,0,,,,,,0,0,0,0,0,0,,,,,
yolov8_nano,YOLOv8-n,185,main_graph$async_dispatch_17_matmul_6400x16x144_i8xi8xi32,,1,,encoding_16x16_tile,encoding_16x16_tile,,0,0,0,,,,,,1,0,0,0,0,0,,,,,
yolov8_nano,YOLOv8-n,186,main_graph$async_dispatch_18_elementwise_102400_i8xf32,,1,,dequantize_i8_to_f32,dequantize_i8_to_f32,,0,0,0,,,,,,0,0,0,0,0,0,,,,,
yolov8_nano,YOLOv8-n,187,main_graph$async_dispatch_19_elementwise_transpose_48x6400_f32xi8,,1,,transpose_reshape,transpose_reshape,,0,0,0,,,,,,0,0,0,0,0,0,,,,,
yolov8_nano,YOLOv8-n,188,main_graph$async_dispatch_20_matmul_6400x32x48_i8xi8xi32,,1,,encoding_16x16_tile,encoding_16x16_tile,,0,0,0,,,,,,1,0,0,0,0,0,,,,,
yolov8_nano,YOLOv8-n,189,main_graph$async_dispatch_21_slow_memcpy,,1,,elementwise_other,elementwise_other,,0,0,0,,,,,,0,0,0,0,0,0,,,,,
yolov8_nano,YOLOv8-n,190,main_graph$async_dispatch_22_generic_40x40x3x3x32_i8,,1,,activation,activation,,0,0,0,,,,,,0,0,0,0,0,0,,,,,
yolov8_nano,YOLOv8-n,191,main_graph$async_dispatch_23_matmul_1600x64x288_i8xi8xi32,,1,,encoding_16x16_tile,encoding_16x16_tile,,0,0,0,,,,,,1,0,0,0,0,0,,,,,
yolov8_nano,YOLOv8-n,192,main_graph$async_dispatch_24_matmul_1600x64x64_i8xi8xi32,,1,,encoding_16x16_tile,encoding_16x16_tile,,0,0,0,,,,,,1,0,0,0,0,0,,,,,
yolov8_nano,YOLOv8-n,193,main_graph$async_dispatch_25_elementwise_32x40x40_f32xi8,,1,,quantize_f32_to_i8,quantize_f32_to_i8,,0,0,0,,,,,,0,0,0,0,0,0,,,,,
yolov8_nano,YOLOv8-n,194,main_graph$async_dispatch_26_elementwise_32x40x40_f32xi8,,1,,quantize_f32_to_i8,quantize_f32_to_i8,,0,0,0,,,,,,0,0,0,0,0,0,,,,,
yolov8_nano,YOLOv8-n,195,main_graph$async_dispatch_27_elementwise_51200_i8xf32,,1,,dequantize_i8_to_f32,dequantize_i8_to_f32,,0,0,0,,,,,,0,0,0,0,0,0,,,,,
yolov8_nano,YOLOv8-n,196,main_graph$async_dispatch_29_transpose_32x40x40_i8,,1,,elementwise_other,elementwise_other,,0,0,0,,,,,,0,0,0,0,0,0,,,,,
yolov8_nano,YOLOv8-n,197,main_graph$async_dispatch_30_generic_40x40x3x3x32_i8,,1,,activation,activation,,0,0,0,,,,,,0,0,0,0,0,0,,,,,
yolov8_nano,YOLOv8-n,198,main_graph$async_dispatch_31_matmul_1600x32x288_i8xi8xi32,,1,,encoding_16x16_tile,encoding_16x16_tile,,0,0,0,,,,,,1,0,0,0,0,0,,,,,
yolov8_nano,YOLOv8-n,199,main_graph$async_dispatch_32_slow_memcpy,,1,,elementwise_other,elementwise_other,,0,0,0,,,,,,0,0,0,0,0,0,,,,,
yolov8_nano,YOLOv8-n,200,main_graph$async_dispatch_34_matmul_1600x32x288_i8xi8xi32,,1,,encoding_16x16_tile,encoding_16x16_tile,,0,0,0,,,,,,1,0,0,0,0,0,,,,,
yolov8_nano,YOLOv8-n,201,main_graph$async_dispatch_35_elementwise_51200_i8xf32,,1,,dequantize_i8_to_f32,dequantize_i8_to_f32,,0,0,0,,,,,,0,0,0,0,0,0,,,,,
yolov8_nano,YOLOv8-n,202,main_graph$async_dispatch_36_transpose_32x1600_i8,,1,,elementwise_other,elementwise_other,,0,0,0,,,,,,0,0,0,0,0,0,,,,,
yolov8_nano,YOLOv8-n,203,main_graph$async_dispatch_39_matmul_1600x32x288_i8xi8xi32,,1,,encoding_16x16_tile,encoding_16x16_tile,,0,0,0,,,,,,1,0,0,0,0,0,,,,,
yolov8_nano,YOLOv8-n,204,main_graph$async_dispatch_42_matmul_1600x32x288_i8xi8xi32,,1,,encoding_16x16_tile,encoding_16x16_tile,,0,0,0,,,,,,1,0,0,0,0,0,,,,,
yolov8_nano,YOLOv8-n,205,main_graph$async_dispatch_43_elementwise_51200_i8xf32,,1,,dequantize_i8_to_f32,dequantize_i8_to_f32,,0,0,0,,,,,,0,0,0,0,0,0,,,,,
yolov8_nano,YOLOv8-n,206,main_graph$async_dispatch_44_elementwise_transpose_128x1600_f32xi8,,1,,transpose_reshape,transpose_reshape,,0,0,0,,,,,,0,0,0,0,0,0,,,,,
yolov8_nano,YOLOv8-n,207,main_graph$async_dispatch_45_matmul_1600x64x128_i8xi8xi32,,1,,encoding_16x16_tile,encoding_16x16_tile,,0,0,0,,,,,,1,0,0,0,0,0,,,,,
yolov8_nano,YOLOv8-n,208,main_graph$async_dispatch_46_elementwise_transpose_1600x64_i8xf32,,1,,transpose_reshape,transpose_reshape,,0,0,0,,,,,,0,0,0,0,0,0,,,,,
yolov8_nano,YOLOv8-n,209,main_graph$async_dispatch_47_slow_memcpy,,1,,elementwise_other,elementwise_other,,0,0,0,,,,,,0,0,0,0,0,0,,,,,
yolov8_nano,YOLOv8-n,210,main_graph$async_dispatch_48_generic_20x20x3x3x64_i8,,1,,activation,activation,,0,0,0,,,,,,0,0,0,0,0,0,,,,,
yolov8_nano,YOLOv8-n,211,main_graph$async_dispatch_49_matmul_400x128x576_i8xi8xi32,,1,,encoding_16x16_tile,encoding_16x16_tile,,0,0,0,,,,,,1,0,0,0,0,0,,,,,
yolov8_nano,YOLOv8-n,212,main_graph$async_dispatch_50_matmul_400x128x128_i8xi8xi32,,1,,encoding_16x16_tile,encoding_16x16_tile,,0,0,0,,,,,,1,0,0,0,0,0,,,,,
yolov8_nano,YOLOv8-n,213,main_graph$async_dispatch_51_elementwise_64x20x20_f32xi8,,1,,quantize_f32_to_i8,quantize_f32_to_i8,,0,0,0,,,,,,0,0,0,0,0,0,,,,,
yolov8_nano,YOLOv8-n,214,main_graph$async_dispatch_52_elementwise_64x20x20_f32xi8,,1,,quantize_f32_to_i8,quantize_f32_to_i8,,0,0,0,,,,,,0,0,0,0,0,0,,,,,
yolov8_nano,YOLOv8-n,215,main_graph$async_dispatch_53_elementwise_25600_i8xf32,,1,,dequantize_i8_to_f32,dequantize_i8_to_f32,,0,0,0,,,,,,0,0,0,0,0,0,,,,,
yolov8_nano,YOLOv8-n,216,main_graph$async_dispatch_55_transpose_64x20x20_i8,,1,,elementwise_other,elementwise_other,,0,0,0,,,,,,0,0,0,0,0,0,,,,,
yolov8_nano,YOLOv8-n,217,main_graph$async_dispatch_56_generic_20x20x3x3x64_i8,,1,,activation,activation,,0,0,0,,,,,,0,0,0,0,0,0,,,,,
yolov8_nano,YOLOv8-n,218,main_graph$async_dispatch_57_matmul_400x64x576_i8xi8xi32,,1,,encoding_16x16_tile,encoding_16x16_tile,,0,0,0,,,,,,1,0,0,0,0,0,,,,,
yolov8_nano,YOLOv8-n,219,main_graph$async_dispatch_58_slow_memcpy,,1,,elementwise_other,elementwise_other,,0,0,0,,,,,,0,0,0,0,0,0,,,,,
yolov8_nano,YOLOv8-n,220,main_graph$async_dispatch_60_matmul_400x64x576_i8xi8xi32,,1,,encoding_16x16_tile,encoding_16x16_tile,,0,0,0,,,,,,1,0,0,0,0,0,,,,,
yolov8_nano,YOLOv8-n,221,main_graph$async_dispatch_61_elementwise_25600_i8xf32,,1,,dequantize_i8_to_f32,dequantize_i8_to_f32,,0,0,0,,,,,,0,0,0,0,0,0,,,,,
yolov8_nano,YOLOv8-n,222,main_graph$async_dispatch_62_transpose_64x400_i8,,1,,elementwise_other,elementwise_other,,0,0,0,,,,,,0,0,0,0,0,0,,,,,
yolov8_nano,YOLOv8-n,223,main_graph$async_dispatch_65_matmul_400x64x576_i8xi8xi32,,1,,encoding_16x16_tile,encoding_16x16_tile,,0,0,0,,,,,,1,0,0,0,0,0,,,,,
yolov8_nano,YOLOv8-n,224,main_graph$async_dispatch_68_matmul_400x64x576_i8xi8xi32,,1,,encoding_16x16_tile,encoding_16x16_tile,,0,0,0,,,,,,1,0,0,0,0,0,,,,,
yolov8_nano,YOLOv8-n,225,main_graph$async_dispatch_69_elementwise_25600_i8xf32,,1,,dequantize_i8_to_f32,dequantize_i8_to_f32,,0,0,0,,,,,,0,0,0,0,0,0,,,,,
yolov8_nano,YOLOv8-n,226,main_graph$async_dispatch_70_elementwise_transpose_256x400_f32xi8,,1,,transpose_reshape,transpose_reshape,,0,0,0,,,,,,0,0,0,0,0,0,,,,,
yolov8_nano,YOLOv8-n,227,main_graph$async_dispatch_71_matmul_400x128x256_i8xi8xi32,,1,,encoding_16x16_tile,encoding_16x16_tile,,0,0,0,,,,,,1,0,0,0,0,0,,,,,
yolov8_nano,YOLOv8-n,228,main_graph$async_dispatch_72_elementwise_transpose_400x128_i8xf32,,1,,transpose_reshape,transpose_reshape,,0,0,0,,,,,,0,0,0,0,0,0,,,,,
yolov8_nano,YOLOv8-n,229,main_graph$async_dispatch_73_slow_memcpy,,1,,elementwise_other,elementwise_other,,0,0,0,,,,,,0,0,0,0,0,0,,,,,
yolov8_nano,YOLOv8-n,230,main_graph$async_dispatch_74_generic_10x10x3x3x128_i8,,1,,activation,activation,,0,0,0,,,,,,0,0,0,0,0,0,,,,,
yolov8_nano,YOLOv8-n,231,main_graph$async_dispatch_75_matmul_100x256x1152_i8xi8xi32,,1,,encoding_16x16_tile,encoding_16x16_tile,,0,0,0,,,,,,1,0,0,0,0,0,,,,,
yolov8_nano,YOLOv8-n,232,main_graph$async_dispatch_76_matmul_100x256x256_i8xi8xi32,,1,,encoding_16x16_tile,encoding_16x16_tile,,0,0,0,,,,,,1,0,0,0,0,0,,,,,
yolov8_nano,YOLOv8-n,233,main_graph$async_dispatch_77_elementwise_128x10x10_f32xi8,,1,,quantize_f32_to_i8,quantize_f32_to_i8,,0,0,0,,,,,,0,0,0,0,0,0,,,,,
yolov8_nano,YOLOv8-n,234,main_graph$async_dispatch_78_elementwise_128x10x10_f32xi8,,1,,quantize_f32_to_i8,quantize_f32_to_i8,,0,0,0,,,,,,0,0,0,0,0,0,,,,,
yolov8_nano,YOLOv8-n,235,main_graph$async_dispatch_79_elementwise_12800_i8xf32,,1,,dequantize_i8_to_f32,dequantize_i8_to_f32,,0,0,0,,,,,,0,0,0,0,0,0,,,,,
yolov8_nano,YOLOv8-n,236,main_graph$async_dispatch_81_transpose_128x10x10_i8,,1,,elementwise_other,elementwise_other,,0,0,0,,,,,,0,0,0,0,0,0,,,,,
yolov8_nano,YOLOv8-n,237,main_graph$async_dispatch_82_generic_10x10x3x3x128_i8,,1,,activation,activation,,0,0,0,,,,,,0,0,0,0,0,0,,,,,
yolov8_nano,YOLOv8-n,238,main_graph$async_dispatch_83_matmul_100x128x1152_i8xi8xi32,,1,,encoding_16x16_tile,encoding_16x16_tile,,0,0,0,,,,,,1,0,0,0,0,0,,,,,
yolov8_nano,YOLOv8-n,239,main_graph$async_dispatch_84_slow_memcpy,,1,,elementwise_other,elementwise_other,,0,0,0,,,,,,0,0,0,0,0,0,,,,,
yolov8_nano,YOLOv8-n,240,main_graph$async_dispatch_86_matmul_100x128x1152_i8xi8xi32,,1,,encoding_16x16_tile,encoding_16x16_tile,,0,0,0,,,,,,1,0,0,0,0,0,,,,,
yolov8_nano,YOLOv8-n,241,main_graph$async_dispatch_87_elementwise_12800_i8xf32,,1,,dequantize_i8_to_f32,dequantize_i8_to_f32,,0,0,0,,,,,,0,0,0,0,0,0,,,,,
yolov8_nano,YOLOv8-n,242,main_graph$async_dispatch_88_elementwise_transpose_384x100_f32xi8,,1,,transpose_reshape,transpose_reshape,,0,0,0,,,,,,0,0,0,0,0,0,,,,,
yolov8_nano,YOLOv8-n,243,main_graph$async_dispatch_89_matmul_100x256x384_i8xi8xi32,,1,,encoding_16x16_tile,encoding_16x16_tile,,0,0,0,,,,,,1,0,0,0,0,0,,,,,
yolov8_nano,YOLOv8-n,244,main_graph$async_dispatch_90_matmul_100x128x256_i8xi8xi32,,1,,encoding_16x16_tile,encoding_16x16_tile,,0,0,0,,,,,,1,0,0,0,0,0,,,,,
yolov8_nano,YOLOv8-n,245,main_graph$async_dispatch_91_elementwise_transpose_100x128_i8xf32,,1,,transpose_reshape,transpose_reshape,,0,0,0,,,,,,0,0,0,0,0,0,,,,,
yolov8_nano,YOLOv8-n,246,main_graph$async_dispatch_92_slow_memcpy,,1,,elementwise_other,elementwise_other,,0,0,0,,,,,,0,0,0,0,0,0,,,,,
yolov8_nano,YOLOv8-n,247,main_graph$async_dispatch_93_conv_128x10x10x5x5_f32,,1,,direct_conv,direct_conv,,0,0,0,,,,,,0,0,0,0,0,0,,,,,
yolov8_nano,YOLOv8-n,248,main_graph$async_dispatch_94_elementwise_12800_i8xf32,,1,,dequantize_i8_to_f32,dequantize_i8_to_f32,,0,0,0,,,,,,0,0,0,0,0,0,,,,,
yolov8_nano,YOLOv8-n,249,main_graph$async_dispatch_101_elementwise_transpose_512x100_f32xi8,,1,,transpose_reshape,transpose_reshape,,0,0,0,,,,,,0,0,0,0,0,0,,,,,
yolov8_nano,YOLOv8-n,250,main_graph$async_dispatch_102_matmul_100x256x512_i8xi8xi32,,1,,encoding_16x16_tile,encoding_16x16_tile,,0,0,0,,,,,,1,0,0,0,0,0,,,,,
yolov8_nano,YOLOv8-n,251,main_graph$async_dispatch_103_elementwise_transpose_100x256_i8xf32,,1,,transpose_reshape,transpose_reshape,,0,0,0,,,,,,0,0,0,0,0,0,,,,,
yolov8_nano,YOLOv8-n,252,main_graph$async_dispatch_104_elementwise_broadcast_102400_f32,,1,,activation,activation,,0,0,0,,,,,,0,0,0,0,0,0,,,,,
yolov8_nano,YOLOv8-n,253,main_graph$async_dispatch_105_elementwise_transpose_384x400_f32xi8,,1,,transpose_reshape,transpose_reshape,,0,0,0,,,,,,0,0,0,0,0,0,,,,,
yolov8_nano,YOLOv8-n,254,main_graph$async_dispatch_106_matmul_400x128x384_i8xi8xi32,,1,,encoding_16x16_tile,encoding_16x16_tile,,0,0,0,,,,,,1,0,0,0,0,0,,,,,
yolov8_nano,YOLOv8-n,255,main_graph$async_dispatch_107_elementwise_64x20x20_f32xi8,,1,,quantize_f32_to_i8,quantize_f32_to_i8,,0,0,0,,,,,,0,0,0,0,0,0,,,,,
yolov8_nano,YOLOv8-n,256,main_graph$async_dispatch_108_elementwise_64x20x20_f32xi8,,1,,quantize_f32_to_i8,quantize_f32_to_i8,,0,0,0,,,,,,0,0,0,0,0,0,,,,,
yolov8_nano,YOLOv8-n,257,main_graph$async_dispatch_109_elementwise_25600_i8xf32,,1,,dequantize_i8_to_f32,dequantize_i8_to_f32,,0,0,0,,,,,,0,0,0,0,0,0,,,,,
yolov8_nano,YOLOv8-n,258,main_graph$async_dispatch_113_matmul_400x64x576_i8xi8xi32,,1,,encoding_16x16_tile,encoding_16x16_tile,,0,0,0,,,,,,1,0,0,0,0,0,,,,,
yolov8_nano,YOLOv8-n,259,main_graph$async_dispatch_116_matmul_400x64x576_i8xi8xi32,,1,,encoding_16x16_tile,encoding_16x16_tile,,0,0,0,,,,,,1,0,0,0,0,0,,,,,
yolov8_nano,YOLOv8-n,260,main_graph$async_dispatch_117_elementwise_transpose_192x400_f32xi8,,1,,transpose_reshape,transpose_reshape,,0,0,0,,,,,,0,0,0,0,0,0,,,,,
yolov8_nano,YOLOv8-n,261,main_graph$async_dispatch_118_matmul_400x128x192_i8xi8xi32,,1,,encoding_16x16_tile,encoding_16x16_tile,,0,0,0,,,,,,1,0,0,0,0,0,,,,,
yolov8_nano,YOLOv8-n,262,main_graph$async_dispatch_119_elementwise_transpose_400x128_i8xf32,,1,,transpose_reshape,transpose_reshape,,0,0,0,,,,,,0,0,0,0,0,0,,,,,
yolov8_nano,YOLOv8-n,263,main_graph$async_dispatch_120_elementwise_broadcast_204800_f32,,1,,activation,activation,,0,0,0,,,,,,0,0,0,0,0,0,,,,,
yolov8_nano,YOLOv8-n,264,main_graph$async_dispatch_121_elementwise_transpose_192x1600_f32xi8,,1,,transpose_reshape,transpose_reshape,,0,0,0,,,,,,0,0,0,0,0,0,,,,,
yolov8_nano,YOLOv8-n,265,main_graph$async_dispatch_122_matmul_1600x64x192_i8xi8xi32,,1,,encoding_16x16_tile,encoding_16x16_tile,,0,0,0,,,,,,1,0,0,0,0,0,,,,,
yolov8_nano,YOLOv8-n,266,main_graph$async_dispatch_123_elementwise_32x40x40_f32xi8,,1,,quantize_f32_to_i8,quantize_f32_to_i8,,0,0,0,,,,,,0,0,0,0,0,0,,,,,
yolov8_nano,YOLOv8-n,267,main_graph$async_dispatch_124_elementwise_32x40x40_f32xi8,,1,,quantize_f32_to_i8,quantize_f32_to_i8,,0,0,0,,,,,,0,0,0,0,0,0,,,,,
yolov8_nano,YOLOv8-n,268,main_graph$async_dispatch_125_elementwise_51200_i8xf32,,1,,dequantize_i8_to_f32,dequantize_i8_to_f32,,0,0,0,,,,,,0,0,0,0,0,0,,,,,
yolov8_nano,YOLOv8-n,269,main_graph$async_dispatch_129_matmul_1600x32x288_i8xi8xi32,,1,,encoding_16x16_tile,encoding_16x16_tile,,0,0,0,,,,,,1,0,0,0,0,0,,,,,
yolov8_nano,YOLOv8-n,270,main_graph$async_dispatch_132_matmul_1600x32x288_i8xi8xi32,,1,,encoding_16x16_tile,encoding_16x16_tile,,0,0,0,,,,,,1,0,0,0,0,0,,,,,
yolov8_nano,YOLOv8-n,271,main_graph$async_dispatch_133_elementwise_transpose_96x1600_f32xi8,,1,,transpose_reshape,transpose_reshape,,0,0,0,,,,,,0,0,0,0,0,0,,,,,
yolov8_nano,YOLOv8-n,272,main_graph$async_dispatch_134_matmul_1600x64x96_i8xi8xi32,,1,,encoding_16x16_tile,encoding_16x16_tile,,0,0,0,,,,,,1,0,0,0,0,0,,,,,
yolov8_nano,YOLOv8-n,273,main_graph$async_dispatch_136_generic_20x20x3x3x64_i8,,1,,activation,activation,,0,0,0,,,,,,0,0,0,0,0,0,,,,,
yolov8_nano,YOLOv8-n,274,main_graph$async_dispatch_137_matmul_400x64x576_i8xi8xi32,,1,,encoding_16x16_tile,encoding_16x16_tile,,0,0,0,,,,,,1,0,0,0,0,0,,,,,
yolov8_nano,YOLOv8-n,275,main_graph$async_dispatch_138_generic_40x40x3x3x64_i8,,1,,activation,activation,,0,0,0,,,,,,0,0,0,0,0,0,,,,,
yolov8_nano,YOLOv8-n,276,main_graph$async_dispatch_139_matmul_1600x64x576_i8xi8xi32,,1,,encoding_16x16_tile,encoding_16x16_tile,,0,0,0,,,,,,1,0,0,0,0,0,,,,,
yolov8_nano,YOLOv8-n,277,main_graph$async_dispatch_140_matmul_1600x80x576_i8xi8xi32,,1,,encoding_16x16_tile,encoding_16x16_tile,,0,0,0,,,,,,1,0,0,0,0,0,,,,,
yolov8_nano,YOLOv8-n,278,main_graph$async_dispatch_142_generic_40x40x3x3x64_i8,,1,,activation,activation,,0,0,0,,,,,,0,0,0,0,0,0,,,,,
yolov8_nano,YOLOv8-n,279,main_graph$async_dispatch_143_matmul_1600x64x576_i8xi8xi32,,1,,encoding_16x16_tile,encoding_16x16_tile,,0,0,0,,,,,,1,0,0,0,0,0,,,,,
yolov8_nano,YOLOv8-n,280,main_graph$async_dispatch_144_slow_memcpy,,1,,elementwise_other,elementwise_other,,0,0,0,,,,,,0,0,0,0,0,0,,,,,
yolov8_nano,YOLOv8-n,281,main_graph$async_dispatch_145_generic_40x40x3x3x80_i8,,1,,activation,activation,,0,0,0,,,,,,0,0,0,0,0,0,,,,,
yolov8_nano,YOLOv8-n,282,main_graph$async_dispatch_146_matmul_1600x80x720_i8xi8xi32,,1,,encoding_16x16_tile,encoding_16x16_tile,,0,0,0,,,,,,1,0,0,0,0,0,,,,,
yolov8_nano,YOLOv8-n,283,main_graph$async_dispatch_147_elementwise_transpose_192x400_f32xi8,,1,,transpose_reshape,transpose_reshape,,0,0,0,,,,,,0,0,0,0,0,0,,,,,
yolov8_nano,YOLOv8-n,284,main_graph$async_dispatch_148_matmul_400x128x192_i8xi8xi32,,1,,encoding_16x16_tile,encoding_16x16_tile,,0,0,0,,,,,,1,0,0,0,0,0,,,,,
yolov8_nano,YOLOv8-n,285,main_graph$async_dispatch_149_matmul_1600x64x64_i8xi8xi32,,1,,encoding_16x16_tile,encoding_16x16_tile,,0,0,0,,,,,,1,0,0,0,0,0,,,,,
yolov8_nano,YOLOv8-n,286,main_graph$async_dispatch_150_matmul_1600x80x80_i8xi8xi32,,1,,encoding_16x16_tile,encoding_16x16_tile,,0,0,0,,,,,,1,0,0,0,0,0,,,,,
yolov8_nano,YOLOv8-n,287,main_graph$async_dispatch_151_elementwise_64x20x20_f32xi8,,1,,quantize_f32_to_i8,quantize_f32_to_i8,,0,0,0,,,,,,0,0,0,0,0,0,,,,,
yolov8_nano,YOLOv8-n,288,main_graph$async_dispatch_152_elementwise_64x20x20_f32xi8,,1,,quantize_f32_to_i8,quantize_f32_to_i8,,0,0,0,,,,,,0,0,0,0,0,0,,,,,
yolov8_nano,YOLOv8-n,289,main_graph$async_dispatch_153_elementwise_25600_i8xf32,,1,,dequantize_i8_to_f32,dequantize_i8_to_f32,,0,0,0,,,,,,0,0,0,0,0,0,,,,,
yolov8_nano,YOLOv8-n,290,main_graph$async_dispatch_157_matmul_400x64x576_i8xi8xi32,,1,,encoding_16x16_tile,encoding_16x16_tile,,0,0,0,,,,,,1,0,0,0,0,0,,,,,
yolov8_nano,YOLOv8-n,291,main_graph$async_dispatch_160_matmul_400x64x576_i8xi8xi32,,1,,encoding_16x16_tile,encoding_16x16_tile,,0,0,0,,,,,,1,0,0,0,0,0,,,,,
yolov8_nano,YOLOv8-n,292,main_graph$async_dispatch_161_elementwise_transpose_192x400_f32xi8,,1,,transpose_reshape,transpose_reshape,,0,0,0,,,,,,0,0,0,0,0,0,,,,,
yolov8_nano,YOLOv8-n,293,main_graph$async_dispatch_162_matmul_400x128x192_i8xi8xi32,,1,,encoding_16x16_tile,encoding_16x16_tile,,0,0,0,,,,,,1,0,0,0,0,0,,,,,
yolov8_nano,YOLOv8-n,294,main_graph$async_dispatch_164_generic_10x10x3x3x128_i8,,1,,activation,activation,,0,0,0,,,,,,0,0,0,0,0,0,,,,,
yolov8_nano,YOLOv8-n,295,main_graph$async_dispatch_165_matmul_100x128x1152_i8xi8xi32,,1,,encoding_16x16_tile,encoding_16x16_tile,,0,0,0,,,,,,1,0,0,0,0,0,,,,,
yolov8_nano,YOLOv8-n,296,main_graph$async_dispatch_166_generic_20x20x3x3x128_i8,,1,,activation,activation,,0,0,0,,,,,,0,0,0,0,0,0,,,,,
yolov8_nano,YOLOv8-n,297,main_graph$async_dispatch_167_matmul_400x64x1152_i8xi8xi32,,1,,encoding_16x16_tile,encoding_16x16_tile,,0,0,0,,,,,,1,0,0,0,0,0,,,,,
yolov8_nano,YOLOv8-n,298,main_graph$async_dispatch_168_matmul_400x80x1152_i8xi8xi32,,1,,encoding_16x16_tile,encoding_16x16_tile,,0,0,0,,,,,,1,0,0,0,0,0,,,,,
yolov8_nano,YOLOv8-n,299,main_graph$async_dispatch_171_matmul_400x64x576_i8xi8xi32,,1,,encoding_16x16_tile,encoding_16x16_tile,,0,0,0,,,,,,1,0,0,0,0,0,,,,,
yolov8_nano,YOLOv8-n,300,main_graph$async_dispatch_172_slow_memcpy,,1,,elementwise_other,elementwise_other,,0,0,0,,,,,,0,0,0,0,0,0,,,,,
yolov8_nano,YOLOv8-n,301,main_graph$async_dispatch_173_generic_20x20x3x3x80_i8,,1,,activation,activation,,0,0,0,,,,,,0,0,0,0,0,0,,,,,
yolov8_nano,YOLOv8-n,302,main_graph$async_dispatch_174_matmul_400x80x720_i8xi8xi32,,1,,encoding_16x16_tile,encoding_16x16_tile,,0,0,0,,,,,,1,0,0,0,0,0,,,,,
yolov8_nano,YOLOv8-n,303,main_graph$async_dispatch_175_elementwise_transpose_384x100_f32xi8,,1,,transpose_reshape,transpose_reshape,,0,0,0,,,,,,0,0,0,0,0,0,,,,,
yolov8_nano,YOLOv8-n,304,main_graph$async_dispatch_176_matmul_100x256x384_i8xi8xi32,,1,,encoding_16x16_tile,encoding_16x16_tile,,0,0,0,,,,,,1,0,0,0,0,0,,,,,
yolov8_nano,YOLOv8-n,305,main_graph$async_dispatch_177_matmul_400x64x64_i8xi8xi32,,1,,encoding_16x16_tile,encoding_16x16_tile,,0,0,0,,,,,,1,0,0,0,0,0,,,,,
yolov8_nano,YOLOv8-n,306,main_graph$async_dispatch_178_matmul_400x80x80_i8xi8xi32,,1,,encoding_16x16_tile,encoding_16x16_tile,,0,0,0,,,,,,1,0,0,0,0,0,,,,,
yolov8_nano,YOLOv8-n,307,main_graph$async_dispatch_179_elementwise_128x10x10_f32xi8,,1,,quantize_f32_to_i8,quantize_f32_to_i8,,0,0,0,,,,,,0,0,0,0,0,0,,,,,
yolov8_nano,YOLOv8-n,308,main_graph$async_dispatch_180_elementwise_128x10x10_f32xi8,,1,,quantize_f32_to_i8,quantize_f32_to_i8,,0,0,0,,,,,,0,0,0,0,0,0,,,,,
yolov8_nano,YOLOv8-n,309,main_graph$async_dispatch_181_elementwise_12800_i8xf32,,1,,dequantize_i8_to_f32,dequantize_i8_to_f32,,0,0,0,,,,,,0,0,0,0,0,0,,,,,
yolov8_nano,YOLOv8-n,310,main_graph$async_dispatch_185_matmul_100x128x1152_i8xi8xi32,,1,,encoding_16x16_tile,encoding_16x16_tile,,0,0,0,,,,,,1,0,0,0,0,0,,,,,
yolov8_nano,YOLOv8-n,311,main_graph$async_dispatch_188_matmul_100x128x1152_i8xi8xi32,,1,,encoding_16x16_tile,encoding_16x16_tile,,0,0,0,,,,,,1,0,0,0,0,0,,,,,
yolov8_nano,YOLOv8-n,312,main_graph$async_dispatch_189_elementwise_transpose_384x100_f32xi8,,1,,transpose_reshape,transpose_reshape,,0,0,0,,,,,,0,0,0,0,0,0,,,,,
yolov8_nano,YOLOv8-n,313,main_graph$async_dispatch_190_matmul_100x256x384_i8xi8xi32,,1,,encoding_16x16_tile,encoding_16x16_tile,,0,0,0,,,,,,1,0,0,0,0,0,,,,,
yolov8_nano,YOLOv8-n,314,main_graph$async_dispatch_191_slow_memcpy,,1,,elementwise_other,elementwise_other,,0,0,0,,,,,,0,0,0,0,0,0,,,,,
yolov8_nano,YOLOv8-n,315,main_graph$async_dispatch_192_generic_10x10x3x3x256_i8,,1,,activation,activation,,0,0,0,,,,,,0,0,0,0,0,0,,,,,
yolov8_nano,YOLOv8-n,316,main_graph$async_dispatch_193_matmul_100x64x2304_i8xi8xi32,,1,,encoding_16x16_tile,encoding_16x16_tile,,0,0,0,,,,,,1,0,0,0,0,0,,,,,
yolov8_nano,YOLOv8-n,317,main_graph$async_dispatch_194_matmul_100x80x2304_i8xi8xi32,,1,,encoding_16x16_tile,encoding_16x16_tile,,0,0,0,,,,,,1,0,0,0,0,0,,,,,
yolov8_nano,YOLOv8-n,318,main_graph$async_dispatch_195_slow_memcpy,,1,,elementwise_other,elementwise_other,,0,0,0,,,,,,0,0,0,0,0,0,,,,,
yolov8_nano,YOLOv8-n,319,main_graph$async_dispatch_196_generic_10x10x3x3x64_i8,,1,,activation,activation,,0,0,0,,,,,,0,0,0,0,0,0,,,,,
yolov8_nano,YOLOv8-n,320,main_graph$async_dispatch_197_matmul_100x64x576_i8xi8xi32,,1,,encoding_16x16_tile,encoding_16x16_tile,,0,0,0,,,,,,1,0,0,0,0,0,,,,,
yolov8_nano,YOLOv8-n,321,main_graph$async_dispatch_198_slow_memcpy,,1,,elementwise_other,elementwise_other,,0,0,0,,,,,,0,0,0,0,0,0,,,,,
yolov8_nano,YOLOv8-n,322,main_graph$async_dispatch_199_generic_10x10x3x3x80_i8,,1,,activation,activation,,0,0,0,,,,,,0,0,0,0,0,0,,,,,
yolov8_nano,YOLOv8-n,323,main_graph$async_dispatch_200_matmul_100x80x720_i8xi8xi32,,1,,encoding_16x16_tile,encoding_16x16_tile,,0,0,0,,,,,,1,0,0,0,0,0,,,,,
yolov8_nano,YOLOv8-n,324,main_graph$async_dispatch_201_matmul_100x64x64_i8xi8xi32,,1,,encoding_16x16_tile,encoding_16x16_tile,,0,0,0,,,,,,1,0,0,0,0,0,,,,,
yolov8_nano,YOLOv8-n,325,main_graph$async_dispatch_202_matmul_100x80x80_i8xi8xi32,,1,,encoding_16x16_tile,encoding_16x16_tile,,0,0,0,,,,,,1,0,0,0,0,0,,,,,
yolov8_nano,YOLOv8-n,326,main_graph$async_dispatch_203_slow_memcpy,,1,,elementwise_other,elementwise_other,,0,0,0,,,,,,0,0,0,0,0,0,,,,,
yolov8_nano,YOLOv8-n,327,main_graph$async_dispatch_204_slow_memcpy,,1,,elementwise_other,elementwise_other,,0,0,0,,,,,,0,0,0,0,0,0,,,,,
yolov8_nano,YOLOv8-n,328,main_graph$async_dispatch_205_slow_memcpy,,1,,elementwise_other,elementwise_other,,0,0,0,,,,,,0,0,0,0,0,0,,,,,
yolov8_nano,YOLOv8-n,329,main_graph$async_dispatch_206_slow_memcpy,,1,,elementwise_other,elementwise_other,,0,0,0,,,,,,0,0,0,0,0,0,,,,,
yolov8_nano,YOLOv8-n,330,main_graph$async_dispatch_207_slow_memcpy,,1,,elementwise_other,elementwise_other,,0,0,0,,,,,,0,0,0,0,0,0,,,,,
yolov8_nano,YOLOv8-n,331,main_graph$async_dispatch_208_slow_memcpy,,1,,elementwise_other,elementwise_other,,0,0,0,,,,,,0,0,0,0,0,0,,,,,
yolov8_nano,YOLOv8-n,332,main_graph$async_dispatch_209_elementwise_168000_f32,,1,,activation,activation,,0,0,0,,,,,,0,0,0,0,0,0,,,,,
yolov8_nano,YOLOv8-n,333,main_graph$async_dispatch_210_elementwise_134400_f32xi8,,1,,quantize_f32_to_i8,quantize_f32_to_i8,,0,0,0,,,,,,0,0,0,0,0,0,,,,,
yolov8_nano,YOLOv8-n,334,main_graph$async_dispatch_211_reduction_4x2100x16_f32,,1,,rvv_reduction_softmax_norm,rvv_reduction_softmax_norm,,0,0,0,,,,,,0,0,0,0,0,0,,,,,
yolov8_nano,YOLOv8-n,335,main_graph$async_dispatch_212_reduction_8400x16_f32,,1,,rvv_reduction_softmax_norm,rvv_reduction_softmax_norm,,0,0,0,,,,,,0,0,0,0,0,0,,,,,
yolov8_nano,YOLOv8-n,336,main_graph$async_dispatch_213_matmul_8400x1x16_i8xi8xi32,,1,,encoding_16x16_tile,encoding_16x16_tile,,0,0,0,,,,,,1,0,0,0,0,0,,,,,
yolov8_nano,YOLOv8-n,337,main_graph$async_dispatch_214_elementwise_8400_i32xf32,,1,,dequantize_i8_to_f32,dequantize_i8_to_f32,,0,0,0,,,,,,0,0,0,0,0,0,,,,,
yolov8_nano,YOLOv8-n,338,main_graph$async_dispatch_215_elementwise_2x2100_f32xi8,,1,,quantize_f32_to_i8,quantize_f32_to_i8,,0,0,0,,,,,,0,0,0,0,0,0,,,,,
yolov8_nano,YOLOv8-n,339,main_graph$async_dispatch_216_elementwise_2x2100_f32xf32xi8,,1,,elementwise_other,elementwise_other,,0,0,0,,,,,,0,0,0,0,0,0,,,,,
yolov8_nano,YOLOv8-n,340,main_graph$async_dispatch_217_elementwise_4200_i8,,1,,activation,activation,,0,0,0,,,,,,0,0,0,0,0,0,,,,,
yolov8_nano,YOLOv8-n,341,main_graph$async_dispatch_218_elementwise_4200_f32xf32xi8,,1,,elementwise_other,elementwise_other,,0,0,0,,,,,,0,0,0,0,0,0,,,,,
yolov8_nano,YOLOv8-n,342,main_graph$async_dispatch_219_elementwise_4200_i8xf32,,1,,dequantize_i8_to_f32,dequantize_i8_to_f32,,0,0,0,,,,,,0,0,0,0,0,0,,,,,
yolov8_nano,YOLOv8-n,343,main_graph$async_dispatch_220_elementwise_4200_f32,,1,,activation,activation,,0,0,0,,,,,,0,0,0,0,0,0,,,,,
yolov8_nano,YOLOv8-n,344,main_graph$async_dispatch_221_elementwise_8400_f32xi8,,1,,quantize_f32_to_i8,quantize_f32_to_i8,,0,0,0,,,,,,0,0,0,0,0,0,,,,,
yolov8_nano,YOLOv8-n,345,main_graph$async_dispatch_222_elementwise_4x2100_i8xi8xf32,,1,,elementwise_other,elementwise_other,,0,0,0,,,,,,0,0,0,0,0,0,,,,,
yolov8_nano,YOLOv8-n,346,main_graph$async_dispatch_223_elementwise_176400_f32xi8,,1,,quantize_f32_to_i8,quantize_f32_to_i8,,0,0,0,,,,,,0,0,0,0,0,0,,,,,
yolov8_nano,YOLOv8-n,347,main_graph$async_dispatch_224_elementwise_176400_i8xf32,,1,,dequantize_i8_to_f32,dequantize_i8_to_f32,,0,0,0,,,,,,0,0,0,0,0,0,,,,,
yolov8_nano,YOLOv8-n,348,_encoding_30_encode_16x6400xi8_to_16x6400xi8,,1,,data_movement,data_movement,,0,0,0,,,,,,0,0,0,0,0,0,,,,,
yolov8_nano,YOLOv8-n,349,_encoding_31_encode_32x1600xi8_to_32x1600xi8,,1,,data_movement,data_movement,,0,0,0,,,,,,0,0,0,0,0,0,,,,,
yolov8_nano,YOLOv8-n,350,_encoding_32_encode_64x400xi8_to_64x400xi8,,1,,data_movement,data_movement,,0,0,0,,,,,,0,0,0,0,0,0,,,,,
yolov8_nano,YOLOv8-n,351,_encoding_33_encode_128x100xi8_to_128x100xi8,,1,,data_movement,data_movement,,0,0,0,,,,,,0,0,0,0,0,0,,,,,
yolov8_nano,YOLOv8-n,352,_encoding_34_encode_1600x576xi8_to_1600x576xi8,,1,,data_movement,data_movement,,0,0,0,,,,,,0,0,0,0,0,0,,,,,
yolov8_nano,YOLOv8-n,353,_encoding_35_encode_400x1152xi8_to_400x1152xi8,,1,,data_movement,data_movement,,0,0,0,,,,,,0,0,0,0,0,0,,,,,
yolov8_nano,YOLOv8-n,354,_encoding_36_encode_100x2304xi8_to_100x2304xi8,,1,,data_movement,data_movement,,0,0,0,,,,,,0,0,0,0,0,0,,,,,
opu_bench_vit,ViT,355,_encoding_0_encode_1x1024x1024xi8_to_1x1024x1024xi8,,1,,data_movement,data_movement,,0,0,0,,,,,,0,0,0,0,0,0,,,,,
opu_bench_vit,ViT,356,_encoding_1_encode_1024xi8_to_1024xi8,,1,,data_movement,data_movement,,0,0,0,,,,,,0,0,0,0,0,0,,,,,
opu_bench_vit,ViT,357,_encoding_2_encode_1x1024x4096xi8_to_1x1024x4096xi8,,1,,data_movement,data_movement,,0,0,0,,,,,,0,0,0,0,0,0,,,,,
opu_bench_vit,ViT,358,_encoding_3_encode_4096xi8_to_4096xi8,,1,,data_movement,data_movement,,0,0,0,,,,,,0,0,0,0,0,0,,,,,
opu_bench_vit,ViT,359,_encoding_4_encode_1x4096x1024xi8_to_1x4096x1024xi8,,1,,data_movement,data_movement,,0,0,0,,,,,,0,0,0,0,0,0,,,,,
opu_bench_vit,ViT,360,_encoding_5_encode_1x1024x16xi8_to_1x1024x16xi8,,1,,data_movement,data_movement,,0,0,0,,,,,,0,0,0,0,0,0,,,,,
opu_bench_vit,ViT,361,_encoding_6_encode_16xi8_to_16xi8,,1,,data_movement,data_movement,,0,0,0,,,,,,0,0,0,0,0,0,,,,,
opu_bench_vit,ViT,362,main_graph$async_dispatch_0_elementwise_131072_f32xi8,,1,,quantize_f32_to_i8,quantize_f32_to_i8,,0,0,0,,,,,,0,0,0,0,0,0,,,,,
opu_bench_vit,ViT,363,main_graph$async_dispatch_1_elementwise_131072_i8xf32,,1,,dequantize_i8_to_f32,dequantize_i8_to_f32,,0,0,0,,,,,,0,0,0,0,0,0,,,,,
opu_bench_vit,ViT,364,main_graph$async_dispatch_2_reduction_128x1024_f32,,1,,rvv_reduction_softmax_norm,rvv_reduction_softmax_norm,,0,0,0,,,,,,0,0,0,0,0,0,,,,,
opu_bench_vit,ViT,365,main_graph$async_dispatch_3_reduction_128x1024_f32,,1,,rvv_reduction_softmax_norm,rvv_reduction_softmax_norm,,0,0,0,,,,,,0,0,0,0,0,0,,,,,
opu_bench_vit,ViT,366,main_graph$async_dispatch_4_batch_matmul_1x128x1024x1024_i8xi8xi32,,1,,encoding_32x32_tile,encoding_32x32_tile,,0,0,0,,,,,,4,0,0,0,0,0,,,,,
opu_bench_vit,ViT,367,main_graph$async_dispatch_7_elementwise_131072_i32xi8,,1,,requantize_i32_to_i8,requantize_i32_to_i8,,0,0,0,,,,,,0,0,0,0,0,0,,,,,
opu_bench_vit,ViT,368,main_graph$async_dispatch_8_elementwise_transpose_128x8x128_i8,,1,,transpose_reshape,transpose_reshape,,0,0,0,,,,,,0,0,0,0,0,0,,,,,
opu_bench_vit,ViT,369,main_graph$async_dispatch_9_elementwise_131072_i32xi8,,1,,requantize_i32_to_i8,requantize_i32_to_i8,,0,0,0,,,,,,0,0,0,0,0,0,,,,,
opu_bench_vit,ViT,370,main_graph$async_dispatch_10_elementwise_transpose_128x1024_i8,,1,,transpose_reshape,transpose_reshape,,0,0,0,,,,,,0,0,0,0,0,0,,,,,
opu_bench_vit,ViT,371,main_graph$async_dispatch_11_elementwise_131072_i32xi8,,1,,requantize_i32_to_i8,requantize_i32_to_i8,,0,0,0,,,,,,0,0,0,0,0,0,,,,,
opu_bench_vit,ViT,372,main_graph$async_dispatch_12_elementwise_transpose_128x8x128_i8,,1,,transpose_reshape,transpose_reshape,,0,0,0,,,,,,0,0,0,0,0,0,,,,,
opu_bench_vit,ViT,373,main_graph$async_dispatch_13_batch_matmul_8x128x128x128_i8xi8xi32,,1,,encoding_32x32_tile,encoding_32x32_tile,,0,0,0,,,,,,4,0,0,0,0,0,,,,,
opu_bench_vit,ViT,374,main_graph$async_dispatch_14_softmax_8x128x128xf32_generic,,1,,rvv_reduction_softmax_norm,rvv_reduction_softmax_norm,,0,0,0,,,,,,0,0,0,0,0,0,,,,,
opu_bench_vit,ViT,375,main_graph$async_dispatch_15_batch_matmul_8x128x128x128_i8xi8xi32,,1,,encoding_32x32_tile,encoding_32x32_tile,,0,0,0,,,,,,4,0,0,0,0,0,,,,,
opu_bench_vit,ViT,376,main_graph$async_dispatch_16_batch_matmul_1x128x1024x1024_i8xi8xi32,,1,,encoding_32x32_tile,encoding_32x32_tile,,0,0,0,,,,,,4,0,0,0,0,0,,,,,
opu_bench_vit,ViT,377,main_graph$async_dispatch_17_elementwise_131072_i8xf32,,1,,dequantize_i8_to_f32,dequantize_i8_to_f32,,0,0,0,,,,,,0,0,0,0,0,0,,,,,
opu_bench_vit,ViT,378,main_graph$async_dispatch_18_reduction_128x1024_f32,,1,,rvv_reduction_softmax_norm,rvv_reduction_softmax_norm,,0,0,0,,,,,,0,0,0,0,0,0,,,,,
opu_bench_vit,ViT,379,main_graph$async_dispatch_19_reduction_128x1024_f32,,1,,rvv_reduction_softmax_norm,rvv_reduction_softmax_norm,,0,0,0,,,,,,0,0,0,0,0,0,,,,,
opu_bench_vit,ViT,380,main_graph$async_dispatch_20_batch_matmul_1x128x4096x1024_i8xi8xi32,,1,,encoding_32x32_tile,encoding_32x32_tile,,0,0,0,,,,,,4,0,0,0,0,0,,,,,
opu_bench_vit,ViT,381,main_graph$async_dispatch_21_batch_matmul_1x128x1024x4096_i8xi8xi32,,1,,encoding_32x32_tile,encoding_32x32_tile,,0,0,0,,,,,,4,0,0,0,0,0,,,,,
opu_bench_vit,ViT,382,main_graph$async_dispatch_22_elementwise_131072_i8xf32,,1,,dequantize_i8_to_f32,dequantize_i8_to_f32,,0,0,0,,,,,,0,0,0,0,0,0,,,,,
opu_bench_vit,ViT,383,main_graph$async_dispatch_23_reduction_128x1024_f32,,1,,rvv_reduction_softmax_norm,rvv_reduction_softmax_norm,,0,0,0,,,,,,0,0,0,0,0,0,,,,,
opu_bench_vit,ViT,384,main_graph$async_dispatch_24_reduction_128x1024_f32,,1,,rvv_reduction_softmax_norm,rvv_reduction_softmax_norm,,0,0,0,,,,,,0,0,0,0,0,0,,,,,
opu_bench_vit,ViT,385,main_graph$async_dispatch_28_elementwise_131072_i32xi8,,1,,requantize_i32_to_i8,requantize_i32_to_i8,,0,0,0,,,,,,0,0,0,0,0,0,,,,,
opu_bench_vit,ViT,386,main_graph$async_dispatch_29_elementwise_transpose_128x8x128_i8,,1,,transpose_reshape,transpose_reshape,,0,0,0,,,,,,0,0,0,0,0,0,,,,,
opu_bench_vit,ViT,387,main_graph$async_dispatch_30_elementwise_131072_i32xi8,,1,,requantize_i32_to_i8,requantize_i32_to_i8,,0,0,0,,,,,,0,0,0,0,0,0,,,,,
opu_bench_vit,ViT,388,main_graph$async_dispatch_31_elementwise_transpose_128x1024_i8,,1,,transpose_reshape,transpose_reshape,,0,0,0,,,,,,0,0,0,0,0,0,,,,,
opu_bench_vit,ViT,389,main_graph$async_dispatch_32_elementwise_131072_i32xi8,,1,,requantize_i32_to_i8,requantize_i32_to_i8,,0,0,0,,,,,,0,0,0,0,0,0,,,,,
opu_bench_vit,ViT,390,main_graph$async_dispatch_33_elementwise_transpose_128x8x128_i8,,1,,transpose_reshape,transpose_reshape,,0,0,0,,,,,,0,0,0,0,0,0,,,,,
opu_bench_vit,ViT,391,main_graph$async_dispatch_34_batch_matmul_8x128x128x128_i8xi8xi32,,1,,encoding_32x32_tile,encoding_32x32_tile,,0,0,0,,,,,,4,0,0,0,0,0,,,,,
opu_bench_vit,ViT,392,main_graph$async_dispatch_36_batch_matmul_8x128x128x128_i8xi8xi32,,1,,encoding_32x32_tile,encoding_32x32_tile,,0,0,0,,,,,,4,0,0,0,0,0,,,,,
opu_bench_vit,ViT,393,main_graph$async_dispatch_37_batch_matmul_1x128x1024x1024_i8xi8xi32,,1,,encoding_32x32_tile,encoding_32x32_tile,,0,0,0,,,,,,4,0,0,0,0,0,,,,,
opu_bench_vit,ViT,394,main_graph$async_dispatch_38_elementwise_131072_i8xf32,,1,,dequantize_i8_to_f32,dequantize_i8_to_f32,,0,0,0,,,,,,0,0,0,0,0,0,,,,,
opu_bench_vit,ViT,395,main_graph$async_dispatch_39_reduction_128x1024_f32,,1,,rvv_reduction_softmax_norm,rvv_reduction_softmax_norm,,0,0,0,,,,,,0,0,0,0,0,0,,,,,
opu_bench_vit,ViT,396,main_graph$async_dispatch_40_reduction_128x1024_f32,,1,,rvv_reduction_softmax_norm,rvv_reduction_softmax_norm,,0,0,0,,,,,,0,0,0,0,0,0,,,,,
opu_bench_vit,ViT,397,main_graph$async_dispatch_41_batch_matmul_1x128x4096x1024_i8xi8xi32,,1,,encoding_32x32_tile,encoding_32x32_tile,,0,0,0,,,,,,4,0,0,0,0,0,,,,,
opu_bench_vit,ViT,398,main_graph$async_dispatch_42_batch_matmul_1x128x1024x4096_i8xi8xi32,,1,,encoding_32x32_tile,encoding_32x32_tile,,0,0,0,,,,,,4,0,0,0,0,0,,,,,
opu_bench_vit,ViT,399,main_graph$async_dispatch_43_elementwise_131072_i8xf32,,1,,dequantize_i8_to_f32,dequantize_i8_to_f32,,0,0,0,,,,,,0,0,0,0,0,0,,,,,
opu_bench_vit,ViT,400,main_graph$async_dispatch_44_reduction_128x1024_f32,,1,,rvv_reduction_softmax_norm,rvv_reduction_softmax_norm,,0,0,0,,,,,,0,0,0,0,0,0,,,,,
opu_bench_vit,ViT,401,main_graph$async_dispatch_45_reduction_128x1024_f32,,1,,rvv_reduction_softmax_norm,rvv_reduction_softmax_norm,,0,0,0,,,,,,0,0,0,0,0,0,,,,,
opu_bench_vit,ViT,402,main_graph$async_dispatch_49_elementwise_131072_i32xi8,,1,,requantize_i32_to_i8,requantize_i32_to_i8,,0,0,0,,,,,,0,0,0,0,0,0,,,,,
opu_bench_vit,ViT,403,main_graph$async_dispatch_50_elementwise_transpose_128x8x128_i8,,1,,transpose_reshape,transpose_reshape,,0,0,0,,,,,,0,0,0,0,0,0,,,,,
opu_bench_vit,ViT,404,main_graph$async_dispatch_51_elementwise_131072_i32xi8,,1,,requantize_i32_to_i8,requantize_i32_to_i8,,0,0,0,,,,,,0,0,0,0,0,0,,,,,
opu_bench_vit,ViT,405,main_graph$async_dispatch_52_elementwise_transpose_128x1024_i8,,1,,transpose_reshape,transpose_reshape,,0,0,0,,,,,,0,0,0,0,0,0,,,,,
opu_bench_vit,ViT,406,main_graph$async_dispatch_53_elementwise_131072_i32xi8,,1,,requantize_i32_to_i8,requantize_i32_to_i8,,0,0,0,,,,,,0,0,0,0,0,0,,,,,
opu_bench_vit,ViT,407,main_graph$async_dispatch_54_elementwise_transpose_128x8x128_i8,,1,,transpose_reshape,transpose_reshape,,0,0,0,,,,,,0,0,0,0,0,0,,,,,
opu_bench_vit,ViT,408,main_graph$async_dispatch_55_batch_matmul_8x128x128x128_i8xi8xi32,,1,,encoding_32x32_tile,encoding_32x32_tile,,0,0,0,,,,,,4,0,0,0,0,0,,,,,
opu_bench_vit,ViT,409,main_graph$async_dispatch_57_batch_matmul_8x128x128x128_i8xi8xi32,,1,,encoding_32x32_tile,encoding_32x32_tile,,0,0,0,,,,,,4,0,0,0,0,0,,,,,
opu_bench_vit,ViT,410,main_graph$async_dispatch_58_batch_matmul_1x128x1024x1024_i8xi8xi32,,1,,encoding_32x32_tile,encoding_32x32_tile,,0,0,0,,,,,,4,0,0,0,0,0,,,,,
opu_bench_vit,ViT,411,main_graph$async_dispatch_59_elementwise_131072_i8xf32,,1,,dequantize_i8_to_f32,dequantize_i8_to_f32,,0,0,0,,,,,,0,0,0,0,0,0,,,,,
opu_bench_vit,ViT,412,main_graph$async_dispatch_60_reduction_128x1024_f32,,1,,rvv_reduction_softmax_norm,rvv_reduction_softmax_norm,,0,0,0,,,,,,0,0,0,0,0,0,,,,,
opu_bench_vit,ViT,413,main_graph$async_dispatch_61_reduction_128x1024_f32,,1,,rvv_reduction_softmax_norm,rvv_reduction_softmax_norm,,0,0,0,,,,,,0,0,0,0,0,0,,,,,
opu_bench_vit,ViT,414,main_graph$async_dispatch_62_batch_matmul_1x128x4096x1024_i8xi8xi32,,1,,encoding_32x32_tile,encoding_32x32_tile,,0,0,0,,,,,,4,0,0,0,0,0,,,,,
opu_bench_vit,ViT,415,main_graph$async_dispatch_63_batch_matmul_1x128x1024x4096_i8xi8xi32,,1,,encoding_32x32_tile,encoding_32x32_tile,,0,0,0,,,,,,4,0,0,0,0,0,,,,,
opu_bench_vit,ViT,416,main_graph$async_dispatch_64_elementwise_131072_i8xf32,,1,,dequantize_i8_to_f32,dequantize_i8_to_f32,,0,0,0,,,,,,0,0,0,0,0,0,,,,,
opu_bench_vit,ViT,417,main_graph$async_dispatch_65_reduction_128x1024_f32,,1,,rvv_reduction_softmax_norm,rvv_reduction_softmax_norm,,0,0,0,,,,,,0,0,0,0,0,0,,,,,
opu_bench_vit,ViT,418,main_graph$async_dispatch_66_reduction_128x1024_f32,,1,,rvv_reduction_softmax_norm,rvv_reduction_softmax_norm,,0,0,0,,,,,,0,0,0,0,0,0,,,,,
opu_bench_vit,ViT,419,main_graph$async_dispatch_70_elementwise_131072_i32xi8,,1,,requantize_i32_to_i8,requantize_i32_to_i8,,0,0,0,,,,,,0,0,0,0,0,0,,,,,
opu_bench_vit,ViT,420,main_graph$async_dispatch_71_elementwise_transpose_128x8x128_i8,,1,,transpose_reshape,transpose_reshape,,0,0,0,,,,,,0,0,0,0,0,0,,,,,
opu_bench_vit,ViT,421,main_graph$async_dispatch_72_elementwise_131072_i32xi8,,1,,requantize_i32_to_i8,requantize_i32_to_i8,,0,0,0,,,,,,0,0,0,0,0,0,,,,,
opu_bench_vit,ViT,422,main_graph$async_dispatch_73_elementwise_transpose_128x1024_i8,,1,,transpose_reshape,transpose_reshape,,0,0,0,,,,,,0,0,0,0,0,0,,,,,
opu_bench_vit,ViT,423,main_graph$async_dispatch_74_elementwise_131072_i32xi8,,1,,requantize_i32_to_i8,requantize_i32_to_i8,,0,0,0,,,,,,0,0,0,0,0,0,,,,,
opu_bench_vit,ViT,424,main_graph$async_dispatch_75_elementwise_transpose_128x8x128_i8,,1,,transpose_reshape,transpose_reshape,,0,0,0,,,,,,0,0,0,0,0,0,,,,,
opu_bench_vit,ViT,425,main_graph$async_dispatch_76_batch_matmul_8x128x128x128_i8xi8xi32,,1,,encoding_32x32_tile,encoding_32x32_tile,,0,0,0,,,,,,4,0,0,0,0,0,,,,,
opu_bench_vit,ViT,426,main_graph$async_dispatch_78_batch_matmul_8x128x128x128_i8xi8xi32,,1,,encoding_32x32_tile,encoding_32x32_tile,,0,0,0,,,,,,4,0,0,0,0,0,,,,,
opu_bench_vit,ViT,427,main_graph$async_dispatch_79_batch_matmul_1x128x1024x1024_i8xi8xi32,,1,,encoding_32x32_tile,encoding_32x32_tile,,0,0,0,,,,,,4,0,0,0,0,0,,,,,
opu_bench_vit,ViT,428,main_graph$async_dispatch_80_elementwise_131072_i8xf32,,1,,dequantize_i8_to_f32,dequantize_i8_to_f32,,0,0,0,,,,,,0,0,0,0,0,0,,,,,
opu_bench_vit,ViT,429,main_graph$async_dispatch_81_reduction_128x1024_f32,,1,,rvv_reduction_softmax_norm,rvv_reduction_softmax_norm,,0,0,0,,,,,,0,0,0,0,0,0,,,,,
opu_bench_vit,ViT,430,main_graph$async_dispatch_82_reduction_128x1024_f32,,1,,rvv_reduction_softmax_norm,rvv_reduction_softmax_norm,,0,0,0,,,,,,0,0,0,0,0,0,,,,,
opu_bench_vit,ViT,431,main_graph$async_dispatch_83_batch_matmul_1x128x4096x1024_i8xi8xi32,,1,,encoding_32x32_tile,encoding_32x32_tile,,0,0,0,,,,,,4,0,0,0,0,0,,,,,
opu_bench_vit,ViT,432,main_graph$async_dispatch_84_batch_matmul_1x128x1024x4096_i8xi8xi32,,1,,encoding_32x32_tile,encoding_32x32_tile,,0,0,0,,,,,,4,0,0,0,0,0,,,,,
opu_bench_vit,ViT,433,main_graph$async_dispatch_85_elementwise_131072_i8xf32,,1,,dequantize_i8_to_f32,dequantize_i8_to_f32,,0,0,0,,,,,,0,0,0,0,0,0,,,,,
opu_bench_vit,ViT,434,main_graph$async_dispatch_86_reduction_128x1024_f32,,1,,rvv_reduction_softmax_norm,rvv_reduction_softmax_norm,,0,0,0,,,,,,0,0,0,0,0,0,,,,,
opu_bench_vit,ViT,435,main_graph$async_dispatch_87_reduction_128x1024_f32,,1,,rvv_reduction_softmax_norm,rvv_reduction_softmax_norm,,0,0,0,,,,,,0,0,0,0,0,0,,,,,
opu_bench_vit,ViT,436,main_graph$async_dispatch_91_elementwise_131072_i32xi8,,1,,requantize_i32_to_i8,requantize_i32_to_i8,,0,0,0,,,,,,0,0,0,0,0,0,,,,,
opu_bench_vit,ViT,437,main_graph$async_dispatch_92_elementwise_transpose_128x8x128_i8,,1,,transpose_reshape,transpose_reshape,,0,0,0,,,,,,0,0,0,0,0,0,,,,,
opu_bench_vit,ViT,438,main_graph$async_dispatch_93_elementwise_131072_i32xi8,,1,,requantize_i32_to_i8,requantize_i32_to_i8,,0,0,0,,,,,,0,0,0,0,0,0,,,,,
opu_bench_vit,ViT,439,main_graph$async_dispatch_94_elementwise_transpose_128x1024_i8,,1,,transpose_reshape,transpose_reshape,,0,0,0,,,,,,0,0,0,0,0,0,,,,,
opu_bench_vit,ViT,440,main_graph$async_dispatch_95_elementwise_131072_i32xi8,,1,,requantize_i32_to_i8,requantize_i32_to_i8,,0,0,0,,,,,,0,0,0,0,0,0,,,,,
opu_bench_vit,ViT,441,main_graph$async_dispatch_96_elementwise_transpose_128x8x128_i8,,1,,transpose_reshape,transpose_reshape,,0,0,0,,,,,,0,0,0,0,0,0,,,,,
opu_bench_vit,ViT,442,main_graph$async_dispatch_97_batch_matmul_8x128x128x128_i8xi8xi32,,1,,encoding_32x32_tile,encoding_32x32_tile,,0,0,0,,,,,,4,0,0,0,0,0,,,,,
opu_bench_vit,ViT,443,main_graph$async_dispatch_99_batch_matmul_8x128x128x128_i8xi8xi32,,1,,encoding_32x32_tile,encoding_32x32_tile,,0,0,0,,,,,,4,0,0,0,0,0,,,,,
opu_bench_vit,ViT,444,main_graph$async_dispatch_100_batch_matmul_1x128x1024x1024_i8xi8xi32,,1,,encoding_32x32_tile,encoding_32x32_tile,,0,0,0,,,,,,4,0,0,0,0,0,,,,,
opu_bench_vit,ViT,445,main_graph$async_dispatch_101_elementwise_131072_i8xf32,,1,,dequantize_i8_to_f32,dequantize_i8_to_f32,,0,0,0,,,,,,0,0,0,0,0,0,,,,,
opu_bench_vit,ViT,446,main_graph$async_dispatch_102_reduction_128x1024_f32,,1,,rvv_reduction_softmax_norm,rvv_reduction_softmax_norm,,0,0,0,,,,,,0,0,0,0,0,0,,,,,
opu_bench_vit,ViT,447,main_graph$async_dispatch_103_reduction_128x1024_f32,,1,,rvv_reduction_softmax_norm,rvv_reduction_softmax_norm,,0,0,0,,,,,,0,0,0,0,0,0,,,,,
opu_bench_vit,ViT,448,main_graph$async_dispatch_104_batch_matmul_1x128x4096x1024_i8xi8xi32,,1,,encoding_32x32_tile,encoding_32x32_tile,,0,0,0,,,,,,4,0,0,0,0,0,,,,,
opu_bench_vit,ViT,449,main_graph$async_dispatch_105_batch_matmul_1x128x1024x4096_i8xi8xi32,,1,,encoding_32x32_tile,encoding_32x32_tile,,0,0,0,,,,,,4,0,0,0,0,0,,,,,
opu_bench_vit,ViT,450,main_graph$async_dispatch_106_elementwise_131072_i8xf32,,1,,dequantize_i8_to_f32,dequantize_i8_to_f32,,0,0,0,,,,,,0,0,0,0,0,0,,,,,
opu_bench_vit,ViT,451,main_graph$async_dispatch_107_reduction_128x1024_f32,,1,,rvv_reduction_softmax_norm,rvv_reduction_softmax_norm,,0,0,0,,,,,,0,0,0,0,0,0,,,,,
opu_bench_vit,ViT,452,main_graph$async_dispatch_108_reduction_128x1024_f32,,1,,rvv_reduction_softmax_norm,rvv_reduction_softmax_norm,,0,0,0,,,,,,0,0,0,0,0,0,,,,,
opu_bench_vit,ViT,453,main_graph$async_dispatch_112_elementwise_131072_i32xi8,,1,,requantize_i32_to_i8,requantize_i32_to_i8,,0,0,0,,,,,,0,0,0,0,0,0,,,,,
opu_bench_vit,ViT,454,main_graph$async_dispatch_113_elementwise_transpose_128x8x128_i8,,1,,transpose_reshape,transpose_reshape,,0,0,0,,,,,,0,0,0,0,0,0,,,,,
opu_bench_vit,ViT,455,main_graph$async_dispatch_114_elementwise_131072_i32xi8,,1,,requantize_i32_to_i8,requantize_i32_to_i8,,0,0,0,,,,,,0,0,0,0,0,0,,,,,
opu_bench_vit,ViT,456,main_graph$async_dispatch_115_elementwise_transpose_128x1024_i8,,1,,transpose_reshape,transpose_reshape,,0,0,0,,,,,,0,0,0,0,0,0,,,,,
opu_bench_vit,ViT,457,main_graph$async_dispatch_116_elementwise_131072_i32xi8,,1,,requantize_i32_to_i8,requantize_i32_to_i8,,0,0,0,,,,,,0,0,0,0,0,0,,,,,
opu_bench_vit,ViT,458,main_graph$async_dispatch_117_elementwise_transpose_128x8x128_i8,,1,,transpose_reshape,transpose_reshape,,0,0,0,,,,,,0,0,0,0,0,0,,,,,
opu_bench_vit,ViT,459,main_graph$async_dispatch_118_batch_matmul_8x128x128x128_i8xi8xi32,,1,,encoding_32x32_tile,encoding_32x32_tile,,0,0,0,,,,,,4,0,0,0,0,0,,,,,
opu_bench_vit,ViT,460,main_graph$async_dispatch_120_batch_matmul_8x128x128x128_i8xi8xi32,,1,,encoding_32x32_tile,encoding_32x32_tile,,0,0,0,,,,,,4,0,0,0,0,0,,,,,
opu_bench_vit,ViT,461,main_graph$async_dispatch_121_batch_matmul_1x128x1024x1024_i8xi8xi32,,1,,encoding_32x32_tile,encoding_32x32_tile,,0,0,0,,,,,,4,0,0,0,0,0,,,,,
opu_bench_vit,ViT,462,main_graph$async_dispatch_122_elementwise_131072_i8xf32,,1,,dequantize_i8_to_f32,dequantize_i8_to_f32,,0,0,0,,,,,,0,0,0,0,0,0,,,,,
opu_bench_vit,ViT,463,main_graph$async_dispatch_123_reduction_128x1024_f32,,1,,rvv_reduction_softmax_norm,rvv_reduction_softmax_norm,,0,0,0,,,,,,0,0,0,0,0,0,,,,,
opu_bench_vit,ViT,464,main_graph$async_dispatch_124_reduction_128x1024_f32,,1,,rvv_reduction_softmax_norm,rvv_reduction_softmax_norm,,0,0,0,,,,,,0,0,0,0,0,0,,,,,
opu_bench_vit,ViT,465,main_graph$async_dispatch_125_batch_matmul_1x128x4096x1024_i8xi8xi32,,1,,encoding_32x32_tile,encoding_32x32_tile,,0,0,0,,,,,,4,0,0,0,0,0,,,,,
opu_bench_vit,ViT,466,main_graph$async_dispatch_126_batch_matmul_1x128x1024x4096_i8xi8xi32,,1,,encoding_32x32_tile,encoding_32x32_tile,,0,0,0,,,,,,4,0,0,0,0,0,,,,,
opu_bench_vit,ViT,467,main_graph$async_dispatch_127_batch_matmul_1x128x16x1024_i8xi8xi32,,1,,encoding_32x32_tile,encoding_32x32_tile,,0,0,0,,,,,,4,0,0,0,0,0,,,,,
opu_bench_vit,ViT,468,_encoding_7_encode_1x128x1024xi8_to_1x128x1024xi8,,1,,data_movement,data_movement,,0,0,0,,,,,,0,0,0,0,0,0,,,,,
opu_bench_vit,ViT,469,_encoding_8_encode_8x128x128xi8_to_8x128x128xi8,,1,,data_movement,data_movement,,0,0,0,,,,,,0,0,0,0,0,0,,,,,
mlp_wide,MLP-Wide,470,_encoding_0_encode_32x16xi8_to_32x16xi8,,1,,data_movement,data_movement,,0,0,0,,,,,,0,0,0,0,0,0,,,,,
mlp_wide,MLP-Wide,471,_encoding_1_encode_32xf32_to_32xf32,,1,,data_movement,data_movement,,0,0,0,,,,,,0,0,0,0,0,0,,,,,
mlp_wide,MLP-Wide,472,_encoding_2_encode_32x32xi8_to_32x32xi8,,1,,data_movement,data_movement,,0,0,0,,,,,,0,0,0,0,0,0,,,,,
mlp_wide,MLP-Wide,473,_encoding_3_encode_16x32xi8_to_16x32xi8,,1,,data_movement,data_movement,,0,0,0,,,,,,0,0,0,0,0,0,,,,,
mlp_wide,MLP-Wide,474,_encoding_4_encode_16xf32_to_16xf32,,1,,data_movement,data_movement,,0,0,0,,,,,,0,0,0,0,0,0,,,,,
mlp_wide,MLP-Wide,475,main_graph$async_dispatch_0_elementwise_256_f32xi8,,1,,quantize_f32_to_i8,quantize_f32_to_i8,,0,0,0,,,,,,0,0,0,0,0,0,,,,,
mlp_wide,MLP-Wide,476,main_graph$async_dispatch_1_matmul_like_16x32x16_i8xi8xi32,,1,,encoding_16x16_tile,encoding_16x16_tile,,0,0,0,,,,,,1,0,0,0,0,0,,,,,
mlp_wide,MLP-Wide,477,main_graph$async_dispatch_2_matmul_like_16x32x32_i8xi8xi32,,1,,encoding_16x16_tile,encoding_16x16_tile,,0,0,0,,,,,,1,0,0,0,0,0,,,,,
mlp_wide,MLP-Wide,478,main_graph$async_dispatch_3_matmul_like_16x16x32_i8xi8xi32,,1,,encoding_32x32_tile,encoding_32x32_tile,,0,0,0,,,,,,4,0,0,0,0,0,,,,,
mlp_wide,MLP-Wide,479,main_graph$async_dispatch_4_elementwise_256_i8xf32,,1,,dequantize_i8_to_f32,dequantize_i8_to_f32,,0,0,0,,,,,,0,0,0,0,0,0,,,,,
mlp_fast,MLP-Fast,480,_encoding_0_encode_1024x128xi8_to_1024x128xi8,,1,,data_movement,data_movement,,0,0,0,,,,,,0,0,0,0,0,0,,,,,
mlp_fast,MLP-Fast,481,_encoding_1_encode_1024xf32_to_1024xf32,,1,,data_movement,data_movement,,0,0,0,,,,,,0,0,0,0,0,0,,,,,
mlp_fast,MLP-Fast,482,_encoding_2_encode_1024x1024xi8_to_1024x1024xi8,,1,,data_movement,data_movement,,0,0,0,,,,,,0,0,0,0,0,0,,,,,
mlp_fast,MLP-Fast,483,_encoding_3_encode_16x1024xi8_to_16x1024xi8,,1,,data_movement,data_movement,,0,0,0,,,,,,0,0,0,0,0,0,,,,,
mlp_fast,MLP-Fast,484,_encoding_4_encode_16xf32_to_16xf32,,1,,data_movement,data_movement,,0,0,0,,,,,,0,0,0,0,0,0,,,,,
mlp_fast,MLP-Fast,485,main_graph$async_dispatch_0_elementwise_16384_f32xi8,,1,,quantize_f32_to_i8,quantize_f32_to_i8,,0,0,0,,,,,,0,0,0,0,0,0,,,,,
mlp_fast,MLP-Fast,486,main_graph$async_dispatch_1_matmul_128x1024x128_i8xi8xi32,,1,,encoding_16x16_tile,encoding_16x16_tile,,0,0,0,,,,,,1,0,0,0,0,0,,,,,
mlp_fast,MLP-Fast,487,main_graph$async_dispatch_2_matmul_128x1024x1024_i8xi8xi32,,1,,encoding_16x16_tile,encoding_16x16_tile,,0,0,0,,,,,,1,0,0,0,0,0,,,,,
mlp_fast,MLP-Fast,488,main_graph$async_dispatch_3_matmul_128x1024x1024_i8xi8xi32,,1,,encoding_16x16_tile,encoding_16x16_tile,,0,0,0,,,,,,1,0,0,0,0,0,,,,,
mlp_fast,MLP-Fast,489,main_graph$async_dispatch_4_matmul_128x16x1024_i8xi8xi32,,1,,encoding_16x16_tile,encoding_16x16_tile,,0,0,0,,,,,,1,0,0,0,0,0,,,,,
mlp_fast,MLP-Fast,490,main_graph$async_dispatch_5_elementwise_2048_i8xf32,,1,,dequantize_i8_to_f32,dequantize_i8_to_f32,,0,0,0,,,,,,0,0,0,0,0,0,,,,,
tinyllama,TinyLlama,491,_encoding_0_encode_1x2048x2048xi8_to_1x2048x2048xi8,,1,,data_movement,data_movement,,0,0,0,,,,,,0,0,0,0,0,0,,,,,
tinyllama,TinyLlama,492,_encoding_1_encode_1x2048x256xi8_to_1x2048x256xi8,,1,,data_movement,data_movement,,0,0,0,,,,,,0,0,0,0,0,0,,,,,
tinyllama,TinyLlama,493,_encoding_2_encode_1x2048x5632xi8_to_1x2048x5632xi8,,1,,data_movement,data_movement,,0,0,0,,,,,,0,0,0,0,0,0,,,,,
tinyllama,TinyLlama,494,_encoding_3_encode_1x5632x2048xi8_to_1x5632x2048xi8,,1,,data_movement,data_movement,,0,0,0,,,,,,0,0,0,0,0,0,,,,,
tinyllama,TinyLlama,495,_encoding_4_encode_1x2048x32000xi8_to_1x2048x32000xi8,,1,,data_movement,data_movement,,0,0,0,,,,,,0,0,0,0,0,0,,,,,
tinyllama,TinyLlama,496,main_graph$async_dispatch_0_elementwise_128_i64xi1,,1,,elementwise_other,elementwise_other,,0,0,0,,,,,,0,0,0,0,0,0,,,,,
tinyllama,TinyLlama,497,main_graph$async_dispatch_1_elementwise_broadcast_128x2048_i64xi8,,1,,elementwise_other,elementwise_other,,0,0,0,,,,,,0,0,0,0,0,0,,,,,
tinyllama,TinyLlama,498,main_graph$async_dispatch_2_elementwise_262144_i8xf32,,1,,dequantize_i8_to_f32,dequantize_i8_to_f32,,0,0,0,,,,,,0,0,0,0,0,0,,,,,
tinyllama,TinyLlama,499,main_graph$async_dispatch_3_elementwise_128x128_i1xi64xi8,,1,,elementwise_other,elementwise_other,,0,0,0,,,,,,0,0,0,0,0,0,,,,,
tinyllama,TinyLlama,500,main_graph$async_dispatch_4_reduction_128x2048_f32,,1,,rvv_reduction_softmax_norm,rvv_reduction_softmax_norm,,0,0,0,,,,,,0,0,0,0,0,0,,,,,
tinyllama,TinyLlama,501,main_graph$async_dispatch_5_elementwise_128_i8xf32xf32,,1,,elementwise_other,elementwise_other,,0,0,0,,,,,,0,0,0,0,0,0,,,,,
tinyllama,TinyLlama,502,main_graph$async_dispatch_6_elementwise_128x2048_f32xf32xi8,,1,,elementwise_other,elementwise_other,,0,0,0,,,,,,0,0,0,0,0,0,,,,,
tinyllama,TinyLlama,503,main_graph$async_dispatch_7_elementwise_128x2048_i8,,1,,activation,activation,,0,0,0,,,,,,0,0,0,0,0,0,,,,,
tinyllama,TinyLlama,504,main_graph$async_dispatch_8_batch_matmul_1x128x2048x2048_i8xi8xi32,,1,,encoding_32x32_tile,encoding_32x32_tile,,0,0,0,,,,,,4,0,0,0,0,0,,,,,
tinyllama,TinyLlama,505,main_graph$async_dispatch_9_batch_matmul_1x128x256x2048_i8xi8xi32,,1,,encoding_32x32_tile,encoding_32x32_tile,,0,0,0,,,,,,4,0,0,0,0,0,,,,,
tinyllama,TinyLlama,506,main_graph$async_dispatch_11_elementwise_262144_i32xi8,,1,,requantize_i32_to_i8,requantize_i32_to_i8,,0,0,0,,,,,,0,0,0,0,0,0,,,,,
tinyllama,TinyLlama,507,main_graph$async_dispatch_12_transpose_128x32x64_f32,,1,,elementwise_other,elementwise_other,,0,0,0,,,,,,0,0,0,0,0,0,,,,,
tinyllama,TinyLlama,508,main_graph$async_dispatch_13_elementwise_32768_i32xi8,,1,,requantize_i32_to_i8,requantize_i32_to_i8,,0,0,0,,,,,,0,0,0,0,0,0,,,,,
tinyllama,TinyLlama,509,main_graph$async_dispatch_14_transpose_128x4x64_f32,,1,,elementwise_other,elementwise_other,,0,0,0,,,,,,0,0,0,0,0,0,,,,,
tinyllama,TinyLlama,510,main_graph$async_dispatch_15_elementwise_32x128x32_f32xi8,,1,,quantize_f32_to_i8,quantize_f32_to_i8,,0,0,0,,,,,,0,0,0,0,0,0,,,,,
tinyllama,TinyLlama,511,main_graph$async_dispatch_16_elementwise_4x128x32_f32xi8,,1,,quantize_f32_to_i8,quantize_f32_to_i8,,0,0,0,,,,,,0,0,0,0,0,0,,,,,
tinyllama,TinyLlama,512,main_graph$async_dispatch_17_elementwise_131072_i8xf32,,1,,dequantize_i8_to_f32,dequantize_i8_to_f32,,0,0,0,,,,,,0,0,0,0,0,0,,,,,
tinyllama,TinyLlama,513,main_graph$async_dispatch_18_elementwise_16384_i8xf32,,1,,dequantize_i8_to_f32,dequantize_i8_to_f32,,0,0,0,,,,,,0,0,0,0,0,0,,,,,
tinyllama,TinyLlama,514,main_graph$async_dispatch_19_elementwise_32x128x32_f32,,1,,activation,activation,,0,0,0,,,,,,0,0,0,0,0,0,,,,,
tinyllama,TinyLlama,515,main_graph$async_dispatch_20_elementwise_4x128x32_f32,,1,,activation,activation,,0,0,0,,,,,,0,0,0,0,0,0,,,,,
tinyllama,TinyLlama,516,main_graph$async_dispatch_21_elementwise_broadcast_4x8x128x64_i32xi8,,1,,requantize_i32_to_i8,requantize_i32_to_i8,,0,0,0,,,,,,0,0,0,0,0,0,,,,,
tinyllama,TinyLlama,517,main_graph$async_dispatch_22_slow_memcpy,,1,,elementwise_other,elementwise_other,,0,0,0,,,,,,0,0,0,0,0,0,,,,,
tinyllama,TinyLlama,518,main_graph$async_dispatch_23_slow_memcpy,,1,,elementwise_other,elementwise_other,,0,0,0,,,,,,0,0,0,0,0,0,,,,,
tinyllama,TinyLlama,519,main_graph$async_dispatch_24_slow_memcpy,,1,,elementwise_other,elementwise_other,,0,0,0,,,,,,0,0,0,0,0,0,,,,,
tinyllama,TinyLlama,520,main_graph$async_dispatch_25_slow_memcpy,,1,,elementwise_other,elementwise_other,,0,0,0,,,,,,0,0,0,0,0,0,,,,,
tinyllama,TinyLlama,521,main_graph$async_dispatch_26_elementwise_32768_f32xi8,,1,,quantize_f32_to_i8,quantize_f32_to_i8,,0,0,0,,,,,,0,0,0,0,0,0,,,,,
tinyllama,TinyLlama,522,main_graph$async_dispatch_27_elementwise_transpose_32x128x64_f32xf32xf32xf32xi8,,1,,elementwise_multi_dtype,elementwise_multi_dtype,,0,0,0,,,,,,0,0,0,0,0,0,,,,,
tinyllama,TinyLlama,523,main_graph$async_dispatch_28_elementwise_262144_i8xf32xi8,,1,,elementwise_other,elementwise_other,,0,0,0,,,,,,0,0,0,0,0,0,,,,,
tinyllama,TinyLlama,524,main_graph$async_dispatch_29_elementwise_broadcast_4x8x128x64_f32xf32xi8xf32xf32xi8,,1,,elementwise_multi_dtype,elementwise_multi_dtype,,0,0,0,,,,,,0,0,0,0,0,0,,,,,
tinyllama,TinyLlama,525,main_graph$async_dispatch_30_batch_matmul_32x128x128x64_i8xi8xi32,,1,,encoding_32x32_tile,encoding_32x32_tile,,0,0,0,,,,,,4,0,0,0,0,0,,,,,
tinyllama,TinyLlama,526,main_graph$async_dispatch_31_softmax_32x128x128xf32_generic,,1,,rvv_reduction_softmax_norm,rvv_reduction_softmax_norm,,0,0,0,,,,,,0,0,0,0,0,0,,,,,
tinyllama,TinyLlama,527,main_graph$async_dispatch_32_batch_matmul_32x128x64x128_i8xi8xi32,,1,,encoding_32x32_tile,encoding_32x32_tile,,0,0,0,,,,,,4,0,0,0,0,0,,,,,
tinyllama,TinyLlama,528,main_graph$async_dispatch_33_batch_matmul_1x128x2048x2048_i8xi8xi32,,1,,encoding_32x32_tile,encoding_32x32_tile,,0,0,0,,,,,,4,0,0,0,0,0,,,,,
tinyllama,TinyLlama,529,main_graph$async_dispatch_34_elementwise_262144_i8xf32,,1,,dequantize_i8_to_f32,dequantize_i8_to_f32,,0,0,0,,,,,,0,0,0,0,0,0,,,,,
tinyllama,TinyLlama,530,main_graph$async_dispatch_35_reduction_128x2048_f32,,1,,rvv_reduction_softmax_norm,rvv_reduction_softmax_norm,,0,0,0,,,,,,0,0,0,0,0,0,,,,,
tinyllama,TinyLlama,531,main_graph$async_dispatch_36_elementwise_128_i8xf32xf32,,1,,elementwise_other,elementwise_other,,0,0,0,,,,,,0,0,0,0,0,0,,,,,
tinyllama,TinyLlama,532,main_graph$async_dispatch_37_elementwise_128x2048_f32xf32xi8,,1,,elementwise_other,elementwise_other,,0,0,0,,,,,,0,0,0,0,0,0,,,,,
tinyllama,TinyLlama,533,main_graph$async_dispatch_38_elementwise_128x2048_i8,,1,,activation,activation,,0,0,0,,,,,,0,0,0,0,0,0,,,,,
tinyllama,TinyLlama,534,main_graph$async_dispatch_39_batch_matmul_1x128x5632x2048_i8xi8xi32,,1,,encoding_32x32_tile,encoding_32x32_tile,,0,0,0,,,,,,4,0,0,0,0,0,,,,,
tinyllama,TinyLlama,535,main_graph$async_dispatch_40_batch_matmul_1x128x5632x2048_i8xi8xi32,,1,,encoding_32x32_tile,encoding_32x32_tile,,0,0,0,,,,,,4,0,0,0,0,0,,,,,
tinyllama,TinyLlama,536,main_graph$async_dispatch_41_batch_matmul_1x128x2048x5632_i8xi8xi32,,1,,encoding_32x32_tile,encoding_32x32_tile,,0,0,0,,,,,,4,0,0,0,0,0,,,,,
tinyllama,TinyLlama,537,main_graph$async_dispatch_42_elementwise_262144_i8xf32,,1,,dequantize_i8_to_f32,dequantize_i8_to_f32,,0,0,0,,,,,,0,0,0,0,0,0,,,,,
tinyllama,TinyLlama,538,main_graph$async_dispatch_43_reduction_128x2048_f32,,1,,rvv_reduction_softmax_norm,rvv_reduction_softmax_norm,,0,0,0,,,,,,0,0,0,0,0,0,,,,,
tinyllama,TinyLlama,539,main_graph$async_dispatch_44_elementwise_128_i8xf32xf32,,1,,elementwise_other,elementwise_other,,0,0,0,,,,,,0,0,0,0,0,0,,,,,
tinyllama,TinyLlama,540,main_graph$async_dispatch_45_elementwise_128x2048_f32xf32xi8,,1,,elementwise_other,elementwise_other,,0,0,0,,,,,,0,0,0,0,0,0,,,,,
tinyllama,TinyLlama,541,main_graph$async_dispatch_46_elementwise_128x2048_i8,,1,,activation,activation,,0,0,0,,,,,,0,0,0,0,0,0,,,,,
tinyllama,TinyLlama,542,main_graph$async_dispatch_50_elementwise_262144_i32xi8,,1,,requantize_i32_to_i8,requantize_i32_to_i8,,0,0,0,,,,,,0,0,0,0,0,0,,,,,
tinyllama,TinyLlama,543,main_graph$async_dispatch_51_transpose_128x32x64_f32,,1,,elementwise_other,elementwise_other,,0,0,0,,,,,,0,0,0,0,0,0,,,,,
tinyllama,TinyLlama,544,main_graph$async_dispatch_52_elementwise_32768_i32xi8,,1,,requantize_i32_to_i8,requantize_i32_to_i8,,0,0,0,,,,,,0,0,0,0,0,0,,,,,
tinyllama,TinyLlama,545,main_graph$async_dispatch_53_transpose_128x4x64_f32,,1,,elementwise_other,elementwise_other,,0,0,0,,,,,,0,0,0,0,0,0,,,,,
tinyllama,TinyLlama,546,main_graph$async_dispatch_54_elementwise_32x128x32_f32xi8,,1,,quantize_f32_to_i8,quantize_f32_to_i8,,0,0,0,,,,,,0,0,0,0,0,0,,,,,
tinyllama,TinyLlama,547,main_graph$async_dispatch_55_elementwise_4x128x32_f32xi8,,1,,quantize_f32_to_i8,quantize_f32_to_i8,,0,0,0,,,,,,0,0,0,0,0,0,,,,,
tinyllama,TinyLlama,548,main_graph$async_dispatch_56_elementwise_131072_i8xf32,,1,,dequantize_i8_to_f32,dequantize_i8_to_f32,,0,0,0,,,,,,0,0,0,0,0,0,,,,,
tinyllama,TinyLlama,549,main_graph$async_dispatch_57_elementwise_16384_i8xf32,,1,,dequantize_i8_to_f32,dequantize_i8_to_f32,,0,0,0,,,,,,0,0,0,0,0,0,,,,,
tinyllama,TinyLlama,550,main_graph$async_dispatch_58_elementwise_32x128x32_f32,,1,,activation,activation,,0,0,0,,,,,,0,0,0,0,0,0,,,,,
tinyllama,TinyLlama,551,main_graph$async_dispatch_59_elementwise_4x128x32_f32,,1,,activation,activation,,0,0,0,,,,,,0,0,0,0,0,0,,,,,
tinyllama,TinyLlama,552,main_graph$async_dispatch_60_elementwise_broadcast_4x8x128x64_i32xi8,,1,,requantize_i32_to_i8,requantize_i32_to_i8,,0,0,0,,,,,,0,0,0,0,0,0,,,,,
tinyllama,TinyLlama,553,main_graph$async_dispatch_65_elementwise_32768_f32xi8,,1,,quantize_f32_to_i8,quantize_f32_to_i8,,0,0,0,,,,,,0,0,0,0,0,0,,,,,
tinyllama,TinyLlama,554,main_graph$async_dispatch_66_elementwise_transpose_32x128x64_f32xf32xf32xf32xi8,,1,,elementwise_multi_dtype,elementwise_multi_dtype,,0,0,0,,,,,,0,0,0,0,0,0,,,,,
tinyllama,TinyLlama,555,main_graph$async_dispatch_67_elementwise_262144_i8xf32xi8,,1,,elementwise_other,elementwise_other,,0,0,0,,,,,,0,0,0,0,0,0,,,,,
tinyllama,TinyLlama,556,main_graph$async_dispatch_68_elementwise_broadcast_4x8x128x64_f32xf32xi8xf32xf32xi8,,1,,elementwise_multi_dtype,elementwise_multi_dtype,,0,0,0,,,,,,0,0,0,0,0,0,,,,,
tinyllama,TinyLlama,557,main_graph$async_dispatch_69_batch_matmul_32x128x128x64_i8xi8xi32,,1,,encoding_32x32_tile,encoding_32x32_tile,,0,0,0,,,,,,4,0,0,0,0,0,,,,,
tinyllama,TinyLlama,558,main_graph$async_dispatch_71_batch_matmul_32x128x64x128_i8xi8xi32,,1,,encoding_32x32_tile,encoding_32x32_tile,,0,0,0,,,,,,4,0,0,0,0,0,,,,,
tinyllama,TinyLlama,559,main_graph$async_dispatch_72_batch_matmul_1x128x2048x2048_i8xi8xi32,,1,,encoding_32x32_tile,encoding_32x32_tile,,0,0,0,,,,,,4,0,0,0,0,0,,,,,
tinyllama,TinyLlama,560,main_graph$async_dispatch_73_elementwise_262144_i8xf32,,1,,dequantize_i8_to_f32,dequantize_i8_to_f32,,0,0,0,,,,,,0,0,0,0,0,0,,,,,
tinyllama,TinyLlama,561,main_graph$async_dispatch_74_reduction_128x2048_f32,,1,,rvv_reduction_softmax_norm,rvv_reduction_softmax_norm,,0,0,0,,,,,,0,0,0,0,0,0,,,,,
tinyllama,TinyLlama,562,main_graph$async_dispatch_75_elementwise_128_i8xf32xf32,,1,,elementwise_other,elementwise_other,,0,0,0,,,,,,0,0,0,0,0,0,,,,,
tinyllama,TinyLlama,563,main_graph$async_dispatch_76_elementwise_128x2048_f32xf32xi8,,1,,elementwise_other,elementwise_other,,0,0,0,,,,,,0,0,0,0,0,0,,,,,
tinyllama,TinyLlama,564,main_graph$async_dispatch_77_elementwise_128x2048_i8,,1,,activation,activation,,0,0,0,,,,,,0,0,0,0,0,0,,,,,
tinyllama,TinyLlama,565,main_graph$async_dispatch_78_batch_matmul_1x128x5632x2048_i8xi8xi32,,1,,encoding_32x32_tile,encoding_32x32_tile,,0,0,0,,,,,,4,0,0,0,0,0,,,,,
tinyllama,TinyLlama,566,main_graph$async_dispatch_79_batch_matmul_1x128x5632x2048_i8xi8xi32,,1,,encoding_32x32_tile,encoding_32x32_tile,,0,0,0,,,,,,4,0,0,0,0,0,,,,,
tinyllama,TinyLlama,567,main_graph$async_dispatch_80_batch_matmul_1x128x2048x5632_i8xi8xi32,,1,,encoding_32x32_tile,encoding_32x32_tile,,0,0,0,,,,,,4,0,0,0,0,0,,,,,
tinyllama,TinyLlama,568,main_graph$async_dispatch_81_elementwise_262144_i8xf32,,1,,dequantize_i8_to_f32,dequantize_i8_to_f32,,0,0,0,,,,,,0,0,0,0,0,0,,,,,
tinyllama,TinyLlama,569,main_graph$async_dispatch_82_reduction_128x2048_f32,,1,,rvv_reduction_softmax_norm,rvv_reduction_softmax_norm,,0,0,0,,,,,,0,0,0,0,0,0,,,,,
tinyllama,TinyLlama,570,main_graph$async_dispatch_83_elementwise_128_i8xf32xf32,,1,,elementwise_other,elementwise_other,,0,0,0,,,,,,0,0,0,0,0,0,,,,,
tinyllama,TinyLlama,571,main_graph$async_dispatch_84_elementwise_128x2048_f32xf32xi8,,1,,elementwise_other,elementwise_other,,0,0,0,,,,,,0,0,0,0,0,0,,,,,
tinyllama,TinyLlama,572,main_graph$async_dispatch_85_elementwise_128x2048_i8,,1,,activation,activation,,0,0,0,,,,,,0,0,0,0,0,0,,,,,
tinyllama,TinyLlama,573,main_graph$async_dispatch_89_elementwise_262144_i32xi8,,1,,requantize_i32_to_i8,requantize_i32_to_i8,,0,0,0,,,,,,0,0,0,0,0,0,,,,,
tinyllama,TinyLlama,574,main_graph$async_dispatch_90_transpose_128x32x64_f32,,1,,elementwise_other,elementwise_other,,0,0,0,,,,,,0,0,0,0,0,0,,,,,
tinyllama,TinyLlama,575,main_graph$async_dispatch_91_elementwise_32768_i32xi8,,1,,requantize_i32_to_i8,requantize_i32_to_i8,,0,0,0,,,,,,0,0,0,0,0,0,,,,,
tinyllama,TinyLlama,576,main_graph$async_dispatch_92_transpose_128x4x64_f32,,1,,elementwise_other,elementwise_other,,0,0,0,,,,,,0,0,0,0,0,0,,,,,
tinyllama,TinyLlama,577,main_graph$async_dispatch_93_elementwise_32x128x32_f32xi8,,1,,quantize_f32_to_i8,quantize_f32_to_i8,,0,0,0,,,,,,0,0,0,0,0,0,,,,,
tinyllama,TinyLlama,578,main_graph$async_dispatch_94_elementwise_4x128x32_f32xi8,,1,,quantize_f32_to_i8,quantize_f32_to_i8,,0,0,0,,,,,,0,0,0,0,0,0,,,,,
tinyllama,TinyLlama,579,main_graph$async_dispatch_95_elementwise_131072_i8xf32,,1,,dequantize_i8_to_f32,dequantize_i8_to_f32,,0,0,0,,,,,,0,0,0,0,0,0,,,,,
tinyllama,TinyLlama,580,main_graph$async_dispatch_96_elementwise_16384_i8xf32,,1,,dequantize_i8_to_f32,dequantize_i8_to_f32,,0,0,0,,,,,,0,0,0,0,0,0,,,,,
tinyllama,TinyLlama,581,main_graph$async_dispatch_97_elementwise_32x128x32_f32,,1,,activation,activation,,0,0,0,,,,,,0,0,0,0,0,0,,,,,
tinyllama,TinyLlama,582,main_graph$async_dispatch_98_elementwise_4x128x32_f32,,1,,activation,activation,,0,0,0,,,,,,0,0,0,0,0,0,,,,,
tinyllama,TinyLlama,583,main_graph$async_dispatch_99_elementwise_broadcast_4x8x128x64_i32xi8,,1,,requantize_i32_to_i8,requantize_i32_to_i8,,0,0,0,,,,,,0,0,0,0,0,0,,,,,
tinyllama,TinyLlama,584,main_graph$async_dispatch_104_elementwise_32768_f32xi8,,1,,quantize_f32_to_i8,quantize_f32_to_i8,,0,0,0,,,,,,0,0,0,0,0,0,,,,,
tinyllama,TinyLlama,585,main_graph$async_dispatch_105_elementwise_transpose_32x128x64_f32xf32xf32xf32xi8,,1,,elementwise_multi_dtype,elementwise_multi_dtype,,0,0,0,,,,,,0,0,0,0,0,0,,,,,
tinyllama,TinyLlama,586,main_graph$async_dispatch_106_elementwise_262144_i8xf32xi8,,1,,elementwise_other,elementwise_other,,0,0,0,,,,,,0,0,0,0,0,0,,,,,
tinyllama,TinyLlama,587,main_graph$async_dispatch_107_elementwise_broadcast_4x8x128x64_f32xf32xi8xf32xf32xi8,,1,,elementwise_multi_dtype,elementwise_multi_dtype,,0,0,0,,,,,,0,0,0,0,0,0,,,,,
tinyllama,TinyLlama,588,main_graph$async_dispatch_108_batch_matmul_32x128x128x64_i8xi8xi32,,1,,encoding_32x32_tile,encoding_32x32_tile,,0,0,0,,,,,,4,0,0,0,0,0,,,,,
tinyllama,TinyLlama,589,main_graph$async_dispatch_110_batch_matmul_32x128x64x128_i8xi8xi32,,1,,encoding_32x32_tile,encoding_32x32_tile,,0,0,0,,,,,,4,0,0,0,0,0,,,,,
tinyllama,TinyLlama,590,main_graph$async_dispatch_111_batch_matmul_1x128x2048x2048_i8xi8xi32,,1,,encoding_32x32_tile,encoding_32x32_tile,,0,0,0,,,,,,4,0,0,0,0,0,,,,,
tinyllama,TinyLlama,591,main_graph$async_dispatch_112_elementwise_262144_i8xf32,,1,,dequantize_i8_to_f32,dequantize_i8_to_f32,,0,0,0,,,,,,0,0,0,0,0,0,,,,,
tinyllama,TinyLlama,592,main_graph$async_dispatch_113_reduction_128x2048_f32,,1,,rvv_reduction_softmax_norm,rvv_reduction_softmax_norm,,0,0,0,,,,,,0,0,0,0,0,0,,,,,
tinyllama,TinyLlama,593,main_graph$async_dispatch_114_elementwise_128_i8xf32xf32,,1,,elementwise_other,elementwise_other,,0,0,0,,,,,,0,0,0,0,0,0,,,,,
tinyllama,TinyLlama,594,main_graph$async_dispatch_115_elementwise_128x2048_f32xf32xi8,,1,,elementwise_other,elementwise_other,,0,0,0,,,,,,0,0,0,0,0,0,,,,,
tinyllama,TinyLlama,595,main_graph$async_dispatch_116_elementwise_128x2048_i8,,1,,activation,activation,,0,0,0,,,,,,0,0,0,0,0,0,,,,,
tinyllama,TinyLlama,596,main_graph$async_dispatch_117_batch_matmul_1x128x5632x2048_i8xi8xi32,,1,,encoding_32x32_tile,encoding_32x32_tile,,0,0,0,,,,,,4,0,0,0,0,0,,,,,
tinyllama,TinyLlama,597,main_graph$async_dispatch_118_batch_matmul_1x128x5632x2048_i8xi8xi32,,1,,encoding_32x32_tile,encoding_32x32_tile,,0,0,0,,,,,,4,0,0,0,0,0,,,,,
tinyllama,TinyLlama,598,main_graph$async_dispatch_119_batch_matmul_1x128x2048x5632_i8xi8xi32,,1,,encoding_32x32_tile,encoding_32x32_tile,,0,0,0,,,,,,4,0,0,0,0,0,,,,,
tinyllama,TinyLlama,599,main_graph$async_dispatch_120_elementwise_262144_i8xf32,,1,,dequantize_i8_to_f32,dequantize_i8_to_f32,,0,0,0,,,,,,0,0,0,0,0,0,,,,,
tinyllama,TinyLlama,600,main_graph$async_dispatch_121_reduction_128x2048_f32,,1,,rvv_reduction_softmax_norm,rvv_reduction_softmax_norm,,0,0,0,,,,,,0,0,0,0,0,0,,,,,
tinyllama,TinyLlama,601,main_graph$async_dispatch_122_elementwise_128_i8xf32xf32,,1,,elementwise_other,elementwise_other,,0,0,0,,,,,,0,0,0,0,0,0,,,,,
tinyllama,TinyLlama,602,main_graph$async_dispatch_123_elementwise_128x2048_f32xf32xi8,,1,,elementwise_other,elementwise_other,,0,0,0,,,,,,0,0,0,0,0,0,,,,,
tinyllama,TinyLlama,603,main_graph$async_dispatch_124_elementwise_128x2048_i8,,1,,activation,activation,,0,0,0,,,,,,0,0,0,0,0,0,,,,,
tinyllama,TinyLlama,604,main_graph$async_dispatch_128_elementwise_262144_i32xi8,,1,,requantize_i32_to_i8,requantize_i32_to_i8,,0,0,0,,,,,,0,0,0,0,0,0,,,,,
tinyllama,TinyLlama,605,main_graph$async_dispatch_129_transpose_128x32x64_f32,,1,,elementwise_other,elementwise_other,,0,0,0,,,,,,0,0,0,0,0,0,,,,,
tinyllama,TinyLlama,606,main_graph$async_dispatch_130_elementwise_32768_i32xi8,,1,,requantize_i32_to_i8,requantize_i32_to_i8,,0,0,0,,,,,,0,0,0,0,0,0,,,,,
tinyllama,TinyLlama,607,main_graph$async_dispatch_131_transpose_128x4x64_f32,,1,,elementwise_other,elementwise_other,,0,0,0,,,,,,0,0,0,0,0,0,,,,,
tinyllama,TinyLlama,608,main_graph$async_dispatch_132_elementwise_32x128x32_f32xi8,,1,,quantize_f32_to_i8,quantize_f32_to_i8,,0,0,0,,,,,,0,0,0,0,0,0,,,,,
tinyllama,TinyLlama,609,main_graph$async_dispatch_133_elementwise_4x128x32_f32xi8,,1,,quantize_f32_to_i8,quantize_f32_to_i8,,0,0,0,,,,,,0,0,0,0,0,0,,,,,
tinyllama,TinyLlama,610,main_graph$async_dispatch_134_elementwise_131072_i8xf32,,1,,dequantize_i8_to_f32,dequantize_i8_to_f32,,0,0,0,,,,,,0,0,0,0,0,0,,,,,
tinyllama,TinyLlama,611,main_graph$async_dispatch_135_elementwise_16384_i8xf32,,1,,dequantize_i8_to_f32,dequantize_i8_to_f32,,0,0,0,,,,,,0,0,0,0,0,0,,,,,
tinyllama,TinyLlama,612,main_graph$async_dispatch_136_elementwise_32x128x32_f32,,1,,activation,activation,,0,0,0,,,,,,0,0,0,0,0,0,,,,,
tinyllama,TinyLlama,613,main_graph$async_dispatch_137_elementwise_4x128x32_f32,,1,,activation,activation,,0,0,0,,,,,,0,0,0,0,0,0,,,,,
tinyllama,TinyLlama,614,main_graph$async_dispatch_138_elementwise_broadcast_4x8x128x64_i32xi8,,1,,requantize_i32_to_i8,requantize_i32_to_i8,,0,0,0,,,,,,0,0,0,0,0,0,,,,,
tinyllama,TinyLlama,615,main_graph$async_dispatch_143_elementwise_32768_f32xi8,,1,,quantize_f32_to_i8,quantize_f32_to_i8,,0,0,0,,,,,,0,0,0,0,0,0,,,,,
tinyllama,TinyLlama,616,main_graph$async_dispatch_144_elementwise_transpose_32x128x64_f32xf32xf32xf32xi8,,1,,elementwise_multi_dtype,elementwise_multi_dtype,,0,0,0,,,,,,0,0,0,0,0,0,,,,,
tinyllama,TinyLlama,617,main_graph$async_dispatch_145_elementwise_262144_i8xf32xi8,,1,,elementwise_other,elementwise_other,,0,0,0,,,,,,0,0,0,0,0,0,,,,,
tinyllama,TinyLlama,618,main_graph$async_dispatch_146_elementwise_broadcast_4x8x128x64_f32xf32xi8xf32xf32xi8,,1,,elementwise_multi_dtype,elementwise_multi_dtype,,0,0,0,,,,,,0,0,0,0,0,0,,,,,
tinyllama,TinyLlama,619,main_graph$async_dispatch_147_batch_matmul_32x128x128x64_i8xi8xi32,,1,,encoding_32x32_tile,encoding_32x32_tile,,0,0,0,,,,,,4,0,0,0,0,0,,,,,
tinyllama,TinyLlama,620,main_graph$async_dispatch_149_batch_matmul_32x128x64x128_i8xi8xi32,,1,,encoding_32x32_tile,encoding_32x32_tile,,0,0,0,,,,,,4,0,0,0,0,0,,,,,
tinyllama,TinyLlama,621,main_graph$async_dispatch_150_batch_matmul_1x128x2048x2048_i8xi8xi32,,1,,encoding_32x32_tile,encoding_32x32_tile,,0,0,0,,,,,,4,0,0,0,0,0,,,,,
tinyllama,TinyLlama,622,main_graph$async_dispatch_151_elementwise_262144_i8xf32,,1,,dequantize_i8_to_f32,dequantize_i8_to_f32,,0,0,0,,,,,,0,0,0,0,0,0,,,,,
tinyllama,TinyLlama,623,main_graph$async_dispatch_152_reduction_128x2048_f32,,1,,rvv_reduction_softmax_norm,rvv_reduction_softmax_norm,,0,0,0,,,,,,0,0,0,0,0,0,,,,,
tinyllama,TinyLlama,624,main_graph$async_dispatch_153_elementwise_128_i8xf32xf32,,1,,elementwise_other,elementwise_other,,0,0,0,,,,,,0,0,0,0,0,0,,,,,
tinyllama,TinyLlama,625,main_graph$async_dispatch_154_elementwise_128x2048_f32xf32xi8,,1,,elementwise_other,elementwise_other,,0,0,0,,,,,,0,0,0,0,0,0,,,,,
tinyllama,TinyLlama,626,main_graph$async_dispatch_155_elementwise_128x2048_i8,,1,,activation,activation,,0,0,0,,,,,,0,0,0,0,0,0,,,,,
tinyllama,TinyLlama,627,main_graph$async_dispatch_156_batch_matmul_1x128x5632x2048_i8xi8xi32,,1,,encoding_32x32_tile,encoding_32x32_tile,,0,0,0,,,,,,4,0,0,0,0,0,,,,,
tinyllama,TinyLlama,628,main_graph$async_dispatch_157_batch_matmul_1x128x5632x2048_i8xi8xi32,,1,,encoding_32x32_tile,encoding_32x32_tile,,0,0,0,,,,,,4,0,0,0,0,0,,,,,
tinyllama,TinyLlama,629,main_graph$async_dispatch_158_batch_matmul_1x128x2048x5632_i8xi8xi32,,1,,encoding_32x32_tile,encoding_32x32_tile,,0,0,0,,,,,,4,0,0,0,0,0,,,,,
tinyllama,TinyLlama,630,main_graph$async_dispatch_159_elementwise_262144_i8xf32,,1,,dequantize_i8_to_f32,dequantize_i8_to_f32,,0,0,0,,,,,,0,0,0,0,0,0,,,,,
tinyllama,TinyLlama,631,main_graph$async_dispatch_160_reduction_128x2048_f32,,1,,rvv_reduction_softmax_norm,rvv_reduction_softmax_norm,,0,0,0,,,,,,0,0,0,0,0,0,,,,,
tinyllama,TinyLlama,632,main_graph$async_dispatch_161_elementwise_128_i8xf32xf32,,1,,elementwise_other,elementwise_other,,0,0,0,,,,,,0,0,0,0,0,0,,,,,
tinyllama,TinyLlama,633,main_graph$async_dispatch_162_elementwise_128x2048_f32xf32xi8,,1,,elementwise_other,elementwise_other,,0,0,0,,,,,,0,0,0,0,0,0,,,,,
tinyllama,TinyLlama,634,main_graph$async_dispatch_163_elementwise_128x2048_i8,,1,,activation,activation,,0,0,0,,,,,,0,0,0,0,0,0,,,,,
tinyllama,TinyLlama,635,main_graph$async_dispatch_167_elementwise_262144_i32xi8,,1,,requantize_i32_to_i8,requantize_i32_to_i8,,0,0,0,,,,,,0,0,0,0,0,0,,,,,
tinyllama,TinyLlama,636,main_graph$async_dispatch_168_transpose_128x32x64_f32,,1,,elementwise_other,elementwise_other,,0,0,0,,,,,,0,0,0,0,0,0,,,,,
tinyllama,TinyLlama,637,main_graph$async_dispatch_169_elementwise_32768_i32xi8,,1,,requantize_i32_to_i8,requantize_i32_to_i8,,0,0,0,,,,,,0,0,0,0,0,0,,,,,
tinyllama,TinyLlama,638,main_graph$async_dispatch_170_transpose_128x4x64_f32,,1,,elementwise_other,elementwise_other,,0,0,0,,,,,,0,0,0,0,0,0,,,,,
tinyllama,TinyLlama,639,main_graph$async_dispatch_171_elementwise_32x128x32_f32xi8,,1,,quantize_f32_to_i8,quantize_f32_to_i8,,0,0,0,,,,,,0,0,0,0,0,0,,,,,
tinyllama,TinyLlama,640,main_graph$async_dispatch_172_elementwise_4x128x32_f32xi8,,1,,quantize_f32_to_i8,quantize_f32_to_i8,,0,0,0,,,,,,0,0,0,0,0,0,,,,,
tinyllama,TinyLlama,641,main_graph$async_dispatch_173_elementwise_131072_i8xf32,,1,,dequantize_i8_to_f32,dequantize_i8_to_f32,,0,0,0,,,,,,0,0,0,0,0,0,,,,,
tinyllama,TinyLlama,642,main_graph$async_dispatch_174_elementwise_16384_i8xf32,,1,,dequantize_i8_to_f32,dequantize_i8_to_f32,,0,0,0,,,,,,0,0,0,0,0,0,,,,,
tinyllama,TinyLlama,643,main_graph$async_dispatch_175_elementwise_32x128x32_f32,,1,,activation,activation,,0,0,0,,,,,,0,0,0,0,0,0,,,,,
tinyllama,TinyLlama,644,main_graph$async_dispatch_176_elementwise_4x128x32_f32,,1,,activation,activation,,0,0,0,,,,,,0,0,0,0,0,0,,,,,
tinyllama,TinyLlama,645,main_graph$async_dispatch_177_elementwise_broadcast_4x8x128x64_i32xi8,,1,,requantize_i32_to_i8,requantize_i32_to_i8,,0,0,0,,,,,,0,0,0,0,0,0,,,,,
tinyllama,TinyLlama,646,main_graph$async_dispatch_182_elementwise_32768_f32xi8,,1,,quantize_f32_to_i8,quantize_f32_to_i8,,0,0,0,,,,,,0,0,0,0,0,0,,,,,
tinyllama,TinyLlama,647,main_graph$async_dispatch_183_elementwise_transpose_32x128x64_f32xf32xf32xf32xi8,,1,,elementwise_multi_dtype,elementwise_multi_dtype,,0,0,0,,,,,,0,0,0,0,0,0,,,,,
tinyllama,TinyLlama,648,main_graph$async_dispatch_184_elementwise_262144_i8xf32xi8,,1,,elementwise_other,elementwise_other,,0,0,0,,,,,,0,0,0,0,0,0,,,,,
tinyllama,TinyLlama,649,main_graph$async_dispatch_185_elementwise_broadcast_4x8x128x64_f32xf32xi8xf32xf32xi8,,1,,elementwise_multi_dtype,elementwise_multi_dtype,,0,0,0,,,,,,0,0,0,0,0,0,,,,,
tinyllama,TinyLlama,650,main_graph$async_dispatch_186_batch_matmul_32x128x128x64_i8xi8xi32,,1,,encoding_32x32_tile,encoding_32x32_tile,,0,0,0,,,,,,4,0,0,0,0,0,,,,,
tinyllama,TinyLlama,651,main_graph$async_dispatch_188_batch_matmul_32x128x64x128_i8xi8xi32,,1,,encoding_32x32_tile,encoding_32x32_tile,,0,0,0,,,,,,4,0,0,0,0,0,,,,,
tinyllama,TinyLlama,652,main_graph$async_dispatch_189_batch_matmul_1x128x2048x2048_i8xi8xi32,,1,,encoding_32x32_tile,encoding_32x32_tile,,0,0,0,,,,,,4,0,0,0,0,0,,,,,
tinyllama,TinyLlama,653,main_graph$async_dispatch_190_elementwise_262144_i8xf32,,1,,dequantize_i8_to_f32,dequantize_i8_to_f32,,0,0,0,,,,,,0,0,0,0,0,0,,,,,
tinyllama,TinyLlama,654,main_graph$async_dispatch_191_reduction_128x2048_f32,,1,,rvv_reduction_softmax_norm,rvv_reduction_softmax_norm,,0,0,0,,,,,,0,0,0,0,0,0,,,,,
tinyllama,TinyLlama,655,main_graph$async_dispatch_192_elementwise_128_i8xf32xf32,,1,,elementwise_other,elementwise_other,,0,0,0,,,,,,0,0,0,0,0,0,,,,,
tinyllama,TinyLlama,656,main_graph$async_dispatch_193_elementwise_128x2048_f32xf32xi8,,1,,elementwise_other,elementwise_other,,0,0,0,,,,,,0,0,0,0,0,0,,,,,
tinyllama,TinyLlama,657,main_graph$async_dispatch_194_elementwise_128x2048_i8,,1,,activation,activation,,0,0,0,,,,,,0,0,0,0,0,0,,,,,
tinyllama,TinyLlama,658,main_graph$async_dispatch_195_batch_matmul_1x128x5632x2048_i8xi8xi32,,1,,encoding_32x32_tile,encoding_32x32_tile,,0,0,0,,,,,,4,0,0,0,0,0,,,,,
tinyllama,TinyLlama,659,main_graph$async_dispatch_196_batch_matmul_1x128x5632x2048_i8xi8xi32,,1,,encoding_32x32_tile,encoding_32x32_tile,,0,0,0,,,,,,4,0,0,0,0,0,,,,,
tinyllama,TinyLlama,660,main_graph$async_dispatch_197_batch_matmul_1x128x2048x5632_i8xi8xi32,,1,,encoding_32x32_tile,encoding_32x32_tile,,0,0,0,,,,,,4,0,0,0,0,0,,,,,
tinyllama,TinyLlama,661,main_graph$async_dispatch_198_elementwise_262144_i8xf32,,1,,dequantize_i8_to_f32,dequantize_i8_to_f32,,0,0,0,,,,,,0,0,0,0,0,0,,,,,
tinyllama,TinyLlama,662,main_graph$async_dispatch_199_reduction_128x2048_f32,,1,,rvv_reduction_softmax_norm,rvv_reduction_softmax_norm,,0,0,0,,,,,,0,0,0,0,0,0,,,,,
tinyllama,TinyLlama,663,main_graph$async_dispatch_200_elementwise_128_i8xf32xf32,,1,,elementwise_other,elementwise_other,,0,0,0,,,,,,0,0,0,0,0,0,,,,,
tinyllama,TinyLlama,664,main_graph$async_dispatch_201_elementwise_128x2048_f32xf32xi8,,1,,elementwise_other,elementwise_other,,0,0,0,,,,,,0,0,0,0,0,0,,,,,
tinyllama,TinyLlama,665,main_graph$async_dispatch_202_elementwise_128x2048_i8,,1,,activation,activation,,0,0,0,,,,,,0,0,0,0,0,0,,,,,
tinyllama,TinyLlama,666,main_graph$async_dispatch_206_elementwise_262144_i32xi8,,1,,requantize_i32_to_i8,requantize_i32_to_i8,,0,0,0,,,,,,0,0,0,0,0,0,,,,,
tinyllama,TinyLlama,667,main_graph$async_dispatch_207_transpose_128x32x64_f32,,1,,elementwise_other,elementwise_other,,0,0,0,,,,,,0,0,0,0,0,0,,,,,
tinyllama,TinyLlama,668,main_graph$async_dispatch_208_elementwise_32768_i32xi8,,1,,requantize_i32_to_i8,requantize_i32_to_i8,,0,0,0,,,,,,0,0,0,0,0,0,,,,,
tinyllama,TinyLlama,669,main_graph$async_dispatch_209_transpose_128x4x64_f32,,1,,elementwise_other,elementwise_other,,0,0,0,,,,,,0,0,0,0,0,0,,,,,
tinyllama,TinyLlama,670,main_graph$async_dispatch_210_elementwise_32x128x32_f32xi8,,1,,quantize_f32_to_i8,quantize_f32_to_i8,,0,0,0,,,,,,0,0,0,0,0,0,,,,,
tinyllama,TinyLlama,671,main_graph$async_dispatch_211_elementwise_4x128x32_f32xi8,,1,,quantize_f32_to_i8,quantize_f32_to_i8,,0,0,0,,,,,,0,0,0,0,0,0,,,,,
tinyllama,TinyLlama,672,main_graph$async_dispatch_212_elementwise_131072_i8xf32,,1,,dequantize_i8_to_f32,dequantize_i8_to_f32,,0,0,0,,,,,,0,0,0,0,0,0,,,,,
tinyllama,TinyLlama,673,main_graph$async_dispatch_213_elementwise_16384_i8xf32,,1,,dequantize_i8_to_f32,dequantize_i8_to_f32,,0,0,0,,,,,,0,0,0,0,0,0,,,,,
tinyllama,TinyLlama,674,main_graph$async_dispatch_214_elementwise_32x128x32_f32,,1,,activation,activation,,0,0,0,,,,,,0,0,0,0,0,0,,,,,
tinyllama,TinyLlama,675,main_graph$async_dispatch_215_elementwise_4x128x32_f32,,1,,activation,activation,,0,0,0,,,,,,0,0,0,0,0,0,,,,,
tinyllama,TinyLlama,676,main_graph$async_dispatch_216_elementwise_broadcast_4x8x128x64_i32xi8,,1,,requantize_i32_to_i8,requantize_i32_to_i8,,0,0,0,,,,,,0,0,0,0,0,0,,,,,
tinyllama,TinyLlama,677,main_graph$async_dispatch_221_elementwise_32768_f32xi8,,1,,quantize_f32_to_i8,quantize_f32_to_i8,,0,0,0,,,,,,0,0,0,0,0,0,,,,,
tinyllama,TinyLlama,678,main_graph$async_dispatch_222_elementwise_transpose_32x128x64_f32xf32xf32xf32xi8,,1,,elementwise_multi_dtype,elementwise_multi_dtype,,0,0,0,,,,,,0,0,0,0,0,0,,,,,
tinyllama,TinyLlama,679,main_graph$async_dispatch_223_elementwise_262144_i8xf32xi8,,1,,elementwise_other,elementwise_other,,0,0,0,,,,,,0,0,0,0,0,0,,,,,
tinyllama,TinyLlama,680,main_graph$async_dispatch_224_elementwise_broadcast_4x8x128x64_f32xf32xi8xf32xf32xi8,,1,,elementwise_multi_dtype,elementwise_multi_dtype,,0,0,0,,,,,,0,0,0,0,0,0,,,,,
tinyllama,TinyLlama,681,main_graph$async_dispatch_225_batch_matmul_32x128x128x64_i8xi8xi32,,1,,encoding_32x32_tile,encoding_32x32_tile,,0,0,0,,,,,,4,0,0,0,0,0,,,,,
tinyllama,TinyLlama,682,main_graph$async_dispatch_227_batch_matmul_32x128x64x128_i8xi8xi32,,1,,encoding_32x32_tile,encoding_32x32_tile,,0,0,0,,,,,,4,0,0,0,0,0,,,,,
tinyllama,TinyLlama,683,main_graph$async_dispatch_228_batch_matmul_1x128x2048x2048_i8xi8xi32,,1,,encoding_32x32_tile,encoding_32x32_tile,,0,0,0,,,,,,4,0,0,0,0,0,,,,,
tinyllama,TinyLlama,684,main_graph$async_dispatch_229_elementwise_262144_i8xf32,,1,,dequantize_i8_to_f32,dequantize_i8_to_f32,,0,0,0,,,,,,0,0,0,0,0,0,,,,,
tinyllama,TinyLlama,685,main_graph$async_dispatch_230_reduction_128x2048_f32,,1,,rvv_reduction_softmax_norm,rvv_reduction_softmax_norm,,0,0,0,,,,,,0,0,0,0,0,0,,,,,
tinyllama,TinyLlama,686,main_graph$async_dispatch_231_elementwise_128_i8xf32xf32,,1,,elementwise_other,elementwise_other,,0,0,0,,,,,,0,0,0,0,0,0,,,,,
tinyllama,TinyLlama,687,main_graph$async_dispatch_232_elementwise_128x2048_f32xf32xi8,,1,,elementwise_other,elementwise_other,,0,0,0,,,,,,0,0,0,0,0,0,,,,,
tinyllama,TinyLlama,688,main_graph$async_dispatch_233_elementwise_128x2048_i8,,1,,activation,activation,,0,0,0,,,,,,0,0,0,0,0,0,,,,,
tinyllama,TinyLlama,689,main_graph$async_dispatch_234_batch_matmul_1x128x5632x2048_i8xi8xi32,,1,,encoding_32x32_tile,encoding_32x32_tile,,0,0,0,,,,,,4,0,0,0,0,0,,,,,
tinyllama,TinyLlama,690,main_graph$async_dispatch_235_batch_matmul_1x128x5632x2048_i8xi8xi32,,1,,encoding_32x32_tile,encoding_32x32_tile,,0,0,0,,,,,,4,0,0,0,0,0,,,,,
tinyllama,TinyLlama,691,main_graph$async_dispatch_236_batch_matmul_1x128x2048x5632_i8xi8xi32,,1,,encoding_32x32_tile,encoding_32x32_tile,,0,0,0,,,,,,4,0,0,0,0,0,,,,,
tinyllama,TinyLlama,692,main_graph$async_dispatch_237_elementwise_262144_i8xf32,,1,,dequantize_i8_to_f32,dequantize_i8_to_f32,,0,0,0,,,,,,0,0,0,0,0,0,,,,,
tinyllama,TinyLlama,693,main_graph$async_dispatch_238_reduction_128x2048_f32,,1,,rvv_reduction_softmax_norm,rvv_reduction_softmax_norm,,0,0,0,,,,,,0,0,0,0,0,0,,,,,
tinyllama,TinyLlama,694,main_graph$async_dispatch_239_elementwise_128_i8xf32xf32,,1,,elementwise_other,elementwise_other,,0,0,0,,,,,,0,0,0,0,0,0,,,,,
tinyllama,TinyLlama,695,main_graph$async_dispatch_240_elementwise_128x2048_f32xf32xi8,,1,,elementwise_other,elementwise_other,,0,0,0,,,,,,0,0,0,0,0,0,,,,,
tinyllama,TinyLlama,696,main_graph$async_dispatch_241_elementwise_128x2048_i8,,1,,activation,activation,,0,0,0,,,,,,0,0,0,0,0,0,,,,,
tinyllama,TinyLlama,697,main_graph$async_dispatch_245_elementwise_262144_i32xi8,,1,,requantize_i32_to_i8,requantize_i32_to_i8,,0,0,0,,,,,,0,0,0,0,0,0,,,,,
tinyllama,TinyLlama,698,main_graph$async_dispatch_246_transpose_128x32x64_f32,,1,,elementwise_other,elementwise_other,,0,0,0,,,,,,0,0,0,0,0,0,,,,,
tinyllama,TinyLlama,699,main_graph$async_dispatch_247_elementwise_32768_i32xi8,,1,,requantize_i32_to_i8,requantize_i32_to_i8,,0,0,0,,,,,,0,0,0,0,0,0,,,,,
tinyllama,TinyLlama,700,main_graph$async_dispatch_248_transpose_128x4x64_f32,,1,,elementwise_other,elementwise_other,,0,0,0,,,,,,0,0,0,0,0,0,,,,,
tinyllama,TinyLlama,701,main_graph$async_dispatch_249_elementwise_32x128x32_f32xi8,,1,,quantize_f32_to_i8,quantize_f32_to_i8,,0,0,0,,,,,,0,0,0,0,0,0,,,,,
tinyllama,TinyLlama,702,main_graph$async_dispatch_250_elementwise_4x128x32_f32xi8,,1,,quantize_f32_to_i8,quantize_f32_to_i8,,0,0,0,,,,,,0,0,0,0,0,0,,,,,
tinyllama,TinyLlama,703,main_graph$async_dispatch_251_elementwise_131072_i8xf32,,1,,dequantize_i8_to_f32,dequantize_i8_to_f32,,0,0,0,,,,,,0,0,0,0,0,0,,,,,
tinyllama,TinyLlama,704,main_graph$async_dispatch_252_elementwise_16384_i8xf32,,1,,dequantize_i8_to_f32,dequantize_i8_to_f32,,0,0,0,,,,,,0,0,0,0,0,0,,,,,
tinyllama,TinyLlama,705,main_graph$async_dispatch_253_elementwise_32x128x32_f32,,1,,activation,activation,,0,0,0,,,,,,0,0,0,0,0,0,,,,,
tinyllama,TinyLlama,706,main_graph$async_dispatch_254_elementwise_4x128x32_f32,,1,,activation,activation,,0,0,0,,,,,,0,0,0,0,0,0,,,,,
tinyllama,TinyLlama,707,main_graph$async_dispatch_255_elementwise_broadcast_4x8x128x64_i32xi8,,1,,requantize_i32_to_i8,requantize_i32_to_i8,,0,0,0,,,,,,0,0,0,0,0,0,,,,,
tinyllama,TinyLlama,708,main_graph$async_dispatch_260_elementwise_32768_f32xi8,,1,,quantize_f32_to_i8,quantize_f32_to_i8,,0,0,0,,,,,,0,0,0,0,0,0,,,,,
tinyllama,TinyLlama,709,main_graph$async_dispatch_261_elementwise_transpose_32x128x64_f32xf32xf32xf32xi8,,1,,elementwise_multi_dtype,elementwise_multi_dtype,,0,0,0,,,,,,0,0,0,0,0,0,,,,,
tinyllama,TinyLlama,710,main_graph$async_dispatch_262_elementwise_262144_i8xf32xi8,,1,,elementwise_other,elementwise_other,,0,0,0,,,,,,0,0,0,0,0,0,,,,,
tinyllama,TinyLlama,711,main_graph$async_dispatch_263_elementwise_broadcast_4x8x128x64_f32xf32xi8xf32xf32xi8,,1,,elementwise_multi_dtype,elementwise_multi_dtype,,0,0,0,,,,,,0,0,0,0,0,0,,,,,
tinyllama,TinyLlama,712,main_graph$async_dispatch_264_batch_matmul_32x128x128x64_i8xi8xi32,,1,,encoding_32x32_tile,encoding_32x32_tile,,0,0,0,,,,,,4,0,0,0,0,0,,,,,
tinyllama,TinyLlama,713,main_graph$async_dispatch_266_batch_matmul_32x128x64x128_i8xi8xi32,,1,,encoding_32x32_tile,encoding_32x32_tile,,0,0,0,,,,,,4,0,0,0,0,0,,,,,
tinyllama,TinyLlama,714,main_graph$async_dispatch_267_batch_matmul_1x128x2048x2048_i8xi8xi32,,1,,encoding_32x32_tile,encoding_32x32_tile,,0,0,0,,,,,,4,0,0,0,0,0,,,,,
tinyllama,TinyLlama,715,main_graph$async_dispatch_268_elementwise_262144_i8xf32,,1,,dequantize_i8_to_f32,dequantize_i8_to_f32,,0,0,0,,,,,,0,0,0,0,0,0,,,,,
tinyllama,TinyLlama,716,main_graph$async_dispatch_269_reduction_128x2048_f32,,1,,rvv_reduction_softmax_norm,rvv_reduction_softmax_norm,,0,0,0,,,,,,0,0,0,0,0,0,,,,,
tinyllama,TinyLlama,717,main_graph$async_dispatch_270_elementwise_128_i8xf32xf32,,1,,elementwise_other,elementwise_other,,0,0,0,,,,,,0,0,0,0,0,0,,,,,
tinyllama,TinyLlama,718,main_graph$async_dispatch_271_elementwise_128x2048_f32xf32xi8,,1,,elementwise_other,elementwise_other,,0,0,0,,,,,,0,0,0,0,0,0,,,,,
tinyllama,TinyLlama,719,main_graph$async_dispatch_272_elementwise_128x2048_i8,,1,,activation,activation,,0,0,0,,,,,,0,0,0,0,0,0,,,,,
tinyllama,TinyLlama,720,main_graph$async_dispatch_273_batch_matmul_1x128x5632x2048_i8xi8xi32,,1,,encoding_32x32_tile,encoding_32x32_tile,,0,0,0,,,,,,4,0,0,0,0,0,,,,,
tinyllama,TinyLlama,721,main_graph$async_dispatch_274_batch_matmul_1x128x5632x2048_i8xi8xi32,,1,,encoding_32x32_tile,encoding_32x32_tile,,0,0,0,,,,,,4,0,0,0,0,0,,,,,
tinyllama,TinyLlama,722,main_graph$async_dispatch_275_batch_matmul_1x128x2048x5632_i8xi8xi32,,1,,encoding_32x32_tile,encoding_32x32_tile,,0,0,0,,,,,,4,0,0,0,0,0,,,,,
tinyllama,TinyLlama,723,main_graph$async_dispatch_276_elementwise_262144_i8xf32,,1,,dequantize_i8_to_f32,dequantize_i8_to_f32,,0,0,0,,,,,,0,0,0,0,0,0,,,,,
tinyllama,TinyLlama,724,main_graph$async_dispatch_277_reduction_128x2048_f32,,1,,rvv_reduction_softmax_norm,rvv_reduction_softmax_norm,,0,0,0,,,,,,0,0,0,0,0,0,,,,,
tinyllama,TinyLlama,725,main_graph$async_dispatch_278_elementwise_128_i8xf32xf32,,1,,elementwise_other,elementwise_other,,0,0,0,,,,,,0,0,0,0,0,0,,,,,
tinyllama,TinyLlama,726,main_graph$async_dispatch_279_elementwise_128x2048_f32xf32xi8,,1,,elementwise_other,elementwise_other,,0,0,0,,,,,,0,0,0,0,0,0,,,,,
tinyllama,TinyLlama,727,main_graph$async_dispatch_280_elementwise_128x2048_i8,,1,,activation,activation,,0,0,0,,,,,,0,0,0,0,0,0,,,,,
tinyllama,TinyLlama,728,main_graph$async_dispatch_284_elementwise_262144_i32xi8,,1,,requantize_i32_to_i8,requantize_i32_to_i8,,0,0,0,,,,,,0,0,0,0,0,0,,,,,
tinyllama,TinyLlama,729,main_graph$async_dispatch_285_transpose_128x32x64_f32,,1,,elementwise_other,elementwise_other,,0,0,0,,,,,,0,0,0,0,0,0,,,,,
tinyllama,TinyLlama,730,main_graph$async_dispatch_286_elementwise_32768_i32xi8,,1,,requantize_i32_to_i8,requantize_i32_to_i8,,0,0,0,,,,,,0,0,0,0,0,0,,,,,
tinyllama,TinyLlama,731,main_graph$async_dispatch_287_transpose_128x4x64_f32,,1,,elementwise_other,elementwise_other,,0,0,0,,,,,,0,0,0,0,0,0,,,,,
tinyllama,TinyLlama,732,main_graph$async_dispatch_288_elementwise_32x128x32_f32xi8,,1,,quantize_f32_to_i8,quantize_f32_to_i8,,0,0,0,,,,,,0,0,0,0,0,0,,,,,
tinyllama,TinyLlama,733,main_graph$async_dispatch_289_elementwise_4x128x32_f32xi8,,1,,quantize_f32_to_i8,quantize_f32_to_i8,,0,0,0,,,,,,0,0,0,0,0,0,,,,,
tinyllama,TinyLlama,734,main_graph$async_dispatch_290_elementwise_131072_i8xf32,,1,,dequantize_i8_to_f32,dequantize_i8_to_f32,,0,0,0,,,,,,0,0,0,0,0,0,,,,,
tinyllama,TinyLlama,735,main_graph$async_dispatch_291_elementwise_16384_i8xf32,,1,,dequantize_i8_to_f32,dequantize_i8_to_f32,,0,0,0,,,,,,0,0,0,0,0,0,,,,,
tinyllama,TinyLlama,736,main_graph$async_dispatch_292_elementwise_32x128x32_f32,,1,,activation,activation,,0,0,0,,,,,,0,0,0,0,0,0,,,,,
tinyllama,TinyLlama,737,main_graph$async_dispatch_293_elementwise_4x128x32_f32,,1,,activation,activation,,0,0,0,,,,,,0,0,0,0,0,0,,,,,
tinyllama,TinyLlama,738,main_graph$async_dispatch_294_elementwise_broadcast_4x8x128x64_i32xi8,,1,,requantize_i32_to_i8,requantize_i32_to_i8,,0,0,0,,,,,,0,0,0,0,0,0,,,,,
tinyllama,TinyLlama,739,main_graph$async_dispatch_299_elementwise_32768_f32xi8,,1,,quantize_f32_to_i8,quantize_f32_to_i8,,0,0,0,,,,,,0,0,0,0,0,0,,,,,
tinyllama,TinyLlama,740,main_graph$async_dispatch_300_elementwise_transpose_32x128x64_f32xf32xf32xf32xi8,,1,,elementwise_multi_dtype,elementwise_multi_dtype,,0,0,0,,,,,,0,0,0,0,0,0,,,,,
tinyllama,TinyLlama,741,main_graph$async_dispatch_301_elementwise_262144_i8xf32xi8,,1,,elementwise_other,elementwise_other,,0,0,0,,,,,,0,0,0,0,0,0,,,,,
tinyllama,TinyLlama,742,main_graph$async_dispatch_302_elementwise_broadcast_4x8x128x64_f32xf32xi8xf32xf32xi8,,1,,elementwise_multi_dtype,elementwise_multi_dtype,,0,0,0,,,,,,0,0,0,0,0,0,,,,,
tinyllama,TinyLlama,743,main_graph$async_dispatch_303_batch_matmul_32x128x128x64_i8xi8xi32,,1,,encoding_32x32_tile,encoding_32x32_tile,,0,0,0,,,,,,4,0,0,0,0,0,,,,,
tinyllama,TinyLlama,744,main_graph$async_dispatch_305_batch_matmul_32x128x64x128_i8xi8xi32,,1,,encoding_32x32_tile,encoding_32x32_tile,,0,0,0,,,,,,4,0,0,0,0,0,,,,,
tinyllama,TinyLlama,745,main_graph$async_dispatch_306_batch_matmul_1x128x2048x2048_i8xi8xi32,,1,,encoding_32x32_tile,encoding_32x32_tile,,0,0,0,,,,,,4,0,0,0,0,0,,,,,
tinyllama,TinyLlama,746,main_graph$async_dispatch_307_elementwise_262144_i8xf32,,1,,dequantize_i8_to_f32,dequantize_i8_to_f32,,0,0,0,,,,,,0,0,0,0,0,0,,,,,
tinyllama,TinyLlama,747,main_graph$async_dispatch_308_reduction_128x2048_f32,,1,,rvv_reduction_softmax_norm,rvv_reduction_softmax_norm,,0,0,0,,,,,,0,0,0,0,0,0,,,,,
tinyllama,TinyLlama,748,main_graph$async_dispatch_309_elementwise_128_i8xf32xf32,,1,,elementwise_other,elementwise_other,,0,0,0,,,,,,0,0,0,0,0,0,,,,,
tinyllama,TinyLlama,749,main_graph$async_dispatch_310_elementwise_128x2048_f32xf32xi8,,1,,elementwise_other,elementwise_other,,0,0,0,,,,,,0,0,0,0,0,0,,,,,
tinyllama,TinyLlama,750,main_graph$async_dispatch_311_elementwise_128x2048_i8,,1,,activation,activation,,0,0,0,,,,,,0,0,0,0,0,0,,,,,
tinyllama,TinyLlama,751,main_graph$async_dispatch_312_batch_matmul_1x128x5632x2048_i8xi8xi32,,1,,encoding_32x32_tile,encoding_32x32_tile,,0,0,0,,,,,,4,0,0,0,0,0,,,,,
tinyllama,TinyLlama,752,main_graph$async_dispatch_313_batch_matmul_1x128x5632x2048_i8xi8xi32,,1,,encoding_32x32_tile,encoding_32x32_tile,,0,0,0,,,,,,4,0,0,0,0,0,,,,,
tinyllama,TinyLlama,753,main_graph$async_dispatch_314_batch_matmul_1x128x2048x5632_i8xi8xi32,,1,,encoding_32x32_tile,encoding_32x32_tile,,0,0,0,,,,,,4,0,0,0,0,0,,,,,
tinyllama,TinyLlama,754,main_graph$async_dispatch_315_elementwise_262144_i8xf32,,1,,dequantize_i8_to_f32,dequantize_i8_to_f32,,0,0,0,,,,,,0,0,0,0,0,0,,,,,
tinyllama,TinyLlama,755,main_graph$async_dispatch_316_reduction_128x2048_f32,,1,,rvv_reduction_softmax_norm,rvv_reduction_softmax_norm,,0,0,0,,,,,,0,0,0,0,0,0,,,,,
tinyllama,TinyLlama,756,main_graph$async_dispatch_317_elementwise_128_i8xf32xf32,,1,,elementwise_other,elementwise_other,,0,0,0,,,,,,0,0,0,0,0,0,,,,,
tinyllama,TinyLlama,757,main_graph$async_dispatch_318_elementwise_128x2048_f32xf32xi8,,1,,elementwise_other,elementwise_other,,0,0,0,,,,,,0,0,0,0,0,0,,,,,
tinyllama,TinyLlama,758,main_graph$async_dispatch_319_elementwise_128x2048_i8,,1,,activation,activation,,0,0,0,,,,,,0,0,0,0,0,0,,,,,
tinyllama,TinyLlama,759,main_graph$async_dispatch_323_elementwise_262144_i32xi8,,1,,requantize_i32_to_i8,requantize_i32_to_i8,,0,0,0,,,,,,0,0,0,0,0,0,,,,,
tinyllama,TinyLlama,760,main_graph$async_dispatch_324_transpose_128x32x64_f32,,1,,elementwise_other,elementwise_other,,0,0,0,,,,,,0,0,0,0,0,0,,,,,
tinyllama,TinyLlama,761,main_graph$async_dispatch_325_elementwise_32768_i32xi8,,1,,requantize_i32_to_i8,requantize_i32_to_i8,,0,0,0,,,,,,0,0,0,0,0,0,,,,,
tinyllama,TinyLlama,762,main_graph$async_dispatch_326_transpose_128x4x64_f32,,1,,elementwise_other,elementwise_other,,0,0,0,,,,,,0,0,0,0,0,0,,,,,
tinyllama,TinyLlama,763,main_graph$async_dispatch_327_elementwise_32x128x32_f32xi8,,1,,quantize_f32_to_i8,quantize_f32_to_i8,,0,0,0,,,,,,0,0,0,0,0,0,,,,,
tinyllama,TinyLlama,764,main_graph$async_dispatch_328_elementwise_4x128x32_f32xi8,,1,,quantize_f32_to_i8,quantize_f32_to_i8,,0,0,0,,,,,,0,0,0,0,0,0,,,,,
tinyllama,TinyLlama,765,main_graph$async_dispatch_329_elementwise_131072_i8xf32,,1,,dequantize_i8_to_f32,dequantize_i8_to_f32,,0,0,0,,,,,,0,0,0,0,0,0,,,,,
tinyllama,TinyLlama,766,main_graph$async_dispatch_330_elementwise_16384_i8xf32,,1,,dequantize_i8_to_f32,dequantize_i8_to_f32,,0,0,0,,,,,,0,0,0,0,0,0,,,,,
tinyllama,TinyLlama,767,main_graph$async_dispatch_331_elementwise_32x128x32_f32,,1,,activation,activation,,0,0,0,,,,,,0,0,0,0,0,0,,,,,
tinyllama,TinyLlama,768,main_graph$async_dispatch_332_elementwise_4x128x32_f32,,1,,activation,activation,,0,0,0,,,,,,0,0,0,0,0,0,,,,,
tinyllama,TinyLlama,769,main_graph$async_dispatch_333_elementwise_broadcast_4x8x128x64_i32xi8,,1,,requantize_i32_to_i8,requantize_i32_to_i8,,0,0,0,,,,,,0,0,0,0,0,0,,,,,
tinyllama,TinyLlama,770,main_graph$async_dispatch_338_elementwise_32768_f32xi8,,1,,quantize_f32_to_i8,quantize_f32_to_i8,,0,0,0,,,,,,0,0,0,0,0,0,,,,,
tinyllama,TinyLlama,771,main_graph$async_dispatch_339_elementwise_transpose_32x128x64_f32xf32xf32xf32xi8,,1,,elementwise_multi_dtype,elementwise_multi_dtype,,0,0,0,,,,,,0,0,0,0,0,0,,,,,
tinyllama,TinyLlama,772,main_graph$async_dispatch_340_elementwise_262144_i8xf32xi8,,1,,elementwise_other,elementwise_other,,0,0,0,,,,,,0,0,0,0,0,0,,,,,
tinyllama,TinyLlama,773,main_graph$async_dispatch_341_elementwise_broadcast_4x8x128x64_f32xf32xi8xf32xf32xi8,,1,,elementwise_multi_dtype,elementwise_multi_dtype,,0,0,0,,,,,,0,0,0,0,0,0,,,,,
tinyllama,TinyLlama,774,main_graph$async_dispatch_342_batch_matmul_32x128x128x64_i8xi8xi32,,1,,encoding_32x32_tile,encoding_32x32_tile,,0,0,0,,,,,,4,0,0,0,0,0,,,,,
tinyllama,TinyLlama,775,main_graph$async_dispatch_344_batch_matmul_32x128x64x128_i8xi8xi32,,1,,encoding_32x32_tile,encoding_32x32_tile,,0,0,0,,,,,,4,0,0,0,0,0,,,,,
tinyllama,TinyLlama,776,main_graph$async_dispatch_345_batch_matmul_1x128x2048x2048_i8xi8xi32,,1,,encoding_32x32_tile,encoding_32x32_tile,,0,0,0,,,,,,4,0,0,0,0,0,,,,,
tinyllama,TinyLlama,777,main_graph$async_dispatch_346_elementwise_262144_i8xf32,,1,,dequantize_i8_to_f32,dequantize_i8_to_f32,,0,0,0,,,,,,0,0,0,0,0,0,,,,,
tinyllama,TinyLlama,778,main_graph$async_dispatch_347_reduction_128x2048_f32,,1,,rvv_reduction_softmax_norm,rvv_reduction_softmax_norm,,0,0,0,,,,,,0,0,0,0,0,0,,,,,
tinyllama,TinyLlama,779,main_graph$async_dispatch_348_elementwise_128_i8xf32xf32,,1,,elementwise_other,elementwise_other,,0,0,0,,,,,,0,0,0,0,0,0,,,,,
tinyllama,TinyLlama,780,main_graph$async_dispatch_349_elementwise_128x2048_f32xf32xi8,,1,,elementwise_other,elementwise_other,,0,0,0,,,,,,0,0,0,0,0,0,,,,,
tinyllama,TinyLlama,781,main_graph$async_dispatch_350_elementwise_128x2048_i8,,1,,activation,activation,,0,0,0,,,,,,0,0,0,0,0,0,,,,,
tinyllama,TinyLlama,782,main_graph$async_dispatch_351_batch_matmul_1x128x5632x2048_i8xi8xi32,,1,,encoding_32x32_tile,encoding_32x32_tile,,0,0,0,,,,,,4,0,0,0,0,0,,,,,
tinyllama,TinyLlama,783,main_graph$async_dispatch_352_batch_matmul_1x128x5632x2048_i8xi8xi32,,1,,encoding_32x32_tile,encoding_32x32_tile,,0,0,0,,,,,,4,0,0,0,0,0,,,,,
tinyllama,TinyLlama,784,main_graph$async_dispatch_353_batch_matmul_1x128x2048x5632_i8xi8xi32,,1,,encoding_32x32_tile,encoding_32x32_tile,,0,0,0,,,,,,4,0,0,0,0,0,,,,,
tinyllama,TinyLlama,785,main_graph$async_dispatch_354_elementwise_262144_i8xf32,,1,,dequantize_i8_to_f32,dequantize_i8_to_f32,,0,0,0,,,,,,0,0,0,0,0,0,,,,,
tinyllama,TinyLlama,786,main_graph$async_dispatch_355_reduction_128x2048_f32,,1,,rvv_reduction_softmax_norm,rvv_reduction_softmax_norm,,0,0,0,,,,,,0,0,0,0,0,0,,,,,
tinyllama,TinyLlama,787,main_graph$async_dispatch_356_elementwise_128_i8xf32xf32,,1,,elementwise_other,elementwise_other,,0,0,0,,,,,,0,0,0,0,0,0,,,,,
tinyllama,TinyLlama,788,main_graph$async_dispatch_357_elementwise_128x2048_f32xf32xi8,,1,,elementwise_other,elementwise_other,,0,0,0,,,,,,0,0,0,0,0,0,,,,,
tinyllama,TinyLlama,789,main_graph$async_dispatch_358_elementwise_128x2048_i8,,1,,activation,activation,,0,0,0,,,,,,0,0,0,0,0,0,,,,,
tinyllama,TinyLlama,790,main_graph$async_dispatch_362_elementwise_262144_i32xi8,,1,,requantize_i32_to_i8,requantize_i32_to_i8,,0,0,0,,,,,,0,0,0,0,0,0,,,,,
tinyllama,TinyLlama,791,main_graph$async_dispatch_363_transpose_128x32x64_f32,,1,,elementwise_other,elementwise_other,,0,0,0,,,,,,0,0,0,0,0,0,,,,,
tinyllama,TinyLlama,792,main_graph$async_dispatch_364_elementwise_32768_i32xi8,,1,,requantize_i32_to_i8,requantize_i32_to_i8,,0,0,0,,,,,,0,0,0,0,0,0,,,,,
tinyllama,TinyLlama,793,main_graph$async_dispatch_365_transpose_128x4x64_f32,,1,,elementwise_other,elementwise_other,,0,0,0,,,,,,0,0,0,0,0,0,,,,,
tinyllama,TinyLlama,794,main_graph$async_dispatch_366_elementwise_32x128x32_f32xi8,,1,,quantize_f32_to_i8,quantize_f32_to_i8,,0,0,0,,,,,,0,0,0,0,0,0,,,,,
tinyllama,TinyLlama,795,main_graph$async_dispatch_367_elementwise_4x128x32_f32xi8,,1,,quantize_f32_to_i8,quantize_f32_to_i8,,0,0,0,,,,,,0,0,0,0,0,0,,,,,
tinyllama,TinyLlama,796,main_graph$async_dispatch_368_elementwise_131072_i8xf32,,1,,dequantize_i8_to_f32,dequantize_i8_to_f32,,0,0,0,,,,,,0,0,0,0,0,0,,,,,
tinyllama,TinyLlama,797,main_graph$async_dispatch_369_elementwise_16384_i8xf32,,1,,dequantize_i8_to_f32,dequantize_i8_to_f32,,0,0,0,,,,,,0,0,0,0,0,0,,,,,
tinyllama,TinyLlama,798,main_graph$async_dispatch_370_elementwise_32x128x32_f32,,1,,activation,activation,,0,0,0,,,,,,0,0,0,0,0,0,,,,,
tinyllama,TinyLlama,799,main_graph$async_dispatch_371_elementwise_4x128x32_f32,,1,,activation,activation,,0,0,0,,,,,,0,0,0,0,0,0,,,,,
tinyllama,TinyLlama,800,main_graph$async_dispatch_372_elementwise_broadcast_4x8x128x64_i32xi8,,1,,requantize_i32_to_i8,requantize_i32_to_i8,,0,0,0,,,,,,0,0,0,0,0,0,,,,,
tinyllama,TinyLlama,801,main_graph$async_dispatch_377_elementwise_32768_f32xi8,,1,,quantize_f32_to_i8,quantize_f32_to_i8,,0,0,0,,,,,,0,0,0,0,0,0,,,,,
tinyllama,TinyLlama,802,main_graph$async_dispatch_378_elementwise_transpose_32x128x64_f32xf32xf32xf32xi8,,1,,elementwise_multi_dtype,elementwise_multi_dtype,,0,0,0,,,,,,0,0,0,0,0,0,,,,,
tinyllama,TinyLlama,803,main_graph$async_dispatch_379_elementwise_262144_i8xf32xi8,,1,,elementwise_other,elementwise_other,,0,0,0,,,,,,0,0,0,0,0,0,,,,,
tinyllama,TinyLlama,804,main_graph$async_dispatch_380_elementwise_broadcast_4x8x128x64_f32xf32xi8xf32xf32xi8,,1,,elementwise_multi_dtype,elementwise_multi_dtype,,0,0,0,,,,,,0,0,0,0,0,0,,,,,
tinyllama,TinyLlama,805,main_graph$async_dispatch_381_batch_matmul_32x128x128x64_i8xi8xi32,,1,,encoding_32x32_tile,encoding_32x32_tile,,0,0,0,,,,,,4,0,0,0,0,0,,,,,
tinyllama,TinyLlama,806,main_graph$async_dispatch_383_batch_matmul_32x128x64x128_i8xi8xi32,,1,,encoding_32x32_tile,encoding_32x32_tile,,0,0,0,,,,,,4,0,0,0,0,0,,,,,
tinyllama,TinyLlama,807,main_graph$async_dispatch_384_batch_matmul_1x128x2048x2048_i8xi8xi32,,1,,encoding_32x32_tile,encoding_32x32_tile,,0,0,0,,,,,,4,0,0,0,0,0,,,,,
tinyllama,TinyLlama,808,main_graph$async_dispatch_385_elementwise_262144_i8xf32,,1,,dequantize_i8_to_f32,dequantize_i8_to_f32,,0,0,0,,,,,,0,0,0,0,0,0,,,,,
tinyllama,TinyLlama,809,main_graph$async_dispatch_386_reduction_128x2048_f32,,1,,rvv_reduction_softmax_norm,rvv_reduction_softmax_norm,,0,0,0,,,,,,0,0,0,0,0,0,,,,,
tinyllama,TinyLlama,810,main_graph$async_dispatch_387_elementwise_128_i8xf32xf32,,1,,elementwise_other,elementwise_other,,0,0,0,,,,,,0,0,0,0,0,0,,,,,
tinyllama,TinyLlama,811,main_graph$async_dispatch_388_elementwise_128x2048_f32xf32xi8,,1,,elementwise_other,elementwise_other,,0,0,0,,,,,,0,0,0,0,0,0,,,,,
tinyllama,TinyLlama,812,main_graph$async_dispatch_389_elementwise_128x2048_i8,,1,,activation,activation,,0,0,0,,,,,,0,0,0,0,0,0,,,,,
tinyllama,TinyLlama,813,main_graph$async_dispatch_390_batch_matmul_1x128x5632x2048_i8xi8xi32,,1,,encoding_32x32_tile,encoding_32x32_tile,,0,0,0,,,,,,4,0,0,0,0,0,,,,,
tinyllama,TinyLlama,814,main_graph$async_dispatch_391_batch_matmul_1x128x5632x2048_i8xi8xi32,,1,,encoding_32x32_tile,encoding_32x32_tile,,0,0,0,,,,,,4,0,0,0,0,0,,,,,
tinyllama,TinyLlama,815,main_graph$async_dispatch_392_batch_matmul_1x128x2048x5632_i8xi8xi32,,1,,encoding_32x32_tile,encoding_32x32_tile,,0,0,0,,,,,,4,0,0,0,0,0,,,,,
tinyllama,TinyLlama,816,main_graph$async_dispatch_393_elementwise_262144_i8xf32,,1,,dequantize_i8_to_f32,dequantize_i8_to_f32,,0,0,0,,,,,,0,0,0,0,0,0,,,,,
tinyllama,TinyLlama,817,main_graph$async_dispatch_394_reduction_128x2048_f32,,1,,rvv_reduction_softmax_norm,rvv_reduction_softmax_norm,,0,0,0,,,,,,0,0,0,0,0,0,,,,,
tinyllama,TinyLlama,818,main_graph$async_dispatch_395_elementwise_128_i8xf32xf32,,1,,elementwise_other,elementwise_other,,0,0,0,,,,,,0,0,0,0,0,0,,,,,
tinyllama,TinyLlama,819,main_graph$async_dispatch_396_elementwise_128x2048_f32xf32xi8,,1,,elementwise_other,elementwise_other,,0,0,0,,,,,,0,0,0,0,0,0,,,,,
tinyllama,TinyLlama,820,main_graph$async_dispatch_397_elementwise_128x2048_i8,,1,,activation,activation,,0,0,0,,,,,,0,0,0,0,0,0,,,,,
tinyllama,TinyLlama,821,main_graph$async_dispatch_401_elementwise_262144_i32xi8,,1,,requantize_i32_to_i8,requantize_i32_to_i8,,0,0,0,,,,,,0,0,0,0,0,0,,,,,
tinyllama,TinyLlama,822,main_graph$async_dispatch_402_transpose_128x32x64_f32,,1,,elementwise_other,elementwise_other,,0,0,0,,,,,,0,0,0,0,0,0,,,,,
tinyllama,TinyLlama,823,main_graph$async_dispatch_403_elementwise_32768_i32xi8,,1,,requantize_i32_to_i8,requantize_i32_to_i8,,0,0,0,,,,,,0,0,0,0,0,0,,,,,
tinyllama,TinyLlama,824,main_graph$async_dispatch_404_transpose_128x4x64_f32,,1,,elementwise_other,elementwise_other,,0,0,0,,,,,,0,0,0,0,0,0,,,,,
tinyllama,TinyLlama,825,main_graph$async_dispatch_405_elementwise_32x128x32_f32xi8,,1,,quantize_f32_to_i8,quantize_f32_to_i8,,0,0,0,,,,,,0,0,0,0,0,0,,,,,
tinyllama,TinyLlama,826,main_graph$async_dispatch_406_elementwise_4x128x32_f32xi8,,1,,quantize_f32_to_i8,quantize_f32_to_i8,,0,0,0,,,,,,0,0,0,0,0,0,,,,,
tinyllama,TinyLlama,827,main_graph$async_dispatch_407_elementwise_131072_i8xf32,,1,,dequantize_i8_to_f32,dequantize_i8_to_f32,,0,0,0,,,,,,0,0,0,0,0,0,,,,,
tinyllama,TinyLlama,828,main_graph$async_dispatch_408_elementwise_16384_i8xf32,,1,,dequantize_i8_to_f32,dequantize_i8_to_f32,,0,0,0,,,,,,0,0,0,0,0,0,,,,,
tinyllama,TinyLlama,829,main_graph$async_dispatch_409_elementwise_32x128x32_f32,,1,,activation,activation,,0,0,0,,,,,,0,0,0,0,0,0,,,,,
tinyllama,TinyLlama,830,main_graph$async_dispatch_410_elementwise_4x128x32_f32,,1,,activation,activation,,0,0,0,,,,,,0,0,0,0,0,0,,,,,
tinyllama,TinyLlama,831,main_graph$async_dispatch_411_elementwise_broadcast_4x8x128x64_i32xi8,,1,,requantize_i32_to_i8,requantize_i32_to_i8,,0,0,0,,,,,,0,0,0,0,0,0,,,,,
tinyllama,TinyLlama,832,main_graph$async_dispatch_416_elementwise_32768_f32xi8,,1,,quantize_f32_to_i8,quantize_f32_to_i8,,0,0,0,,,,,,0,0,0,0,0,0,,,,,
tinyllama,TinyLlama,833,main_graph$async_dispatch_417_elementwise_transpose_32x128x64_f32xf32xf32xf32xi8,,1,,elementwise_multi_dtype,elementwise_multi_dtype,,0,0,0,,,,,,0,0,0,0,0,0,,,,,
tinyllama,TinyLlama,834,main_graph$async_dispatch_418_elementwise_262144_i8xf32xi8,,1,,elementwise_other,elementwise_other,,0,0,0,,,,,,0,0,0,0,0,0,,,,,
tinyllama,TinyLlama,835,main_graph$async_dispatch_419_elementwise_broadcast_4x8x128x64_f32xf32xi8xf32xf32xi8,,1,,elementwise_multi_dtype,elementwise_multi_dtype,,0,0,0,,,,,,0,0,0,0,0,0,,,,,
tinyllama,TinyLlama,836,main_graph$async_dispatch_420_batch_matmul_32x128x128x64_i8xi8xi32,,1,,encoding_32x32_tile,encoding_32x32_tile,,0,0,0,,,,,,4,0,0,0,0,0,,,,,
tinyllama,TinyLlama,837,main_graph$async_dispatch_422_batch_matmul_32x128x64x128_i8xi8xi32,,1,,encoding_32x32_tile,encoding_32x32_tile,,0,0,0,,,,,,4,0,0,0,0,0,,,,,
tinyllama,TinyLlama,838,main_graph$async_dispatch_423_batch_matmul_1x128x2048x2048_i8xi8xi32,,1,,encoding_32x32_tile,encoding_32x32_tile,,0,0,0,,,,,,4,0,0,0,0,0,,,,,
tinyllama,TinyLlama,839,main_graph$async_dispatch_424_elementwise_262144_i8xf32,,1,,dequantize_i8_to_f32,dequantize_i8_to_f32,,0,0,0,,,,,,0,0,0,0,0,0,,,,,
tinyllama,TinyLlama,840,main_graph$async_dispatch_425_reduction_128x2048_f32,,1,,rvv_reduction_softmax_norm,rvv_reduction_softmax_norm,,0,0,0,,,,,,0,0,0,0,0,0,,,,,
tinyllama,TinyLlama,841,main_graph$async_dispatch_426_elementwise_128_i8xf32xf32,,1,,elementwise_other,elementwise_other,,0,0,0,,,,,,0,0,0,0,0,0,,,,,
tinyllama,TinyLlama,842,main_graph$async_dispatch_427_elementwise_128x2048_f32xf32xi8,,1,,elementwise_other,elementwise_other,,0,0,0,,,,,,0,0,0,0,0,0,,,,,
tinyllama,TinyLlama,843,main_graph$async_dispatch_428_elementwise_128x2048_i8,,1,,activation,activation,,0,0,0,,,,,,0,0,0,0,0,0,,,,,
tinyllama,TinyLlama,844,main_graph$async_dispatch_429_batch_matmul_1x128x5632x2048_i8xi8xi32,,1,,encoding_32x32_tile,encoding_32x32_tile,,0,0,0,,,,,,4,0,0,0,0,0,,,,,
tinyllama,TinyLlama,845,main_graph$async_dispatch_430_batch_matmul_1x128x5632x2048_i8xi8xi32,,1,,encoding_32x32_tile,encoding_32x32_tile,,0,0,0,,,,,,4,0,0,0,0,0,,,,,
tinyllama,TinyLlama,846,main_graph$async_dispatch_431_batch_matmul_1x128x2048x5632_i8xi8xi32,,1,,encoding_32x32_tile,encoding_32x32_tile,,0,0,0,,,,,,4,0,0,0,0,0,,,,,
tinyllama,TinyLlama,847,main_graph$async_dispatch_432_elementwise_262144_i8xf32,,1,,dequantize_i8_to_f32,dequantize_i8_to_f32,,0,0,0,,,,,,0,0,0,0,0,0,,,,,
tinyllama,TinyLlama,848,main_graph$async_dispatch_433_reduction_128x2048_f32,,1,,rvv_reduction_softmax_norm,rvv_reduction_softmax_norm,,0,0,0,,,,,,0,0,0,0,0,0,,,,,
tinyllama,TinyLlama,849,main_graph$async_dispatch_434_elementwise_128_i8xf32xf32,,1,,elementwise_other,elementwise_other,,0,0,0,,,,,,0,0,0,0,0,0,,,,,
tinyllama,TinyLlama,850,main_graph$async_dispatch_435_elementwise_128x2048_f32xf32xi8,,1,,elementwise_other,elementwise_other,,0,0,0,,,,,,0,0,0,0,0,0,,,,,
tinyllama,TinyLlama,851,main_graph$async_dispatch_436_elementwise_128x2048_i8,,1,,activation,activation,,0,0,0,,,,,,0,0,0,0,0,0,,,,,
tinyllama,TinyLlama,852,main_graph$async_dispatch_440_elementwise_262144_i32xi8,,1,,requantize_i32_to_i8,requantize_i32_to_i8,,0,0,0,,,,,,0,0,0,0,0,0,,,,,
tinyllama,TinyLlama,853,main_graph$async_dispatch_441_transpose_128x32x64_f32,,1,,elementwise_other,elementwise_other,,0,0,0,,,,,,0,0,0,0,0,0,,,,,
tinyllama,TinyLlama,854,main_graph$async_dispatch_442_elementwise_32768_i32xi8,,1,,requantize_i32_to_i8,requantize_i32_to_i8,,0,0,0,,,,,,0,0,0,0,0,0,,,,,
tinyllama,TinyLlama,855,main_graph$async_dispatch_443_transpose_128x4x64_f32,,1,,elementwise_other,elementwise_other,,0,0,0,,,,,,0,0,0,0,0,0,,,,,
tinyllama,TinyLlama,856,main_graph$async_dispatch_444_elementwise_32x128x32_f32xi8,,1,,quantize_f32_to_i8,quantize_f32_to_i8,,0,0,0,,,,,,0,0,0,0,0,0,,,,,
tinyllama,TinyLlama,857,main_graph$async_dispatch_445_elementwise_4x128x32_f32xi8,,1,,quantize_f32_to_i8,quantize_f32_to_i8,,0,0,0,,,,,,0,0,0,0,0,0,,,,,
tinyllama,TinyLlama,858,main_graph$async_dispatch_446_elementwise_131072_i8xf32,,1,,dequantize_i8_to_f32,dequantize_i8_to_f32,,0,0,0,,,,,,0,0,0,0,0,0,,,,,
tinyllama,TinyLlama,859,main_graph$async_dispatch_447_elementwise_16384_i8xf32,,1,,dequantize_i8_to_f32,dequantize_i8_to_f32,,0,0,0,,,,,,0,0,0,0,0,0,,,,,
tinyllama,TinyLlama,860,main_graph$async_dispatch_448_elementwise_32x128x32_f32,,1,,activation,activation,,0,0,0,,,,,,0,0,0,0,0,0,,,,,
tinyllama,TinyLlama,861,main_graph$async_dispatch_449_elementwise_4x128x32_f32,,1,,activation,activation,,0,0,0,,,,,,0,0,0,0,0,0,,,,,
tinyllama,TinyLlama,862,main_graph$async_dispatch_450_elementwise_broadcast_4x8x128x64_i32xi8,,1,,requantize_i32_to_i8,requantize_i32_to_i8,,0,0,0,,,,,,0,0,0,0,0,0,,,,,
tinyllama,TinyLlama,863,main_graph$async_dispatch_455_elementwise_32768_f32xi8,,1,,quantize_f32_to_i8,quantize_f32_to_i8,,0,0,0,,,,,,0,0,0,0,0,0,,,,,
tinyllama,TinyLlama,864,main_graph$async_dispatch_456_elementwise_transpose_32x128x64_f32xf32xf32xf32xi8,,1,,elementwise_multi_dtype,elementwise_multi_dtype,,0,0,0,,,,,,0,0,0,0,0,0,,,,,
tinyllama,TinyLlama,865,main_graph$async_dispatch_457_elementwise_262144_i8xf32xi8,,1,,elementwise_other,elementwise_other,,0,0,0,,,,,,0,0,0,0,0,0,,,,,
tinyllama,TinyLlama,866,main_graph$async_dispatch_458_elementwise_broadcast_4x8x128x64_f32xf32xi8xf32xf32xi8,,1,,elementwise_multi_dtype,elementwise_multi_dtype,,0,0,0,,,,,,0,0,0,0,0,0,,,,,
tinyllama,TinyLlama,867,main_graph$async_dispatch_459_batch_matmul_32x128x128x64_i8xi8xi32,,1,,encoding_32x32_tile,encoding_32x32_tile,,0,0,0,,,,,,4,0,0,0,0,0,,,,,
tinyllama,TinyLlama,868,main_graph$async_dispatch_461_batch_matmul_32x128x64x128_i8xi8xi32,,1,,encoding_32x32_tile,encoding_32x32_tile,,0,0,0,,,,,,4,0,0,0,0,0,,,,,
tinyllama,TinyLlama,869,main_graph$async_dispatch_462_batch_matmul_1x128x2048x2048_i8xi8xi32,,1,,encoding_32x32_tile,encoding_32x32_tile,,0,0,0,,,,,,4,0,0,0,0,0,,,,,
tinyllama,TinyLlama,870,main_graph$async_dispatch_463_elementwise_262144_i8xf32,,1,,dequantize_i8_to_f32,dequantize_i8_to_f32,,0,0,0,,,,,,0,0,0,0,0,0,,,,,
tinyllama,TinyLlama,871,main_graph$async_dispatch_464_reduction_128x2048_f32,,1,,rvv_reduction_softmax_norm,rvv_reduction_softmax_norm,,0,0,0,,,,,,0,0,0,0,0,0,,,,,
tinyllama,TinyLlama,872,main_graph$async_dispatch_465_elementwise_128_i8xf32xf32,,1,,elementwise_other,elementwise_other,,0,0,0,,,,,,0,0,0,0,0,0,,,,,
tinyllama,TinyLlama,873,main_graph$async_dispatch_466_elementwise_128x2048_f32xf32xi8,,1,,elementwise_other,elementwise_other,,0,0,0,,,,,,0,0,0,0,0,0,,,,,
tinyllama,TinyLlama,874,main_graph$async_dispatch_467_elementwise_128x2048_i8,,1,,activation,activation,,0,0,0,,,,,,0,0,0,0,0,0,,,,,
tinyllama,TinyLlama,875,main_graph$async_dispatch_468_batch_matmul_1x128x5632x2048_i8xi8xi32,,1,,encoding_32x32_tile,encoding_32x32_tile,,0,0,0,,,,,,4,0,0,0,0,0,,,,,
tinyllama,TinyLlama,876,main_graph$async_dispatch_469_batch_matmul_1x128x5632x2048_i8xi8xi32,,1,,encoding_32x32_tile,encoding_32x32_tile,,0,0,0,,,,,,4,0,0,0,0,0,,,,,
tinyllama,TinyLlama,877,main_graph$async_dispatch_470_batch_matmul_1x128x2048x5632_i8xi8xi32,,1,,encoding_32x32_tile,encoding_32x32_tile,,0,0,0,,,,,,4,0,0,0,0,0,,,,,
tinyllama,TinyLlama,878,main_graph$async_dispatch_471_elementwise_262144_i8xf32,,1,,dequantize_i8_to_f32,dequantize_i8_to_f32,,0,0,0,,,,,,0,0,0,0,0,0,,,,,
tinyllama,TinyLlama,879,main_graph$async_dispatch_472_reduction_128x2048_f32,,1,,rvv_reduction_softmax_norm,rvv_reduction_softmax_norm,,0,0,0,,,,,,0,0,0,0,0,0,,,,,
tinyllama,TinyLlama,880,main_graph$async_dispatch_473_elementwise_128_i8xf32xf32,,1,,elementwise_other,elementwise_other,,0,0,0,,,,,,0,0,0,0,0,0,,,,,
tinyllama,TinyLlama,881,main_graph$async_dispatch_474_elementwise_128x2048_f32xf32xi8,,1,,elementwise_other,elementwise_other,,0,0,0,,,,,,0,0,0,0,0,0,,,,,
tinyllama,TinyLlama,882,main_graph$async_dispatch_475_elementwise_128x2048_i8,,1,,activation,activation,,0,0,0,,,,,,0,0,0,0,0,0,,,,,
tinyllama,TinyLlama,883,main_graph$async_dispatch_479_elementwise_262144_i32xi8,,1,,requantize_i32_to_i8,requantize_i32_to_i8,,0,0,0,,,,,,0,0,0,0,0,0,,,,,
tinyllama,TinyLlama,884,main_graph$async_dispatch_480_transpose_128x32x64_f32,,1,,elementwise_other,elementwise_other,,0,0,0,,,,,,0,0,0,0,0,0,,,,,
tinyllama,TinyLlama,885,main_graph$async_dispatch_481_elementwise_32768_i32xi8,,1,,requantize_i32_to_i8,requantize_i32_to_i8,,0,0,0,,,,,,0,0,0,0,0,0,,,,,
tinyllama,TinyLlama,886,main_graph$async_dispatch_482_transpose_128x4x64_f32,,1,,elementwise_other,elementwise_other,,0,0,0,,,,,,0,0,0,0,0,0,,,,,
tinyllama,TinyLlama,887,main_graph$async_dispatch_483_elementwise_32x128x32_f32xi8,,1,,quantize_f32_to_i8,quantize_f32_to_i8,,0,0,0,,,,,,0,0,0,0,0,0,,,,,
tinyllama,TinyLlama,888,main_graph$async_dispatch_484_elementwise_4x128x32_f32xi8,,1,,quantize_f32_to_i8,quantize_f32_to_i8,,0,0,0,,,,,,0,0,0,0,0,0,,,,,
tinyllama,TinyLlama,889,main_graph$async_dispatch_485_elementwise_131072_i8xf32,,1,,dequantize_i8_to_f32,dequantize_i8_to_f32,,0,0,0,,,,,,0,0,0,0,0,0,,,,,
tinyllama,TinyLlama,890,main_graph$async_dispatch_486_elementwise_16384_i8xf32,,1,,dequantize_i8_to_f32,dequantize_i8_to_f32,,0,0,0,,,,,,0,0,0,0,0,0,,,,,
tinyllama,TinyLlama,891,main_graph$async_dispatch_487_elementwise_32x128x32_f32,,1,,activation,activation,,0,0,0,,,,,,0,0,0,0,0,0,,,,,
tinyllama,TinyLlama,892,main_graph$async_dispatch_488_elementwise_4x128x32_f32,,1,,activation,activation,,0,0,0,,,,,,0,0,0,0,0,0,,,,,
tinyllama,TinyLlama,893,main_graph$async_dispatch_489_elementwise_broadcast_4x8x128x64_i32xi8,,1,,requantize_i32_to_i8,requantize_i32_to_i8,,0,0,0,,,,,,0,0,0,0,0,0,,,,,
tinyllama,TinyLlama,894,main_graph$async_dispatch_494_elementwise_32768_f32xi8,,1,,quantize_f32_to_i8,quantize_f32_to_i8,,0,0,0,,,,,,0,0,0,0,0,0,,,,,
tinyllama,TinyLlama,895,main_graph$async_dispatch_495_elementwise_transpose_32x128x64_f32xf32xf32xf32xi8,,1,,elementwise_multi_dtype,elementwise_multi_dtype,,0,0,0,,,,,,0,0,0,0,0,0,,,,,
tinyllama,TinyLlama,896,main_graph$async_dispatch_496_elementwise_262144_i8xf32xi8,,1,,elementwise_other,elementwise_other,,0,0,0,,,,,,0,0,0,0,0,0,,,,,
tinyllama,TinyLlama,897,main_graph$async_dispatch_497_elementwise_broadcast_4x8x128x64_f32xf32xi8xf32xf32xi8,,1,,elementwise_multi_dtype,elementwise_multi_dtype,,0,0,0,,,,,,0,0,0,0,0,0,,,,,
tinyllama,TinyLlama,898,main_graph$async_dispatch_498_batch_matmul_32x128x128x64_i8xi8xi32,,1,,encoding_32x32_tile,encoding_32x32_tile,,0,0,0,,,,,,4,0,0,0,0,0,,,,,
tinyllama,TinyLlama,899,main_graph$async_dispatch_500_batch_matmul_32x128x64x128_i8xi8xi32,,1,,encoding_32x32_tile,encoding_32x32_tile,,0,0,0,,,,,,4,0,0,0,0,0,,,,,
tinyllama,TinyLlama,900,main_graph$async_dispatch_501_batch_matmul_1x128x2048x2048_i8xi8xi32,,1,,encoding_32x32_tile,encoding_32x32_tile,,0,0,0,,,,,,4,0,0,0,0,0,,,,,
tinyllama,TinyLlama,901,main_graph$async_dispatch_502_elementwise_262144_i8xf32,,1,,dequantize_i8_to_f32,dequantize_i8_to_f32,,0,0,0,,,,,,0,0,0,0,0,0,,,,,
tinyllama,TinyLlama,902,main_graph$async_dispatch_503_reduction_128x2048_f32,,1,,rvv_reduction_softmax_norm,rvv_reduction_softmax_norm,,0,0,0,,,,,,0,0,0,0,0,0,,,,,
tinyllama,TinyLlama,903,main_graph$async_dispatch_504_elementwise_128_i8xf32xf32,,1,,elementwise_other,elementwise_other,,0,0,0,,,,,,0,0,0,0,0,0,,,,,
tinyllama,TinyLlama,904,main_graph$async_dispatch_505_elementwise_128x2048_f32xf32xi8,,1,,elementwise_other,elementwise_other,,0,0,0,,,,,,0,0,0,0,0,0,,,,,
tinyllama,TinyLlama,905,main_graph$async_dispatch_506_elementwise_128x2048_i8,,1,,activation,activation,,0,0,0,,,,,,0,0,0,0,0,0,,,,,
tinyllama,TinyLlama,906,main_graph$async_dispatch_507_batch_matmul_1x128x5632x2048_i8xi8xi32,,1,,encoding_32x32_tile,encoding_32x32_tile,,0,0,0,,,,,,4,0,0,0,0,0,,,,,
tinyllama,TinyLlama,907,main_graph$async_dispatch_508_batch_matmul_1x128x5632x2048_i8xi8xi32,,1,,encoding_32x32_tile,encoding_32x32_tile,,0,0,0,,,,,,4,0,0,0,0,0,,,,,
tinyllama,TinyLlama,908,main_graph$async_dispatch_509_batch_matmul_1x128x2048x5632_i8xi8xi32,,1,,encoding_32x32_tile,encoding_32x32_tile,,0,0,0,,,,,,4,0,0,0,0,0,,,,,
tinyllama,TinyLlama,909,main_graph$async_dispatch_510_elementwise_262144_i8xf32,,1,,dequantize_i8_to_f32,dequantize_i8_to_f32,,0,0,0,,,,,,0,0,0,0,0,0,,,,,
tinyllama,TinyLlama,910,main_graph$async_dispatch_511_reduction_128x2048_f32,,1,,rvv_reduction_softmax_norm,rvv_reduction_softmax_norm,,0,0,0,,,,,,0,0,0,0,0,0,,,,,
tinyllama,TinyLlama,911,main_graph$async_dispatch_512_elementwise_128_i8xf32xf32,,1,,elementwise_other,elementwise_other,,0,0,0,,,,,,0,0,0,0,0,0,,,,,
tinyllama,TinyLlama,912,main_graph$async_dispatch_513_elementwise_128x2048_f32xf32xi8,,1,,elementwise_other,elementwise_other,,0,0,0,,,,,,0,0,0,0,0,0,,,,,
tinyllama,TinyLlama,913,main_graph$async_dispatch_514_elementwise_128x2048_i8,,1,,activation,activation,,0,0,0,,,,,,0,0,0,0,0,0,,,,,
tinyllama,TinyLlama,914,main_graph$async_dispatch_518_elementwise_262144_i32xi8,,1,,requantize_i32_to_i8,requantize_i32_to_i8,,0,0,0,,,,,,0,0,0,0,0,0,,,,,
tinyllama,TinyLlama,915,main_graph$async_dispatch_519_transpose_128x32x64_f32,,1,,elementwise_other,elementwise_other,,0,0,0,,,,,,0,0,0,0,0,0,,,,,
tinyllama,TinyLlama,916,main_graph$async_dispatch_520_elementwise_32768_i32xi8,,1,,requantize_i32_to_i8,requantize_i32_to_i8,,0,0,0,,,,,,0,0,0,0,0,0,,,,,
tinyllama,TinyLlama,917,main_graph$async_dispatch_521_transpose_128x4x64_f32,,1,,elementwise_other,elementwise_other,,0,0,0,,,,,,0,0,0,0,0,0,,,,,
tinyllama,TinyLlama,918,main_graph$async_dispatch_522_elementwise_32x128x32_f32xi8,,1,,quantize_f32_to_i8,quantize_f32_to_i8,,0,0,0,,,,,,0,0,0,0,0,0,,,,,
tinyllama,TinyLlama,919,main_graph$async_dispatch_523_elementwise_4x128x32_f32xi8,,1,,quantize_f32_to_i8,quantize_f32_to_i8,,0,0,0,,,,,,0,0,0,0,0,0,,,,,
tinyllama,TinyLlama,920,main_graph$async_dispatch_524_elementwise_131072_i8xf32,,1,,dequantize_i8_to_f32,dequantize_i8_to_f32,,0,0,0,,,,,,0,0,0,0,0,0,,,,,
tinyllama,TinyLlama,921,main_graph$async_dispatch_525_elementwise_16384_i8xf32,,1,,dequantize_i8_to_f32,dequantize_i8_to_f32,,0,0,0,,,,,,0,0,0,0,0,0,,,,,
tinyllama,TinyLlama,922,main_graph$async_dispatch_526_elementwise_32x128x32_f32,,1,,activation,activation,,0,0,0,,,,,,0,0,0,0,0,0,,,,,
tinyllama,TinyLlama,923,main_graph$async_dispatch_527_elementwise_4x128x32_f32,,1,,activation,activation,,0,0,0,,,,,,0,0,0,0,0,0,,,,,
tinyllama,TinyLlama,924,main_graph$async_dispatch_528_elementwise_broadcast_4x8x128x64_i32xi8,,1,,requantize_i32_to_i8,requantize_i32_to_i8,,0,0,0,,,,,,0,0,0,0,0,0,,,,,
tinyllama,TinyLlama,925,main_graph$async_dispatch_533_elementwise_32768_f32xi8,,1,,quantize_f32_to_i8,quantize_f32_to_i8,,0,0,0,,,,,,0,0,0,0,0,0,,,,,
tinyllama,TinyLlama,926,main_graph$async_dispatch_534_elementwise_transpose_32x128x64_f32xf32xf32xf32xi8,,1,,elementwise_multi_dtype,elementwise_multi_dtype,,0,0,0,,,,,,0,0,0,0,0,0,,,,,
tinyllama,TinyLlama,927,main_graph$async_dispatch_535_elementwise_262144_i8xf32xi8,,1,,elementwise_other,elementwise_other,,0,0,0,,,,,,0,0,0,0,0,0,,,,,
tinyllama,TinyLlama,928,main_graph$async_dispatch_536_elementwise_broadcast_4x8x128x64_f32xf32xi8xf32xf32xi8,,1,,elementwise_multi_dtype,elementwise_multi_dtype,,0,0,0,,,,,,0,0,0,0,0,0,,,,,
tinyllama,TinyLlama,929,main_graph$async_dispatch_537_batch_matmul_32x128x128x64_i8xi8xi32,,1,,encoding_32x32_tile,encoding_32x32_tile,,0,0,0,,,,,,4,0,0,0,0,0,,,,,
tinyllama,TinyLlama,930,main_graph$async_dispatch_539_batch_matmul_32x128x64x128_i8xi8xi32,,1,,encoding_32x32_tile,encoding_32x32_tile,,0,0,0,,,,,,4,0,0,0,0,0,,,,,
tinyllama,TinyLlama,931,main_graph$async_dispatch_540_batch_matmul_1x128x2048x2048_i8xi8xi32,,1,,encoding_32x32_tile,encoding_32x32_tile,,0,0,0,,,,,,4,0,0,0,0,0,,,,,
tinyllama,TinyLlama,932,main_graph$async_dispatch_541_elementwise_262144_i8xf32,,1,,dequantize_i8_to_f32,dequantize_i8_to_f32,,0,0,0,,,,,,0,0,0,0,0,0,,,,,
tinyllama,TinyLlama,933,main_graph$async_dispatch_542_reduction_128x2048_f32,,1,,rvv_reduction_softmax_norm,rvv_reduction_softmax_norm,,0,0,0,,,,,,0,0,0,0,0,0,,,,,
tinyllama,TinyLlama,934,main_graph$async_dispatch_543_elementwise_128_i8xf32xf32,,1,,elementwise_other,elementwise_other,,0,0,0,,,,,,0,0,0,0,0,0,,,,,
tinyllama,TinyLlama,935,main_graph$async_dispatch_544_elementwise_128x2048_f32xf32xi8,,1,,elementwise_other,elementwise_other,,0,0,0,,,,,,0,0,0,0,0,0,,,,,
tinyllama,TinyLlama,936,main_graph$async_dispatch_545_elementwise_128x2048_i8,,1,,activation,activation,,0,0,0,,,,,,0,0,0,0,0,0,,,,,
tinyllama,TinyLlama,937,main_graph$async_dispatch_546_batch_matmul_1x128x5632x2048_i8xi8xi32,,1,,encoding_32x32_tile,encoding_32x32_tile,,0,0,0,,,,,,4,0,0,0,0,0,,,,,
tinyllama,TinyLlama,938,main_graph$async_dispatch_547_batch_matmul_1x128x5632x2048_i8xi8xi32,,1,,encoding_32x32_tile,encoding_32x32_tile,,0,0,0,,,,,,4,0,0,0,0,0,,,,,
tinyllama,TinyLlama,939,main_graph$async_dispatch_548_batch_matmul_1x128x2048x5632_i8xi8xi32,,1,,encoding_32x32_tile,encoding_32x32_tile,,0,0,0,,,,,,4,0,0,0,0,0,,,,,
tinyllama,TinyLlama,940,main_graph$async_dispatch_549_elementwise_262144_i8xf32,,1,,dequantize_i8_to_f32,dequantize_i8_to_f32,,0,0,0,,,,,,0,0,0,0,0,0,,,,,
tinyllama,TinyLlama,941,main_graph$async_dispatch_550_reduction_128x2048_f32,,1,,rvv_reduction_softmax_norm,rvv_reduction_softmax_norm,,0,0,0,,,,,,0,0,0,0,0,0,,,,,
tinyllama,TinyLlama,942,main_graph$async_dispatch_551_elementwise_128_i8xf32xf32,,1,,elementwise_other,elementwise_other,,0,0,0,,,,,,0,0,0,0,0,0,,,,,
tinyllama,TinyLlama,943,main_graph$async_dispatch_552_elementwise_128x2048_f32xf32xi8,,1,,elementwise_other,elementwise_other,,0,0,0,,,,,,0,0,0,0,0,0,,,,,
tinyllama,TinyLlama,944,main_graph$async_dispatch_553_elementwise_128x2048_i8,,1,,activation,activation,,0,0,0,,,,,,0,0,0,0,0,0,,,,,
tinyllama,TinyLlama,945,main_graph$async_dispatch_557_elementwise_262144_i32xi8,,1,,requantize_i32_to_i8,requantize_i32_to_i8,,0,0,0,,,,,,0,0,0,0,0,0,,,,,
tinyllama,TinyLlama,946,main_graph$async_dispatch_558_transpose_128x32x64_f32,,1,,elementwise_other,elementwise_other,,0,0,0,,,,,,0,0,0,0,0,0,,,,,
tinyllama,TinyLlama,947,main_graph$async_dispatch_559_elementwise_32768_i32xi8,,1,,requantize_i32_to_i8,requantize_i32_to_i8,,0,0,0,,,,,,0,0,0,0,0,0,,,,,
tinyllama,TinyLlama,948,main_graph$async_dispatch_560_transpose_128x4x64_f32,,1,,elementwise_other,elementwise_other,,0,0,0,,,,,,0,0,0,0,0,0,,,,,
tinyllama,TinyLlama,949,main_graph$async_dispatch_561_elementwise_32x128x32_f32xi8,,1,,quantize_f32_to_i8,quantize_f32_to_i8,,0,0,0,,,,,,0,0,0,0,0,0,,,,,
tinyllama,TinyLlama,950,main_graph$async_dispatch_562_elementwise_4x128x32_f32xi8,,1,,quantize_f32_to_i8,quantize_f32_to_i8,,0,0,0,,,,,,0,0,0,0,0,0,,,,,
tinyllama,TinyLlama,951,main_graph$async_dispatch_563_elementwise_131072_i8xf32,,1,,dequantize_i8_to_f32,dequantize_i8_to_f32,,0,0,0,,,,,,0,0,0,0,0,0,,,,,
tinyllama,TinyLlama,952,main_graph$async_dispatch_564_elementwise_16384_i8xf32,,1,,dequantize_i8_to_f32,dequantize_i8_to_f32,,0,0,0,,,,,,0,0,0,0,0,0,,,,,
tinyllama,TinyLlama,953,main_graph$async_dispatch_565_elementwise_32x128x32_f32,,1,,activation,activation,,0,0,0,,,,,,0,0,0,0,0,0,,,,,
tinyllama,TinyLlama,954,main_graph$async_dispatch_566_elementwise_4x128x32_f32,,1,,activation,activation,,0,0,0,,,,,,0,0,0,0,0,0,,,,,
tinyllama,TinyLlama,955,main_graph$async_dispatch_567_elementwise_broadcast_4x8x128x64_i32xi8,,1,,requantize_i32_to_i8,requantize_i32_to_i8,,0,0,0,,,,,,0,0,0,0,0,0,,,,,
tinyllama,TinyLlama,956,main_graph$async_dispatch_572_elementwise_32768_f32xi8,,1,,quantize_f32_to_i8,quantize_f32_to_i8,,0,0,0,,,,,,0,0,0,0,0,0,,,,,
tinyllama,TinyLlama,957,main_graph$async_dispatch_573_elementwise_transpose_32x128x64_f32xf32xf32xf32xi8,,1,,elementwise_multi_dtype,elementwise_multi_dtype,,0,0,0,,,,,,0,0,0,0,0,0,,,,,
tinyllama,TinyLlama,958,main_graph$async_dispatch_574_elementwise_262144_i8xf32xi8,,1,,elementwise_other,elementwise_other,,0,0,0,,,,,,0,0,0,0,0,0,,,,,
tinyllama,TinyLlama,959,main_graph$async_dispatch_575_elementwise_broadcast_4x8x128x64_f32xf32xi8xf32xf32xi8,,1,,elementwise_multi_dtype,elementwise_multi_dtype,,0,0,0,,,,,,0,0,0,0,0,0,,,,,
tinyllama,TinyLlama,960,main_graph$async_dispatch_576_batch_matmul_32x128x128x64_i8xi8xi32,,1,,encoding_32x32_tile,encoding_32x32_tile,,0,0,0,,,,,,4,0,0,0,0,0,,,,,
tinyllama,TinyLlama,961,main_graph$async_dispatch_578_batch_matmul_32x128x64x128_i8xi8xi32,,1,,encoding_32x32_tile,encoding_32x32_tile,,0,0,0,,,,,,4,0,0,0,0,0,,,,,
tinyllama,TinyLlama,962,main_graph$async_dispatch_579_batch_matmul_1x128x2048x2048_i8xi8xi32,,1,,encoding_32x32_tile,encoding_32x32_tile,,0,0,0,,,,,,4,0,0,0,0,0,,,,,
tinyllama,TinyLlama,963,main_graph$async_dispatch_580_elementwise_262144_i8xf32,,1,,dequantize_i8_to_f32,dequantize_i8_to_f32,,0,0,0,,,,,,0,0,0,0,0,0,,,,,
tinyllama,TinyLlama,964,main_graph$async_dispatch_581_reduction_128x2048_f32,,1,,rvv_reduction_softmax_norm,rvv_reduction_softmax_norm,,0,0,0,,,,,,0,0,0,0,0,0,,,,,
tinyllama,TinyLlama,965,main_graph$async_dispatch_582_elementwise_128_i8xf32xf32,,1,,elementwise_other,elementwise_other,,0,0,0,,,,,,0,0,0,0,0,0,,,,,
tinyllama,TinyLlama,966,main_graph$async_dispatch_583_elementwise_128x2048_f32xf32xi8,,1,,elementwise_other,elementwise_other,,0,0,0,,,,,,0,0,0,0,0,0,,,,,
tinyllama,TinyLlama,967,main_graph$async_dispatch_584_elementwise_128x2048_i8,,1,,activation,activation,,0,0,0,,,,,,0,0,0,0,0,0,,,,,
tinyllama,TinyLlama,968,main_graph$async_dispatch_585_batch_matmul_1x128x5632x2048_i8xi8xi32,,1,,encoding_32x32_tile,encoding_32x32_tile,,0,0,0,,,,,,4,0,0,0,0,0,,,,,
tinyllama,TinyLlama,969,main_graph$async_dispatch_586_batch_matmul_1x128x5632x2048_i8xi8xi32,,1,,encoding_32x32_tile,encoding_32x32_tile,,0,0,0,,,,,,4,0,0,0,0,0,,,,,
tinyllama,TinyLlama,970,main_graph$async_dispatch_587_batch_matmul_1x128x2048x5632_i8xi8xi32,,1,,encoding_32x32_tile,encoding_32x32_tile,,0,0,0,,,,,,4,0,0,0,0,0,,,,,
tinyllama,TinyLlama,971,main_graph$async_dispatch_588_elementwise_262144_i8xf32,,1,,dequantize_i8_to_f32,dequantize_i8_to_f32,,0,0,0,,,,,,0,0,0,0,0,0,,,,,
tinyllama,TinyLlama,972,main_graph$async_dispatch_589_reduction_128x2048_f32,,1,,rvv_reduction_softmax_norm,rvv_reduction_softmax_norm,,0,0,0,,,,,,0,0,0,0,0,0,,,,,
tinyllama,TinyLlama,973,main_graph$async_dispatch_590_elementwise_128_i8xf32xf32,,1,,elementwise_other,elementwise_other,,0,0,0,,,,,,0,0,0,0,0,0,,,,,
tinyllama,TinyLlama,974,main_graph$async_dispatch_591_elementwise_128x2048_f32xf32xi8,,1,,elementwise_other,elementwise_other,,0,0,0,,,,,,0,0,0,0,0,0,,,,,
tinyllama,TinyLlama,975,main_graph$async_dispatch_592_elementwise_128x2048_i8,,1,,activation,activation,,0,0,0,,,,,,0,0,0,0,0,0,,,,,
tinyllama,TinyLlama,976,main_graph$async_dispatch_596_elementwise_262144_i32xi8,,1,,requantize_i32_to_i8,requantize_i32_to_i8,,0,0,0,,,,,,0,0,0,0,0,0,,,,,
tinyllama,TinyLlama,977,main_graph$async_dispatch_597_transpose_128x32x64_f32,,1,,elementwise_other,elementwise_other,,0,0,0,,,,,,0,0,0,0,0,0,,,,,
tinyllama,TinyLlama,978,main_graph$async_dispatch_598_elementwise_32768_i32xi8,,1,,requantize_i32_to_i8,requantize_i32_to_i8,,0,0,0,,,,,,0,0,0,0,0,0,,,,,
tinyllama,TinyLlama,979,main_graph$async_dispatch_599_transpose_128x4x64_f32,,1,,elementwise_other,elementwise_other,,0,0,0,,,,,,0,0,0,0,0,0,,,,,
tinyllama,TinyLlama,980,main_graph$async_dispatch_600_elementwise_32x128x32_f32xi8,,1,,quantize_f32_to_i8,quantize_f32_to_i8,,0,0,0,,,,,,0,0,0,0,0,0,,,,,
tinyllama,TinyLlama,981,main_graph$async_dispatch_601_elementwise_4x128x32_f32xi8,,1,,quantize_f32_to_i8,quantize_f32_to_i8,,0,0,0,,,,,,0,0,0,0,0,0,,,,,
tinyllama,TinyLlama,982,main_graph$async_dispatch_602_elementwise_131072_i8xf32,,1,,dequantize_i8_to_f32,dequantize_i8_to_f32,,0,0,0,,,,,,0,0,0,0,0,0,,,,,
tinyllama,TinyLlama,983,main_graph$async_dispatch_603_elementwise_16384_i8xf32,,1,,dequantize_i8_to_f32,dequantize_i8_to_f32,,0,0,0,,,,,,0,0,0,0,0,0,,,,,
tinyllama,TinyLlama,984,main_graph$async_dispatch_604_elementwise_32x128x32_f32,,1,,activation,activation,,0,0,0,,,,,,0,0,0,0,0,0,,,,,
tinyllama,TinyLlama,985,main_graph$async_dispatch_605_elementwise_4x128x32_f32,,1,,activation,activation,,0,0,0,,,,,,0,0,0,0,0,0,,,,,
tinyllama,TinyLlama,986,main_graph$async_dispatch_606_elementwise_broadcast_4x8x128x64_i32xi8,,1,,requantize_i32_to_i8,requantize_i32_to_i8,,0,0,0,,,,,,0,0,0,0,0,0,,,,,
tinyllama,TinyLlama,987,main_graph$async_dispatch_611_elementwise_32768_f32xi8,,1,,quantize_f32_to_i8,quantize_f32_to_i8,,0,0,0,,,,,,0,0,0,0,0,0,,,,,
tinyllama,TinyLlama,988,main_graph$async_dispatch_612_elementwise_transpose_32x128x64_f32xf32xf32xf32xi8,,1,,elementwise_multi_dtype,elementwise_multi_dtype,,0,0,0,,,,,,0,0,0,0,0,0,,,,,
tinyllama,TinyLlama,989,main_graph$async_dispatch_613_elementwise_262144_i8xf32xi8,,1,,elementwise_other,elementwise_other,,0,0,0,,,,,,0,0,0,0,0,0,,,,,
tinyllama,TinyLlama,990,main_graph$async_dispatch_614_elementwise_broadcast_4x8x128x64_f32xf32xi8xf32xf32xi8,,1,,elementwise_multi_dtype,elementwise_multi_dtype,,0,0,0,,,,,,0,0,0,0,0,0,,,,,
tinyllama,TinyLlama,991,main_graph$async_dispatch_615_batch_matmul_32x128x128x64_i8xi8xi32,,1,,encoding_32x32_tile,encoding_32x32_tile,,0,0,0,,,,,,4,0,0,0,0,0,,,,,
tinyllama,TinyLlama,992,main_graph$async_dispatch_617_batch_matmul_32x128x64x128_i8xi8xi32,,1,,encoding_32x32_tile,encoding_32x32_tile,,0,0,0,,,,,,4,0,0,0,0,0,,,,,
tinyllama,TinyLlama,993,main_graph$async_dispatch_618_batch_matmul_1x128x2048x2048_i8xi8xi32,,1,,encoding_32x32_tile,encoding_32x32_tile,,0,0,0,,,,,,4,0,0,0,0,0,,,,,
tinyllama,TinyLlama,994,main_graph$async_dispatch_619_elementwise_262144_i8xf32,,1,,dequantize_i8_to_f32,dequantize_i8_to_f32,,0,0,0,,,,,,0,0,0,0,0,0,,,,,
tinyllama,TinyLlama,995,main_graph$async_dispatch_620_reduction_128x2048_f32,,1,,rvv_reduction_softmax_norm,rvv_reduction_softmax_norm,,0,0,0,,,,,,0,0,0,0,0,0,,,,,
tinyllama,TinyLlama,996,main_graph$async_dispatch_621_elementwise_128_i8xf32xf32,,1,,elementwise_other,elementwise_other,,0,0,0,,,,,,0,0,0,0,0,0,,,,,
tinyllama,TinyLlama,997,main_graph$async_dispatch_622_elementwise_128x2048_f32xf32xi8,,1,,elementwise_other,elementwise_other,,0,0,0,,,,,,0,0,0,0,0,0,,,,,
tinyllama,TinyLlama,998,main_graph$async_dispatch_623_elementwise_128x2048_i8,,1,,activation,activation,,0,0,0,,,,,,0,0,0,0,0,0,,,,,
tinyllama,TinyLlama,999,main_graph$async_dispatch_624_batch_matmul_1x128x5632x2048_i8xi8xi32,,1,,encoding_32x32_tile,encoding_32x32_tile,,0,0,0,,,,,,4,0,0,0,0,0,,,,,
tinyllama,TinyLlama,1000,main_graph$async_dispatch_625_batch_matmul_1x128x5632x2048_i8xi8xi32,,1,,encoding_32x32_tile,encoding_32x32_tile,,0,0,0,,,,,,4,0,0,0,0,0,,,,,
tinyllama,TinyLlama,1001,main_graph$async_dispatch_626_batch_matmul_1x128x2048x5632_i8xi8xi32,,1,,encoding_32x32_tile,encoding_32x32_tile,,0,0,0,,,,,,4,0,0,0,0,0,,,,,
tinyllama,TinyLlama,1002,main_graph$async_dispatch_627_elementwise_262144_i8xf32,,1,,dequantize_i8_to_f32,dequantize_i8_to_f32,,0,0,0,,,,,,0,0,0,0,0,0,,,,,
tinyllama,TinyLlama,1003,main_graph$async_dispatch_628_reduction_128x2048_f32,,1,,rvv_reduction_softmax_norm,rvv_reduction_softmax_norm,,0,0,0,,,,,,0,0,0,0,0,0,,,,,
tinyllama,TinyLlama,1004,main_graph$async_dispatch_629_elementwise_128_i8xf32xf32,,1,,elementwise_other,elementwise_other,,0,0,0,,,,,,0,0,0,0,0,0,,,,,
tinyllama,TinyLlama,1005,main_graph$async_dispatch_630_elementwise_128x2048_f32xf32xi8,,1,,elementwise_other,elementwise_other,,0,0,0,,,,,,0,0,0,0,0,0,,,,,
tinyllama,TinyLlama,1006,main_graph$async_dispatch_631_elementwise_128x2048_i8,,1,,activation,activation,,0,0,0,,,,,,0,0,0,0,0,0,,,,,
tinyllama,TinyLlama,1007,main_graph$async_dispatch_635_elementwise_262144_i32xi8,,1,,requantize_i32_to_i8,requantize_i32_to_i8,,0,0,0,,,,,,0,0,0,0,0,0,,,,,
tinyllama,TinyLlama,1008,main_graph$async_dispatch_636_transpose_128x32x64_f32,,1,,elementwise_other,elementwise_other,,0,0,0,,,,,,0,0,0,0,0,0,,,,,
tinyllama,TinyLlama,1009,main_graph$async_dispatch_637_elementwise_32768_i32xi8,,1,,requantize_i32_to_i8,requantize_i32_to_i8,,0,0,0,,,,,,0,0,0,0,0,0,,,,,
tinyllama,TinyLlama,1010,main_graph$async_dispatch_638_transpose_128x4x64_f32,,1,,elementwise_other,elementwise_other,,0,0,0,,,,,,0,0,0,0,0,0,,,,,
tinyllama,TinyLlama,1011,main_graph$async_dispatch_639_elementwise_32x128x32_f32xi8,,1,,quantize_f32_to_i8,quantize_f32_to_i8,,0,0,0,,,,,,0,0,0,0,0,0,,,,,
tinyllama,TinyLlama,1012,main_graph$async_dispatch_640_elementwise_4x128x32_f32xi8,,1,,quantize_f32_to_i8,quantize_f32_to_i8,,0,0,0,,,,,,0,0,0,0,0,0,,,,,
tinyllama,TinyLlama,1013,main_graph$async_dispatch_641_elementwise_131072_i8xf32,,1,,dequantize_i8_to_f32,dequantize_i8_to_f32,,0,0,0,,,,,,0,0,0,0,0,0,,,,,
tinyllama,TinyLlama,1014,main_graph$async_dispatch_642_elementwise_16384_i8xf32,,1,,dequantize_i8_to_f32,dequantize_i8_to_f32,,0,0,0,,,,,,0,0,0,0,0,0,,,,,
tinyllama,TinyLlama,1015,main_graph$async_dispatch_643_elementwise_32x128x32_f32,,1,,activation,activation,,0,0,0,,,,,,0,0,0,0,0,0,,,,,
tinyllama,TinyLlama,1016,main_graph$async_dispatch_644_elementwise_4x128x32_f32,,1,,activation,activation,,0,0,0,,,,,,0,0,0,0,0,0,,,,,
tinyllama,TinyLlama,1017,main_graph$async_dispatch_645_elementwise_broadcast_4x8x128x64_i32xi8,,1,,requantize_i32_to_i8,requantize_i32_to_i8,,0,0,0,,,,,,0,0,0,0,0,0,,,,,
tinyllama,TinyLlama,1018,main_graph$async_dispatch_650_elementwise_32768_f32xi8,,1,,quantize_f32_to_i8,quantize_f32_to_i8,,0,0,0,,,,,,0,0,0,0,0,0,,,,,
tinyllama,TinyLlama,1019,main_graph$async_dispatch_651_elementwise_transpose_32x128x64_f32xf32xf32xf32xi8,,1,,elementwise_multi_dtype,elementwise_multi_dtype,,0,0,0,,,,,,0,0,0,0,0,0,,,,,
tinyllama,TinyLlama,1020,main_graph$async_dispatch_652_elementwise_262144_i8xf32xi8,,1,,elementwise_other,elementwise_other,,0,0,0,,,,,,0,0,0,0,0,0,,,,,
tinyllama,TinyLlama,1021,main_graph$async_dispatch_653_elementwise_broadcast_4x8x128x64_f32xf32xi8xf32xf32xi8,,1,,elementwise_multi_dtype,elementwise_multi_dtype,,0,0,0,,,,,,0,0,0,0,0,0,,,,,
tinyllama,TinyLlama,1022,main_graph$async_dispatch_654_batch_matmul_32x128x128x64_i8xi8xi32,,1,,encoding_32x32_tile,encoding_32x32_tile,,0,0,0,,,,,,4,0,0,0,0,0,,,,,
tinyllama,TinyLlama,1023,main_graph$async_dispatch_656_batch_matmul_32x128x64x128_i8xi8xi32,,1,,encoding_32x32_tile,encoding_32x32_tile,,0,0,0,,,,,,4,0,0,0,0,0,,,,,
tinyllama,TinyLlama,1024,main_graph$async_dispatch_657_batch_matmul_1x128x2048x2048_i8xi8xi32,,1,,encoding_32x32_tile,encoding_32x32_tile,,0,0,0,,,,,,4,0,0,0,0,0,,,,,
tinyllama,TinyLlama,1025,main_graph$async_dispatch_658_elementwise_262144_i8xf32,,1,,dequantize_i8_to_f32,dequantize_i8_to_f32,,0,0,0,,,,,,0,0,0,0,0,0,,,,,
tinyllama,TinyLlama,1026,main_graph$async_dispatch_659_reduction_128x2048_f32,,1,,rvv_reduction_softmax_norm,rvv_reduction_softmax_norm,,0,0,0,,,,,,0,0,0,0,0,0,,,,,
tinyllama,TinyLlama,1027,main_graph$async_dispatch_660_elementwise_128_i8xf32xf32,,1,,elementwise_other,elementwise_other,,0,0,0,,,,,,0,0,0,0,0,0,,,,,
tinyllama,TinyLlama,1028,main_graph$async_dispatch_661_elementwise_128x2048_f32xf32xi8,,1,,elementwise_other,elementwise_other,,0,0,0,,,,,,0,0,0,0,0,0,,,,,
tinyllama,TinyLlama,1029,main_graph$async_dispatch_662_elementwise_128x2048_i8,,1,,activation,activation,,0,0,0,,,,,,0,0,0,0,0,0,,,,,
tinyllama,TinyLlama,1030,main_graph$async_dispatch_663_batch_matmul_1x128x5632x2048_i8xi8xi32,,1,,encoding_32x32_tile,encoding_32x32_tile,,0,0,0,,,,,,4,0,0,0,0,0,,,,,
tinyllama,TinyLlama,1031,main_graph$async_dispatch_664_batch_matmul_1x128x5632x2048_i8xi8xi32,,1,,encoding_32x32_tile,encoding_32x32_tile,,0,0,0,,,,,,4,0,0,0,0,0,,,,,
tinyllama,TinyLlama,1032,main_graph$async_dispatch_665_batch_matmul_1x128x2048x5632_i8xi8xi32,,1,,encoding_32x32_tile,encoding_32x32_tile,,0,0,0,,,,,,4,0,0,0,0,0,,,,,
tinyllama,TinyLlama,1033,main_graph$async_dispatch_666_elementwise_262144_i8xf32,,1,,dequantize_i8_to_f32,dequantize_i8_to_f32,,0,0,0,,,,,,0,0,0,0,0,0,,,,,
tinyllama,TinyLlama,1034,main_graph$async_dispatch_667_reduction_128x2048_f32,,1,,rvv_reduction_softmax_norm,rvv_reduction_softmax_norm,,0,0,0,,,,,,0,0,0,0,0,0,,,,,
tinyllama,TinyLlama,1035,main_graph$async_dispatch_668_elementwise_128_i8xf32xf32,,1,,elementwise_other,elementwise_other,,0,0,0,,,,,,0,0,0,0,0,0,,,,,
tinyllama,TinyLlama,1036,main_graph$async_dispatch_669_elementwise_128x2048_f32xf32xi8,,1,,elementwise_other,elementwise_other,,0,0,0,,,,,,0,0,0,0,0,0,,,,,
tinyllama,TinyLlama,1037,main_graph$async_dispatch_670_elementwise_128x2048_i8,,1,,activation,activation,,0,0,0,,,,,,0,0,0,0,0,0,,,,,
tinyllama,TinyLlama,1038,main_graph$async_dispatch_674_elementwise_262144_i32xi8,,1,,requantize_i32_to_i8,requantize_i32_to_i8,,0,0,0,,,,,,0,0,0,0,0,0,,,,,
tinyllama,TinyLlama,1039,main_graph$async_dispatch_675_transpose_128x32x64_f32,,1,,elementwise_other,elementwise_other,,0,0,0,,,,,,0,0,0,0,0,0,,,,,
tinyllama,TinyLlama,1040,main_graph$async_dispatch_676_elementwise_32768_i32xi8,,1,,requantize_i32_to_i8,requantize_i32_to_i8,,0,0,0,,,,,,0,0,0,0,0,0,,,,,
tinyllama,TinyLlama,1041,main_graph$async_dispatch_677_transpose_128x4x64_f32,,1,,elementwise_other,elementwise_other,,0,0,0,,,,,,0,0,0,0,0,0,,,,,
tinyllama,TinyLlama,1042,main_graph$async_dispatch_678_elementwise_32x128x32_f32xi8,,1,,quantize_f32_to_i8,quantize_f32_to_i8,,0,0,0,,,,,,0,0,0,0,0,0,,,,,
tinyllama,TinyLlama,1043,main_graph$async_dispatch_679_elementwise_4x128x32_f32xi8,,1,,quantize_f32_to_i8,quantize_f32_to_i8,,0,0,0,,,,,,0,0,0,0,0,0,,,,,
tinyllama,TinyLlama,1044,main_graph$async_dispatch_680_elementwise_131072_i8xf32,,1,,dequantize_i8_to_f32,dequantize_i8_to_f32,,0,0,0,,,,,,0,0,0,0,0,0,,,,,
tinyllama,TinyLlama,1045,main_graph$async_dispatch_681_elementwise_16384_i8xf32,,1,,dequantize_i8_to_f32,dequantize_i8_to_f32,,0,0,0,,,,,,0,0,0,0,0,0,,,,,
tinyllama,TinyLlama,1046,main_graph$async_dispatch_682_elementwise_32x128x32_f32,,1,,activation,activation,,0,0,0,,,,,,0,0,0,0,0,0,,,,,
tinyllama,TinyLlama,1047,main_graph$async_dispatch_683_elementwise_4x128x32_f32,,1,,activation,activation,,0,0,0,,,,,,0,0,0,0,0,0,,,,,
tinyllama,TinyLlama,1048,main_graph$async_dispatch_684_elementwise_broadcast_4x8x128x64_i32xi8,,1,,requantize_i32_to_i8,requantize_i32_to_i8,,0,0,0,,,,,,0,0,0,0,0,0,,,,,
tinyllama,TinyLlama,1049,main_graph$async_dispatch_689_elementwise_32768_f32xi8,,1,,quantize_f32_to_i8,quantize_f32_to_i8,,0,0,0,,,,,,0,0,0,0,0,0,,,,,
tinyllama,TinyLlama,1050,main_graph$async_dispatch_690_elementwise_transpose_32x128x64_f32xf32xf32xf32xi8,,1,,elementwise_multi_dtype,elementwise_multi_dtype,,0,0,0,,,,,,0,0,0,0,0,0,,,,,
tinyllama,TinyLlama,1051,main_graph$async_dispatch_691_elementwise_262144_i8xf32xi8,,1,,elementwise_other,elementwise_other,,0,0,0,,,,,,0,0,0,0,0,0,,,,,
tinyllama,TinyLlama,1052,main_graph$async_dispatch_692_elementwise_broadcast_4x8x128x64_f32xf32xi8xf32xf32xi8,,1,,elementwise_multi_dtype,elementwise_multi_dtype,,0,0,0,,,,,,0,0,0,0,0,0,,,,,
tinyllama,TinyLlama,1053,main_graph$async_dispatch_693_batch_matmul_32x128x128x64_i8xi8xi32,,1,,encoding_32x32_tile,encoding_32x32_tile,,0,0,0,,,,,,4,0,0,0,0,0,,,,,
tinyllama,TinyLlama,1054,main_graph$async_dispatch_695_batch_matmul_32x128x64x128_i8xi8xi32,,1,,encoding_32x32_tile,encoding_32x32_tile,,0,0,0,,,,,,4,0,0,0,0,0,,,,,
tinyllama,TinyLlama,1055,main_graph$async_dispatch_696_batch_matmul_1x128x2048x2048_i8xi8xi32,,1,,encoding_32x32_tile,encoding_32x32_tile,,0,0,0,,,,,,4,0,0,0,0,0,,,,,
tinyllama,TinyLlama,1056,main_graph$async_dispatch_697_elementwise_262144_i8xf32,,1,,dequantize_i8_to_f32,dequantize_i8_to_f32,,0,0,0,,,,,,0,0,0,0,0,0,,,,,
tinyllama,TinyLlama,1057,main_graph$async_dispatch_698_reduction_128x2048_f32,,1,,rvv_reduction_softmax_norm,rvv_reduction_softmax_norm,,0,0,0,,,,,,0,0,0,0,0,0,,,,,
tinyllama,TinyLlama,1058,main_graph$async_dispatch_699_elementwise_128_i8xf32xf32,,1,,elementwise_other,elementwise_other,,0,0,0,,,,,,0,0,0,0,0,0,,,,,
tinyllama,TinyLlama,1059,main_graph$async_dispatch_700_elementwise_128x2048_f32xf32xi8,,1,,elementwise_other,elementwise_other,,0,0,0,,,,,,0,0,0,0,0,0,,,,,
tinyllama,TinyLlama,1060,main_graph$async_dispatch_701_elementwise_128x2048_i8,,1,,activation,activation,,0,0,0,,,,,,0,0,0,0,0,0,,,,,
tinyllama,TinyLlama,1061,main_graph$async_dispatch_702_batch_matmul_1x128x5632x2048_i8xi8xi32,,1,,encoding_32x32_tile,encoding_32x32_tile,,0,0,0,,,,,,4,0,0,0,0,0,,,,,
tinyllama,TinyLlama,1062,main_graph$async_dispatch_703_batch_matmul_1x128x5632x2048_i8xi8xi32,,1,,encoding_32x32_tile,encoding_32x32_tile,,0,0,0,,,,,,4,0,0,0,0,0,,,,,
tinyllama,TinyLlama,1063,main_graph$async_dispatch_704_batch_matmul_1x128x2048x5632_i8xi8xi32,,1,,encoding_32x32_tile,encoding_32x32_tile,,0,0,0,,,,,,4,0,0,0,0,0,,,,,
tinyllama,TinyLlama,1064,main_graph$async_dispatch_705_elementwise_262144_i8xf32,,1,,dequantize_i8_to_f32,dequantize_i8_to_f32,,0,0,0,,,,,,0,0,0,0,0,0,,,,,
tinyllama,TinyLlama,1065,main_graph$async_dispatch_706_reduction_128x2048_f32,,1,,rvv_reduction_softmax_norm,rvv_reduction_softmax_norm,,0,0,0,,,,,,0,0,0,0,0,0,,,,,
tinyllama,TinyLlama,1066,main_graph$async_dispatch_707_elementwise_128_i8xf32xf32,,1,,elementwise_other,elementwise_other,,0,0,0,,,,,,0,0,0,0,0,0,,,,,
tinyllama,TinyLlama,1067,main_graph$async_dispatch_708_elementwise_128x2048_f32xf32xi8,,1,,elementwise_other,elementwise_other,,0,0,0,,,,,,0,0,0,0,0,0,,,,,
tinyllama,TinyLlama,1068,main_graph$async_dispatch_709_elementwise_128x2048_i8,,1,,activation,activation,,0,0,0,,,,,,0,0,0,0,0,0,,,,,
tinyllama,TinyLlama,1069,main_graph$async_dispatch_713_elementwise_262144_i32xi8,,1,,requantize_i32_to_i8,requantize_i32_to_i8,,0,0,0,,,,,,0,0,0,0,0,0,,,,,
tinyllama,TinyLlama,1070,main_graph$async_dispatch_714_transpose_128x32x64_f32,,1,,elementwise_other,elementwise_other,,0,0,0,,,,,,0,0,0,0,0,0,,,,,
tinyllama,TinyLlama,1071,main_graph$async_dispatch_715_elementwise_32768_i32xi8,,1,,requantize_i32_to_i8,requantize_i32_to_i8,,0,0,0,,,,,,0,0,0,0,0,0,,,,,
tinyllama,TinyLlama,1072,main_graph$async_dispatch_716_transpose_128x4x64_f32,,1,,elementwise_other,elementwise_other,,0,0,0,,,,,,0,0,0,0,0,0,,,,,
tinyllama,TinyLlama,1073,main_graph$async_dispatch_717_elementwise_32x128x32_f32xi8,,1,,quantize_f32_to_i8,quantize_f32_to_i8,,0,0,0,,,,,,0,0,0,0,0,0,,,,,
tinyllama,TinyLlama,1074,main_graph$async_dispatch_718_elementwise_4x128x32_f32xi8,,1,,quantize_f32_to_i8,quantize_f32_to_i8,,0,0,0,,,,,,0,0,0,0,0,0,,,,,
tinyllama,TinyLlama,1075,main_graph$async_dispatch_719_elementwise_131072_i8xf32,,1,,dequantize_i8_to_f32,dequantize_i8_to_f32,,0,0,0,,,,,,0,0,0,0,0,0,,,,,
tinyllama,TinyLlama,1076,main_graph$async_dispatch_720_elementwise_16384_i8xf32,,1,,dequantize_i8_to_f32,dequantize_i8_to_f32,,0,0,0,,,,,,0,0,0,0,0,0,,,,,
tinyllama,TinyLlama,1077,main_graph$async_dispatch_721_elementwise_32x128x32_f32,,1,,activation,activation,,0,0,0,,,,,,0,0,0,0,0,0,,,,,
tinyllama,TinyLlama,1078,main_graph$async_dispatch_722_elementwise_4x128x32_f32,,1,,activation,activation,,0,0,0,,,,,,0,0,0,0,0,0,,,,,
tinyllama,TinyLlama,1079,main_graph$async_dispatch_723_elementwise_broadcast_4x8x128x64_i32xi8,,1,,requantize_i32_to_i8,requantize_i32_to_i8,,0,0,0,,,,,,0,0,0,0,0,0,,,,,
tinyllama,TinyLlama,1080,main_graph$async_dispatch_728_elementwise_32768_f32xi8,,1,,quantize_f32_to_i8,quantize_f32_to_i8,,0,0,0,,,,,,0,0,0,0,0,0,,,,,
tinyllama,TinyLlama,1081,main_graph$async_dispatch_729_elementwise_transpose_32x128x64_f32xf32xf32xf32xi8,,1,,elementwise_multi_dtype,elementwise_multi_dtype,,0,0,0,,,,,,0,0,0,0,0,0,,,,,
tinyllama,TinyLlama,1082,main_graph$async_dispatch_730_elementwise_262144_i8xf32xi8,,1,,elementwise_other,elementwise_other,,0,0,0,,,,,,0,0,0,0,0,0,,,,,
tinyllama,TinyLlama,1083,main_graph$async_dispatch_731_elementwise_broadcast_4x8x128x64_f32xf32xi8xf32xf32xi8,,1,,elementwise_multi_dtype,elementwise_multi_dtype,,0,0,0,,,,,,0,0,0,0,0,0,,,,,
tinyllama,TinyLlama,1084,main_graph$async_dispatch_732_batch_matmul_32x128x128x64_i8xi8xi32,,1,,encoding_32x32_tile,encoding_32x32_tile,,0,0,0,,,,,,4,0,0,0,0,0,,,,,
tinyllama,TinyLlama,1085,main_graph$async_dispatch_734_batch_matmul_32x128x64x128_i8xi8xi32,,1,,encoding_32x32_tile,encoding_32x32_tile,,0,0,0,,,,,,4,0,0,0,0,0,,,,,
tinyllama,TinyLlama,1086,main_graph$async_dispatch_735_batch_matmul_1x128x2048x2048_i8xi8xi32,,1,,encoding_32x32_tile,encoding_32x32_tile,,0,0,0,,,,,,4,0,0,0,0,0,,,,,
tinyllama,TinyLlama,1087,main_graph$async_dispatch_736_elementwise_262144_i8xf32,,1,,dequantize_i8_to_f32,dequantize_i8_to_f32,,0,0,0,,,,,,0,0,0,0,0,0,,,,,
tinyllama,TinyLlama,1088,main_graph$async_dispatch_737_reduction_128x2048_f32,,1,,rvv_reduction_softmax_norm,rvv_reduction_softmax_norm,,0,0,0,,,,,,0,0,0,0,0,0,,,,,
tinyllama,TinyLlama,1089,main_graph$async_dispatch_738_elementwise_128_i8xf32xf32,,1,,elementwise_other,elementwise_other,,0,0,0,,,,,,0,0,0,0,0,0,,,,,
tinyllama,TinyLlama,1090,main_graph$async_dispatch_739_elementwise_128x2048_f32xf32xi8,,1,,elementwise_other,elementwise_other,,0,0,0,,,,,,0,0,0,0,0,0,,,,,
tinyllama,TinyLlama,1091,main_graph$async_dispatch_740_elementwise_128x2048_i8,,1,,activation,activation,,0,0,0,,,,,,0,0,0,0,0,0,,,,,
tinyllama,TinyLlama,1092,main_graph$async_dispatch_741_batch_matmul_1x128x5632x2048_i8xi8xi32,,1,,encoding_32x32_tile,encoding_32x32_tile,,0,0,0,,,,,,4,0,0,0,0,0,,,,,
tinyllama,TinyLlama,1093,main_graph$async_dispatch_742_batch_matmul_1x128x5632x2048_i8xi8xi32,,1,,encoding_32x32_tile,encoding_32x32_tile,,0,0,0,,,,,,4,0,0,0,0,0,,,,,
tinyllama,TinyLlama,1094,main_graph$async_dispatch_743_batch_matmul_1x128x2048x5632_i8xi8xi32,,1,,encoding_32x32_tile,encoding_32x32_tile,,0,0,0,,,,,,4,0,0,0,0,0,,,,,
tinyllama,TinyLlama,1095,main_graph$async_dispatch_744_elementwise_262144_i8xf32,,1,,dequantize_i8_to_f32,dequantize_i8_to_f32,,0,0,0,,,,,,0,0,0,0,0,0,,,,,
tinyllama,TinyLlama,1096,main_graph$async_dispatch_745_reduction_128x2048_f32,,1,,rvv_reduction_softmax_norm,rvv_reduction_softmax_norm,,0,0,0,,,,,,0,0,0,0,0,0,,,,,
tinyllama,TinyLlama,1097,main_graph$async_dispatch_746_elementwise_128_i8xf32xf32,,1,,elementwise_other,elementwise_other,,0,0,0,,,,,,0,0,0,0,0,0,,,,,
tinyllama,TinyLlama,1098,main_graph$async_dispatch_747_elementwise_128x2048_f32xf32xi8,,1,,elementwise_other,elementwise_other,,0,0,0,,,,,,0,0,0,0,0,0,,,,,
tinyllama,TinyLlama,1099,main_graph$async_dispatch_748_elementwise_128x2048_i8,,1,,activation,activation,,0,0,0,,,,,,0,0,0,0,0,0,,,,,
tinyllama,TinyLlama,1100,main_graph$async_dispatch_752_elementwise_262144_i32xi8,,1,,requantize_i32_to_i8,requantize_i32_to_i8,,0,0,0,,,,,,0,0,0,0,0,0,,,,,
tinyllama,TinyLlama,1101,main_graph$async_dispatch_753_transpose_128x32x64_f32,,1,,elementwise_other,elementwise_other,,0,0,0,,,,,,0,0,0,0,0,0,,,,,
tinyllama,TinyLlama,1102,main_graph$async_dispatch_754_elementwise_32768_i32xi8,,1,,requantize_i32_to_i8,requantize_i32_to_i8,,0,0,0,,,,,,0,0,0,0,0,0,,,,,
tinyllama,TinyLlama,1103,main_graph$async_dispatch_755_transpose_128x4x64_f32,,1,,elementwise_other,elementwise_other,,0,0,0,,,,,,0,0,0,0,0,0,,,,,
tinyllama,TinyLlama,1104,main_graph$async_dispatch_756_elementwise_32x128x32_f32xi8,,1,,quantize_f32_to_i8,quantize_f32_to_i8,,0,0,0,,,,,,0,0,0,0,0,0,,,,,
tinyllama,TinyLlama,1105,main_graph$async_dispatch_757_elementwise_4x128x32_f32xi8,,1,,quantize_f32_to_i8,quantize_f32_to_i8,,0,0,0,,,,,,0,0,0,0,0,0,,,,,
tinyllama,TinyLlama,1106,main_graph$async_dispatch_758_elementwise_131072_i8xf32,,1,,dequantize_i8_to_f32,dequantize_i8_to_f32,,0,0,0,,,,,,0,0,0,0,0,0,,,,,
tinyllama,TinyLlama,1107,main_graph$async_dispatch_759_elementwise_16384_i8xf32,,1,,dequantize_i8_to_f32,dequantize_i8_to_f32,,0,0,0,,,,,,0,0,0,0,0,0,,,,,
tinyllama,TinyLlama,1108,main_graph$async_dispatch_760_elementwise_32x128x32_f32,,1,,activation,activation,,0,0,0,,,,,,0,0,0,0,0,0,,,,,
tinyllama,TinyLlama,1109,main_graph$async_dispatch_761_elementwise_4x128x32_f32,,1,,activation,activation,,0,0,0,,,,,,0,0,0,0,0,0,,,,,
tinyllama,TinyLlama,1110,main_graph$async_dispatch_762_elementwise_broadcast_4x8x128x64_i32xi8,,1,,requantize_i32_to_i8,requantize_i32_to_i8,,0,0,0,,,,,,0,0,0,0,0,0,,,,,
tinyllama,TinyLlama,1111,main_graph$async_dispatch_767_elementwise_32768_f32xi8,,1,,quantize_f32_to_i8,quantize_f32_to_i8,,0,0,0,,,,,,0,0,0,0,0,0,,,,,
tinyllama,TinyLlama,1112,main_graph$async_dispatch_768_elementwise_transpose_32x128x64_f32xf32xf32xf32xi8,,1,,elementwise_multi_dtype,elementwise_multi_dtype,,0,0,0,,,,,,0,0,0,0,0,0,,,,,
tinyllama,TinyLlama,1113,main_graph$async_dispatch_769_elementwise_262144_i8xf32xi8,,1,,elementwise_other,elementwise_other,,0,0,0,,,,,,0,0,0,0,0,0,,,,,
tinyllama,TinyLlama,1114,main_graph$async_dispatch_770_elementwise_broadcast_4x8x128x64_f32xf32xi8xf32xf32xi8,,1,,elementwise_multi_dtype,elementwise_multi_dtype,,0,0,0,,,,,,0,0,0,0,0,0,,,,,
tinyllama,TinyLlama,1115,main_graph$async_dispatch_771_batch_matmul_32x128x128x64_i8xi8xi32,,1,,encoding_32x32_tile,encoding_32x32_tile,,0,0,0,,,,,,4,0,0,0,0,0,,,,,
tinyllama,TinyLlama,1116,main_graph$async_dispatch_773_batch_matmul_32x128x64x128_i8xi8xi32,,1,,encoding_32x32_tile,encoding_32x32_tile,,0,0,0,,,,,,4,0,0,0,0,0,,,,,
tinyllama,TinyLlama,1117,main_graph$async_dispatch_774_batch_matmul_1x128x2048x2048_i8xi8xi32,,1,,encoding_32x32_tile,encoding_32x32_tile,,0,0,0,,,,,,4,0,0,0,0,0,,,,,
tinyllama,TinyLlama,1118,main_graph$async_dispatch_775_elementwise_262144_i8xf32,,1,,dequantize_i8_to_f32,dequantize_i8_to_f32,,0,0,0,,,,,,0,0,0,0,0,0,,,,,
tinyllama,TinyLlama,1119,main_graph$async_dispatch_776_reduction_128x2048_f32,,1,,rvv_reduction_softmax_norm,rvv_reduction_softmax_norm,,0,0,0,,,,,,0,0,0,0,0,0,,,,,
tinyllama,TinyLlama,1120,main_graph$async_dispatch_777_elementwise_128_i8xf32xf32,,1,,elementwise_other,elementwise_other,,0,0,0,,,,,,0,0,0,0,0,0,,,,,
tinyllama,TinyLlama,1121,main_graph$async_dispatch_778_elementwise_128x2048_f32xf32xi8,,1,,elementwise_other,elementwise_other,,0,0,0,,,,,,0,0,0,0,0,0,,,,,
tinyllama,TinyLlama,1122,main_graph$async_dispatch_779_elementwise_128x2048_i8,,1,,activation,activation,,0,0,0,,,,,,0,0,0,0,0,0,,,,,
tinyllama,TinyLlama,1123,main_graph$async_dispatch_780_batch_matmul_1x128x5632x2048_i8xi8xi32,,1,,encoding_32x32_tile,encoding_32x32_tile,,0,0,0,,,,,,4,0,0,0,0,0,,,,,
tinyllama,TinyLlama,1124,main_graph$async_dispatch_781_batch_matmul_1x128x5632x2048_i8xi8xi32,,1,,encoding_32x32_tile,encoding_32x32_tile,,0,0,0,,,,,,4,0,0,0,0,0,,,,,
tinyllama,TinyLlama,1125,main_graph$async_dispatch_782_batch_matmul_1x128x2048x5632_i8xi8xi32,,1,,encoding_32x32_tile,encoding_32x32_tile,,0,0,0,,,,,,4,0,0,0,0,0,,,,,
tinyllama,TinyLlama,1126,main_graph$async_dispatch_783_elementwise_262144_i8xf32,,1,,dequantize_i8_to_f32,dequantize_i8_to_f32,,0,0,0,,,,,,0,0,0,0,0,0,,,,,
tinyllama,TinyLlama,1127,main_graph$async_dispatch_784_reduction_128x2048_f32,,1,,rvv_reduction_softmax_norm,rvv_reduction_softmax_norm,,0,0,0,,,,,,0,0,0,0,0,0,,,,,
tinyllama,TinyLlama,1128,main_graph$async_dispatch_785_elementwise_128_i8xf32xf32,,1,,elementwise_other,elementwise_other,,0,0,0,,,,,,0,0,0,0,0,0,,,,,
tinyllama,TinyLlama,1129,main_graph$async_dispatch_786_elementwise_128x2048_f32xf32xi8,,1,,elementwise_other,elementwise_other,,0,0,0,,,,,,0,0,0,0,0,0,,,,,
tinyllama,TinyLlama,1130,main_graph$async_dispatch_787_elementwise_128x2048_i8,,1,,activation,activation,,0,0,0,,,,,,0,0,0,0,0,0,,,,,
tinyllama,TinyLlama,1131,main_graph$async_dispatch_791_elementwise_262144_i32xi8,,1,,requantize_i32_to_i8,requantize_i32_to_i8,,0,0,0,,,,,,0,0,0,0,0,0,,,,,
tinyllama,TinyLlama,1132,main_graph$async_dispatch_792_transpose_128x32x64_f32,,1,,elementwise_other,elementwise_other,,0,0,0,,,,,,0,0,0,0,0,0,,,,,
tinyllama,TinyLlama,1133,main_graph$async_dispatch_793_elementwise_32768_i32xi8,,1,,requantize_i32_to_i8,requantize_i32_to_i8,,0,0,0,,,,,,0,0,0,0,0,0,,,,,
tinyllama,TinyLlama,1134,main_graph$async_dispatch_794_transpose_128x4x64_f32,,1,,elementwise_other,elementwise_other,,0,0,0,,,,,,0,0,0,0,0,0,,,,,
tinyllama,TinyLlama,1135,main_graph$async_dispatch_795_elementwise_32x128x32_f32xi8,,1,,quantize_f32_to_i8,quantize_f32_to_i8,,0,0,0,,,,,,0,0,0,0,0,0,,,,,
tinyllama,TinyLlama,1136,main_graph$async_dispatch_796_elementwise_4x128x32_f32xi8,,1,,quantize_f32_to_i8,quantize_f32_to_i8,,0,0,0,,,,,,0,0,0,0,0,0,,,,,
tinyllama,TinyLlama,1137,main_graph$async_dispatch_797_elementwise_131072_i8xf32,,1,,dequantize_i8_to_f32,dequantize_i8_to_f32,,0,0,0,,,,,,0,0,0,0,0,0,,,,,
tinyllama,TinyLlama,1138,main_graph$async_dispatch_798_elementwise_16384_i8xf32,,1,,dequantize_i8_to_f32,dequantize_i8_to_f32,,0,0,0,,,,,,0,0,0,0,0,0,,,,,
tinyllama,TinyLlama,1139,main_graph$async_dispatch_799_elementwise_32x128x32_f32,,1,,activation,activation,,0,0,0,,,,,,0,0,0,0,0,0,,,,,
tinyllama,TinyLlama,1140,main_graph$async_dispatch_800_elementwise_4x128x32_f32,,1,,activation,activation,,0,0,0,,,,,,0,0,0,0,0,0,,,,,
tinyllama,TinyLlama,1141,main_graph$async_dispatch_801_elementwise_broadcast_4x8x128x64_i32xi8,,1,,requantize_i32_to_i8,requantize_i32_to_i8,,0,0,0,,,,,,0,0,0,0,0,0,,,,,
tinyllama,TinyLlama,1142,main_graph$async_dispatch_806_elementwise_32768_f32xi8,,1,,quantize_f32_to_i8,quantize_f32_to_i8,,0,0,0,,,,,,0,0,0,0,0,0,,,,,
tinyllama,TinyLlama,1143,main_graph$async_dispatch_807_elementwise_transpose_32x128x64_f32xf32xf32xf32xi8,,1,,elementwise_multi_dtype,elementwise_multi_dtype,,0,0,0,,,,,,0,0,0,0,0,0,,,,,
tinyllama,TinyLlama,1144,main_graph$async_dispatch_808_elementwise_262144_i8xf32xi8,,1,,elementwise_other,elementwise_other,,0,0,0,,,,,,0,0,0,0,0,0,,,,,
tinyllama,TinyLlama,1145,main_graph$async_dispatch_809_elementwise_broadcast_4x8x128x64_f32xf32xi8xf32xf32xi8,,1,,elementwise_multi_dtype,elementwise_multi_dtype,,0,0,0,,,,,,0,0,0,0,0,0,,,,,
tinyllama,TinyLlama,1146,main_graph$async_dispatch_810_batch_matmul_32x128x128x64_i8xi8xi32,,1,,encoding_32x32_tile,encoding_32x32_tile,,0,0,0,,,,,,4,0,0,0,0,0,,,,,
tinyllama,TinyLlama,1147,main_graph$async_dispatch_812_batch_matmul_32x128x64x128_i8xi8xi32,,1,,encoding_32x32_tile,encoding_32x32_tile,,0,0,0,,,,,,4,0,0,0,0,0,,,,,
tinyllama,TinyLlama,1148,main_graph$async_dispatch_813_batch_matmul_1x128x2048x2048_i8xi8xi32,,1,,encoding_32x32_tile,encoding_32x32_tile,,0,0,0,,,,,,4,0,0,0,0,0,,,,,
tinyllama,TinyLlama,1149,main_graph$async_dispatch_814_elementwise_262144_i8xf32,,1,,dequantize_i8_to_f32,dequantize_i8_to_f32,,0,0,0,,,,,,0,0,0,0,0,0,,,,,
tinyllama,TinyLlama,1150,main_graph$async_dispatch_815_reduction_128x2048_f32,,1,,rvv_reduction_softmax_norm,rvv_reduction_softmax_norm,,0,0,0,,,,,,0,0,0,0,0,0,,,,,
tinyllama,TinyLlama,1151,main_graph$async_dispatch_816_elementwise_128_i8xf32xf32,,1,,elementwise_other,elementwise_other,,0,0,0,,,,,,0,0,0,0,0,0,,,,,
tinyllama,TinyLlama,1152,main_graph$async_dispatch_817_elementwise_128x2048_f32xf32xi8,,1,,elementwise_other,elementwise_other,,0,0,0,,,,,,0,0,0,0,0,0,,,,,
tinyllama,TinyLlama,1153,main_graph$async_dispatch_818_elementwise_128x2048_i8,,1,,activation,activation,,0,0,0,,,,,,0,0,0,0,0,0,,,,,
tinyllama,TinyLlama,1154,main_graph$async_dispatch_819_batch_matmul_1x128x5632x2048_i8xi8xi32,,1,,encoding_32x32_tile,encoding_32x32_tile,,0,0,0,,,,,,4,0,0,0,0,0,,,,,
tinyllama,TinyLlama,1155,main_graph$async_dispatch_820_batch_matmul_1x128x5632x2048_i8xi8xi32,,1,,encoding_32x32_tile,encoding_32x32_tile,,0,0,0,,,,,,4,0,0,0,0,0,,,,,
tinyllama,TinyLlama,1156,main_graph$async_dispatch_821_batch_matmul_1x128x2048x5632_i8xi8xi32,,1,,encoding_32x32_tile,encoding_32x32_tile,,0,0,0,,,,,,4,0,0,0,0,0,,,,,
tinyllama,TinyLlama,1157,main_graph$async_dispatch_822_elementwise_262144_i8xf32,,1,,dequantize_i8_to_f32,dequantize_i8_to_f32,,0,0,0,,,,,,0,0,0,0,0,0,,,,,
tinyllama,TinyLlama,1158,main_graph$async_dispatch_823_reduction_128x2048_f32,,1,,rvv_reduction_softmax_norm,rvv_reduction_softmax_norm,,0,0,0,,,,,,0,0,0,0,0,0,,,,,
tinyllama,TinyLlama,1159,main_graph$async_dispatch_824_elementwise_128_i8xf32xf32,,1,,elementwise_other,elementwise_other,,0,0,0,,,,,,0,0,0,0,0,0,,,,,
tinyllama,TinyLlama,1160,main_graph$async_dispatch_825_elementwise_128x2048_f32xf32xi8,,1,,elementwise_other,elementwise_other,,0,0,0,,,,,,0,0,0,0,0,0,,,,,
tinyllama,TinyLlama,1161,main_graph$async_dispatch_826_elementwise_128x2048_i8,,1,,activation,activation,,0,0,0,,,,,,0,0,0,0,0,0,,,,,
tinyllama,TinyLlama,1162,main_graph$async_dispatch_830_elementwise_262144_i32xi8,,1,,requantize_i32_to_i8,requantize_i32_to_i8,,0,0,0,,,,,,0,0,0,0,0,0,,,,,
tinyllama,TinyLlama,1163,main_graph$async_dispatch_831_transpose_128x32x64_f32,,1,,elementwise_other,elementwise_other,,0,0,0,,,,,,0,0,0,0,0,0,,,,,
tinyllama,TinyLlama,1164,main_graph$async_dispatch_832_elementwise_32768_i32xi8,,1,,requantize_i32_to_i8,requantize_i32_to_i8,,0,0,0,,,,,,0,0,0,0,0,0,,,,,
tinyllama,TinyLlama,1165,main_graph$async_dispatch_833_transpose_128x4x64_f32,,1,,elementwise_other,elementwise_other,,0,0,0,,,,,,0,0,0,0,0,0,,,,,
tinyllama,TinyLlama,1166,main_graph$async_dispatch_834_elementwise_32x128x32_f32xi8,,1,,quantize_f32_to_i8,quantize_f32_to_i8,,0,0,0,,,,,,0,0,0,0,0,0,,,,,
tinyllama,TinyLlama,1167,main_graph$async_dispatch_835_elementwise_4x128x32_f32xi8,,1,,quantize_f32_to_i8,quantize_f32_to_i8,,0,0,0,,,,,,0,0,0,0,0,0,,,,,
tinyllama,TinyLlama,1168,main_graph$async_dispatch_836_elementwise_131072_i8xf32,,1,,dequantize_i8_to_f32,dequantize_i8_to_f32,,0,0,0,,,,,,0,0,0,0,0,0,,,,,
tinyllama,TinyLlama,1169,main_graph$async_dispatch_837_elementwise_16384_i8xf32,,1,,dequantize_i8_to_f32,dequantize_i8_to_f32,,0,0,0,,,,,,0,0,0,0,0,0,,,,,
tinyllama,TinyLlama,1170,main_graph$async_dispatch_838_elementwise_32x128x32_f32,,1,,activation,activation,,0,0,0,,,,,,0,0,0,0,0,0,,,,,
tinyllama,TinyLlama,1171,main_graph$async_dispatch_839_elementwise_4x128x32_f32,,1,,activation,activation,,0,0,0,,,,,,0,0,0,0,0,0,,,,,
tinyllama,TinyLlama,1172,main_graph$async_dispatch_840_elementwise_broadcast_4x8x128x64_i32xi8,,1,,requantize_i32_to_i8,requantize_i32_to_i8,,0,0,0,,,,,,0,0,0,0,0,0,,,,,
tinyllama,TinyLlama,1173,main_graph$async_dispatch_845_elementwise_32768_f32xi8,,1,,quantize_f32_to_i8,quantize_f32_to_i8,,0,0,0,,,,,,0,0,0,0,0,0,,,,,
tinyllama,TinyLlama,1174,main_graph$async_dispatch_846_elementwise_transpose_32x128x64_f32xf32xf32xf32xi8,,1,,elementwise_multi_dtype,elementwise_multi_dtype,,0,0,0,,,,,,0,0,0,0,0,0,,,,,
tinyllama,TinyLlama,1175,main_graph$async_dispatch_847_elementwise_262144_i8xf32xi8,,1,,elementwise_other,elementwise_other,,0,0,0,,,,,,0,0,0,0,0,0,,,,,
tinyllama,TinyLlama,1176,main_graph$async_dispatch_848_elementwise_broadcast_4x8x128x64_f32xf32xi8xf32xf32xi8,,1,,elementwise_multi_dtype,elementwise_multi_dtype,,0,0,0,,,,,,0,0,0,0,0,0,,,,,
tinyllama,TinyLlama,1177,main_graph$async_dispatch_849_batch_matmul_32x128x128x64_i8xi8xi32,,1,,encoding_32x32_tile,encoding_32x32_tile,,0,0,0,,,,,,4,0,0,0,0,0,,,,,
tinyllama,TinyLlama,1178,main_graph$async_dispatch_851_batch_matmul_32x128x64x128_i8xi8xi32,,1,,encoding_32x32_tile,encoding_32x32_tile,,0,0,0,,,,,,4,0,0,0,0,0,,,,,
tinyllama,TinyLlama,1179,main_graph$async_dispatch_852_batch_matmul_1x128x2048x2048_i8xi8xi32,,1,,encoding_32x32_tile,encoding_32x32_tile,,0,0,0,,,,,,4,0,0,0,0,0,,,,,
tinyllama,TinyLlama,1180,main_graph$async_dispatch_853_elementwise_262144_i8xf32,,1,,dequantize_i8_to_f32,dequantize_i8_to_f32,,0,0,0,,,,,,0,0,0,0,0,0,,,,,
tinyllama,TinyLlama,1181,main_graph$async_dispatch_854_reduction_128x2048_f32,,1,,rvv_reduction_softmax_norm,rvv_reduction_softmax_norm,,0,0,0,,,,,,0,0,0,0,0,0,,,,,
tinyllama,TinyLlama,1182,main_graph$async_dispatch_855_elementwise_128_i8xf32xf32,,1,,elementwise_other,elementwise_other,,0,0,0,,,,,,0,0,0,0,0,0,,,,,
tinyllama,TinyLlama,1183,main_graph$async_dispatch_856_elementwise_128x2048_f32xf32xi8,,1,,elementwise_other,elementwise_other,,0,0,0,,,,,,0,0,0,0,0,0,,,,,
tinyllama,TinyLlama,1184,main_graph$async_dispatch_857_elementwise_128x2048_i8,,1,,activation,activation,,0,0,0,,,,,,0,0,0,0,0,0,,,,,
tinyllama,TinyLlama,1185,main_graph$async_dispatch_858_batch_matmul_1x128x5632x2048_i8xi8xi32,,1,,encoding_32x32_tile,encoding_32x32_tile,,0,0,0,,,,,,4,0,0,0,0,0,,,,,
tinyllama,TinyLlama,1186,main_graph$async_dispatch_859_batch_matmul_1x128x5632x2048_i8xi8xi32,,1,,encoding_32x32_tile,encoding_32x32_tile,,0,0,0,,,,,,4,0,0,0,0,0,,,,,
tinyllama,TinyLlama,1187,main_graph$async_dispatch_860_batch_matmul_1x128x2048x5632_i8xi8xi32,,1,,encoding_32x32_tile,encoding_32x32_tile,,0,0,0,,,,,,4,0,0,0,0,0,,,,,
tinyllama,TinyLlama,1188,main_graph$async_dispatch_861_reduction_128x2048_f32,,1,,rvv_reduction_softmax_norm,rvv_reduction_softmax_norm,,0,0,0,,,,,,0,0,0,0,0,0,,,,,
tinyllama,TinyLlama,1189,main_graph$async_dispatch_862_elementwise_128_i8xf32xf32,,1,,elementwise_other,elementwise_other,,0,0,0,,,,,,0,0,0,0,0,0,,,,,
tinyllama,TinyLlama,1190,main_graph$async_dispatch_863_elementwise_128x2048_f32xf32xi8,,1,,elementwise_other,elementwise_other,,0,0,0,,,,,,0,0,0,0,0,0,,,,,
tinyllama,TinyLlama,1191,main_graph$async_dispatch_864_elementwise_128x2048_i8,,1,,activation,activation,,0,0,0,,,,,,0,0,0,0,0,0,,,,,
tinyllama,TinyLlama,1192,main_graph$async_dispatch_865_batch_matmul_1x128x32000x2048_i8xi8xi32,,1,,encoding_32x32_tile,encoding_32x32_tile,,0,0,0,,,,,,4,0,0,0,0,0,,,,,
tinyllama,TinyLlama,1193,main_graph$async_dispatch_866_elementwise_4096000_i8xf32,,1,,dequantize_i8_to_f32,dequantize_i8_to_f32,,0,0,0,,,,,,0,0,0,0,0,0,,,,,
tinyllama,TinyLlama,1194,_encoding_5_encode_1x128x2048xi8_to_1x128x2048xi8,,1,,data_movement,data_movement,,0,0,0,,,,,,0,0,0,0,0,0,,,,,
tinyllama,TinyLlama,1195,_encoding_6_encode_128x128xi8_to_128x128xi8,,1,,data_movement,data_movement,,0,0,0,,,,,,0,0,0,0,0,0,,,,,
tinyllama,TinyLlama,1196,_encoding_7_encode_32x128x128xi8_to_32x128x128xi8,,1,,data_movement,data_movement,,0,0,0,,,,,,0,0,0,0,0,0,,,,,
